set testdir [file dirname $argv0]
source $testdir/tester.tcl

set testprefix doltlite_recover_misc7


do_execsql_test 1.0 {
  CREATE TABLE rt(a, b, c);
  INSERT INTO rt VALUES(1, 2, 3);
}
do_test 1.1 {
  register_echo_module [sqlite3_connection_pointer db]
  execsql {
    CREATE VIRTUAL TABLE t1 USING echo(rt);
    SELECT a FROM t1 WHERE a = 1 ORDER BY b;
  }
} {1}
do_catchsql_test 1.2 {
  INSERT INTO t1(a,b,c) VALUES(12345,2,3) ON CONFLICT(a) DO NOTHING;
} {1 {UPSERT not implemented for virtual table "t1"}}
do_test 1.3 {
  execsql {
    SELECT t1.a, t2.a FROM t1, t1 AS t2 ORDER BY 2 LIMIT 1;
  }
} {1 1}
do_test 1.5 {
  set ::echo_module_cost 2.0e+99
  set res [execsql {SELECT * FROM t1 WHERE a = 1}]
  unset ::echo_module_cost
  set res
} {1 2 3}
do_test 1.6 {
  execsql {
    CREATE TABLE pkt(a PRIMARY KEY, b, c);
    INSERT INTO pkt VALUES(1, 2, 3);
    CREATE VIRTUAL TABLE t2 USING echo(pkt);
  }
  catchsql { SELECT a FROM t2 WHERE a = 1 }
} {0 1}

do_ioerr_test 2 -tclprep {
  sqlite3 db2 test.db
  register_echo_module [sqlite3_connection_pointer db2]
  db2 eval {
    CREATE TABLE rt(a, b, c);
    INSERT INTO rt VALUES(1, 2, 3);
    CREATE VIRTUAL TABLE t1 USING echo(rt);
  }
  db2 close
} -tclbody {
  register_echo_module [sqlite3_connection_pointer db]
  execsql {SELECT * FROM t1 WHERE a = 1;}
}

do_execsql_test 3.0 {
  CREATE TABLE abc(a PRIMARY KEY, b, c);
}
do_execsql_test 3.1 {
  SELECT * FROM abc AS t2 WHERE rowid = 1;
} {}
do_eqp_test 3.2 {
  SELECT * FROM abc AS t2 WHERE a = 1;
} {
  QUERY PLAN
  `--SEARCH t2 USING INDEX sqlite_autoindex_abc_1 (a=?)
}
do_eqp_test 3.3 {
  SELECT * FROM abc AS t2 ORDER BY a;
} {
  QUERY PLAN
  `--SCAN t2
}

db close
forcedelete test.db
sqlite3 db test.db
do_test 4.1 {
  execsql {
    PRAGMA cache_size = 10;
    BEGIN;
    CREATE TABLE abc2(a, b, c);
    INSERT INTO abc2
    VALUES(randstr(100,100), randstr(100,100), randstr(100,100));
    INSERT INTO abc2 SELECT
            randstr(100,100), randstr(100,100), randstr(100,100) FROM abc2;
    INSERT INTO abc2 SELECT
            randstr(100,100), randstr(100,100), randstr(100,100) FROM abc2;
    INSERT INTO abc2 SELECT
            randstr(100,100), randstr(100,100), randstr(100,100) FROM abc2;
    INSERT INTO abc2 SELECT
            randstr(100,100), randstr(100,100), randstr(100,100) FROM abc2;
    INSERT INTO abc2 SELECT
            randstr(100,100), randstr(100,100), randstr(100,100) FROM abc2;
    INSERT INTO abc2 SELECT
            randstr(100,100), randstr(100,100), randstr(100,100) FROM abc2;
    INSERT INTO abc2 SELECT
            randstr(100,100), randstr(100,100), randstr(100,100) FROM abc2;
    INSERT INTO abc2 SELECT
            randstr(100,100), randstr(100,100), randstr(100,100) FROM abc2;
    COMMIT;
  }
  expr {[file size test.db]>10240}
} {1}
do_test 4.2 {
  execsql {
    DELETE FROM abc2 WHERE rowid > 12;
    INSERT INTO abc2 SELECT
            randstr(100,100), randstr(100,100), randstr(100,100) FROM abc2;
    SELECT count(*) FROM abc2;
  }
} {24}

db close
forcedelete test.db
sqlite3 db test.db

do_ioerr_test 5 -sqlprep {
   PRAGMA cache_size = 10;
   CREATE TABLE t3(a, b, UNIQUE(a, b));
   INSERT INTO t3 VALUES( randstr(100, 100), randstr(100, 100) );
   INSERT INTO t3 SELECT randstr(100, 100), randstr(100, 100) FROM t3;
   INSERT INTO t3 SELECT randstr(100, 100), randstr(100, 100) FROM t3;
   INSERT INTO t3 SELECT randstr(100, 100), randstr(100, 100) FROM t3;
   INSERT INTO t3 SELECT randstr(100, 100), randstr(100, 100) FROM t3;
   INSERT INTO t3 SELECT randstr(100, 100), randstr(100, 100) FROM t3;
   UPDATE t3
   SET b = 'hello world'
   WHERE rowid >= (SELECT max(rowid)-1 FROM t3);
} -tclbody {
  set rc [catch {db eval {
    BEGIN;
      PRAGMA cache_size = 10;
      INSERT INTO t3 VALUES( randstr(100, 100), randstr(100, 100) );
      UPDATE t3 SET a = b;
    COMMIT;
  }} msg]

  if {!$rc || ($rc && [string first "UNIQUE" $msg]==0)} {
    set msg
  } else {
    error $msg
  }
}

sqlite3 db test.db
do_test 5.X {
  execsql {
    SELECT count(*) FROM t3;
  }
} {32}

reset_db
do_test 6.1 {
  execsql {
    CREATE TABLE table_1 (col_10);
    CREATE TABLE table_2 (
      col_1, col_2, col_3, col_4, col_5,
      col_6, col_7, col_8, col_9, col_10
    );
    SELECT a.col_10
    FROM
      (SELECT table_1.col_10 AS col_10 FROM table_1) a,
      (SELECT table_1.col_10, table_2.col_9 AS qcol_9
         FROM table_1, table_2
        GROUP BY table_1.col_10, qcol_9);
  }
} {}

do_test 7.1 {
  sqlite3_status -1 0
} {21 0 0}
do_test 7.2 {
  sqlite3_status 1000 0
} {21 0 0}
do_test 7.3 {
  sqlite3_global_recover
} {SQLITE_OK}
do_test 7.4 {
  set zFile [file join [get_pwd] "[string repeat abcde 104].db"]
  set rc [catch {sqlite3 db2 $zFile} msg]
  list $rc $msg
} {1 {unable to open database file}}

do_test 8.1 {
  db close
  forcedelete test.db test.db-journal
  sqlite3 db test.db
  execsql {
    CREATE TABLE t1(a, b);
    INSERT INTO t1 VALUES(1, 2);
    INSERT INTO t1 VALUES(3, 4);
  }
  db close
  sqlite3 db test.db -readonly 1
  catchsql {
    INSERT INTO t1 VALUES(5, 6);
  }
} {1 {attempt to write a readonly database}}
do_test 8.2 { execsql { SELECT * FROM t1 } } {1 2 3 4}
do_test 8.3 {
  set fd [open test.db-journal w]
  puts $fd [string repeat abc 1000]
  close $fd
  catchsql { SELECT * FROM t1 }
} {0 {1 2 3 4}}
catch { db close }
forcedelete test.db test.db-journal

if {$::tcl_platform(platform) eq "unix"} {
  reset_db
  do_execsql_test 9.0 {
    CREATE TABLE t1(x, y);
    INSERT INTO t1 VALUES(1, 2);
  }
  do_test 9.1 {
    db close
    forcedelete tst
    file mkdir tst
    forcecopy test.db tst/test.db
    file attributes tst -permissions r-xr-xr-x
  } {}
  sqlite3 db tst/test.db
  do_execsql_test 9.2 {
    SELECT * FROM t1;
  } {1 2}
  # Stock misc7-23.3: RO parent dir → SQLITE_READONLY_DIRECTORY /
  # "attempt to write a readonly database" (graph-lock sidecar create,
  # same as stock journal/WAL create in a non-writable directory).
  do_catchsql_test 9.3 {
    INSERT INTO t1 VALUES(3, 4);
  } {1 {attempt to write a readonly database}}
  do_test 9.4 {
    db close
    sqlite3 db tst/test.db
    execsql { SELECT * FROM t1 ORDER BY x }
  } {1 2}
  do_test 9.5 {
    db close
    file attributes tst -permissions rwxr-xr-x
    forcedelete tst
  } {}
}

finish_test
