set testdir [file dirname $argv0]
source $testdir/tester.tcl
database_may_be_corrupt


proc xorByte {file off} {
  set f [open $file r+]
  fconfigure $f -translation binary
  seek $f $off
  binary scan [read $f 1] cu v
  seek $f $off
  puts -nonewline $f [binary format c [expr {$v ^ 0xff}]]
  close $f
}
proc rdU32 {file off} {
  set f [open $file rb]; seek $f $off; set d [read $f 4]; close $f
  binary scan $d iu v
  return $v
}
proc rdI64 {file off} {
  set f [open $file rb]; seek $f $off; set d [read $f 8]; close $f
  binary scan $d wu v
  return $v
}
proc openCorrupt {file} {
  if {[catch {sqlite3 dbc $file} msg]} { return $msg }
  catch {dbc close}
  return opened
}
proc csDetect {off {src rch2.db}} {
  forcedelete rcor.db
  file copy -force $src rcor.db
  xorByte rcor.db $off
  if {[catch {sqlite3 dbc rcor.db}]} { return detected }
  set rc [catch {dbc eval {SELECT count(*) FROM t1}} cnt]
  if {$rc} { catch {dbc close}; return detected }
  set rc2 [catch {dbc eval {PRAGMA integrity_check}} ic]
  catch {dbc close}
  if {$rc2 || $ic ne "ok"} { return detected }
  return "SILENT count=$cnt ic=$ic"
}

forcedelete rch1.db rch2.db rcor.db

do_test doltlite_recover_corruption-1.1 {
  execsql {
    CREATE TABLE t1(a INTEGER PRIMARY KEY, b TEXT);
    INSERT INTO t1 VALUES(1,'one'),(2,'two'),(3,'three');
    INSERT INTO t1 SELECT a+3, b||'x' FROM t1;
    INSERT INTO t1 SELECT a+6, b||'y' FROM t1;
    INSERT INTO t1 SELECT a+12, b||'z' FROM t1;
    CREATE INDEX i1 ON t1(b);
    CREATE TABLE tw1(a PRIMARY KEY) WITHOUT ROWID;
    INSERT INTO tw1 VALUES('B');
  }
  db close
  file copy -force test.db rch1.db
  sqlite3 dbc rch1.db
  set res [list [dbc eval {SELECT count(*) FROM t1}] \
                [dbc eval {PRAGMA integrity_check}]]
  dbc close
  set res
} {24 ok}

do_test doltlite_recover_corruption-1.2 {
  file copy -force rch1.db rcor.db
  xorByte rcor.db 0
  openCorrupt rcor.db
} {file is not a database}

do_test doltlite_recover_corruption-1.3 {
  file copy -force rch1.db rcor.db
  xorByte rcor.db 3
  openCorrupt rcor.db
} {file is not a database}

do_test doltlite_recover_corruption-1.4 {
  file copy -force rch1.db rcor.db
  xorByte rcor.db 4
  openCorrupt rcor.db
} {file is not a database}

do_test doltlite_recover_corruption-1.5 {
  file copy -force rch1.db rcor.db
  xorByte rcor.db 40
  openCorrupt rcor.db
} {database disk image is malformed}

do_test doltlite_recover_corruption-1.6 {
  forcedelete rcor.db
  file copy -force rch1.db rcor.db
  sqlite3 dbc rcor.db
  set res [list [dbc eval {SELECT count(*) FROM t1}] \
                [dbc eval {PRAGMA integrity_check}]]
  dbc close
  set res
} {24 ok}

do_test doltlite_recover_corruption-1.7 {
  set ::ncSz [file size rch1.db]
  csDetect 169 rch1.db
} {detected}

do_test doltlite_recover_corruption-1.8 {
  csDetect 201 rch1.db
} {detected}

do_test doltlite_recover_corruption-1.9 {
  csDetect [expr {168 + ($::ncSz - 168)/2}] rch1.db
} {detected}

do_test doltlite_recover_corruption-1.10 {
  forcedelete rcor.db
  file copy -force rch1.db rcor.db
  set f [open rcor.db r+]
  chan truncate $f [expr {$::ncSz - 40}]
  close $f
  sqlite3 dbc rcor.db
  set res [list [dbc eval {SELECT count(*) FROM t1}] \
                [dbc eval {SELECT count(*) FROM tw1}] \
                [dbc eval {PRAGMA integrity_check}]]
  dbc close
  set res
} {24 0 ok}

do_test doltlite_recover_corruption-1.11 {
  forcedelete rcor.db
  file copy -force rch1.db rcor.db
  set f [open rcor.db a]
  fconfigure $f -translation binary
  puts -nonewline $f [binary format c 1][string repeat A 36]
  close $f
  sqlite3 dbc rcor.db
  set res [list [dbc eval {SELECT count(*) FROM t1}] \
                [dbc eval {SELECT count(*) FROM tw1}] \
                [dbc eval {PRAGMA integrity_check}]]
  dbc close
  set res
} {24 1 ok}

do_test doltlite_recover_corruption-2.1 {
  sqlite3 db test.db
  db eval {SELECT dolt_commit('-A','-m','c1')}
  db eval {SELECT dolt_gc()}
  db close
  file copy -force test.db rch2.db
  sqlite3 dbc rch2.db
  set res [list [dbc eval {SELECT count(*) FROM t1}] \
                [dbc eval {PRAGMA integrity_check}] \
                [dbc eval {SELECT count(*) FROM dolt_log}]]
  dbc close
  set res
} {24 ok 2}

do_test doltlite_recover_corruption-2.2 {
  set ::csSz [file size rch2.db]
  set ::csCc [rdU32 rch2.db 28]
  set ::csIo [rdI64 rch2.db 32]
  set ::csIs [rdI64 rch2.db 40]
  list [expr {$::csCc > 0}] \
       [expr {$::csIo > 168}] \
       [expr {$::csIs == $::csCc * 32}] \
       [expr {$::csIo + $::csIs <= $::csSz}]
} {1 1 1 1}

do_test doltlite_recover_corruption-2.3 {
  csDetect 178
} {detected}

do_test doltlite_recover_corruption-2.4 {
  csDetect [expr {168 + ($::csIo - 168)/4}]
} {detected}

do_test doltlite_recover_corruption-2.5 {
  csDetect [expr {168 + ($::csIo - 168)/2}]
} {detected}

do_test doltlite_recover_corruption-2.6 {
  csDetect [expr {168 + 3*($::csIo - 168)/4}]
} {detected}

do_test doltlite_recover_corruption-2.7 {
  csDetect [expr {$::csIo + 3}]
} {detected}

do_test doltlite_recover_corruption-2.8 {
  csDetect [expr {$::csIo + $::csIs/2}]
} {detected}

do_test doltlite_recover_corruption-2.9 {
  csDetect [expr {$::csIo + $::csIs - 1}]
} {detected}

do_test doltlite_recover_corruption-2.10 {
  csDetect [expr {$::csSz - 1}]
} {detected}

do_test doltlite_recover_corruption-2.11 {
  file copy -force rch2.db rcor.db
  set f [open rcor.db r+]
  chan truncate $f [expr {$::csSz - 40}]
  close $f
  openCorrupt rcor.db
} {database disk image is malformed}

do_test doltlite_recover_corruption-2.12 {
  file copy -force rch2.db rcor.db
  set f [open rcor.db r+]
  chan truncate $f 100
  close $f
  openCorrupt rcor.db
} {disk I/O error}

do_test doltlite_recover_corruption-2.13 {
  file copy -force rch2.db rcor.db
  set f [open rcor.db a]
  fconfigure $f -translation binary
  puts -nonewline $f "GARBAGEGARBAGE"
  close $f
  openCorrupt rcor.db
} {database disk image is malformed}

do_test doltlite_recover_corruption-2.14 {
  forcedelete rcor.db
  set f [open rcor.db w]
  puts -nonewline $f [string repeat "Not a doltlite chunk store. " 10]
  close $f
  openCorrupt rcor.db
} {file is not a database}

do_test doltlite_recover_corruption-2.15 {
  forcedelete rcor.db
  set f [open rcor.db w]
  close $f
  sqlite3 dbc rcor.db
  set res [list [dbc eval {SELECT count(*) FROM sqlite_schema}]]
  dbc eval {CREATE TABLE z(q); INSERT INTO z VALUES(5)}
  lappend res [dbc eval {SELECT q FROM z}] [dbc eval {PRAGMA integrity_check}]
  dbc close
  set res
} {0 5 ok}

do_test doltlite_recover_corruption-2.16 {
  forcedelete rcor.db
  file copy -force rch2.db rcor.db
  sqlite3 dbc rcor.db
  set res [list [dbc eval {SELECT count(*) FROM t1}] \
                [dbc eval {SELECT b FROM t1 ORDER BY a LIMIT 3}] \
                [dbc eval {PRAGMA integrity_check}]]
  dbc close
  set res
} {24 {one two three} ok}

sqlite3 db test.db

do_execsql_test doltlite_recover_corruption-3.1 {
  SELECT pgno, quote(substr(data,1,5)) FROM sqlite_dbpage;
} {1 X'53514C6974'}

do_execsql_test doltlite_recover_corruption-3.2 {
  SELECT length(data), hex(substr(data,17,2)) FROM sqlite_dbpage WHERE pgno=1;
} {4096 1000}

do_catchsql_test doltlite_recover_corruption-3.3 {
  SELECT pgno FROM sqlite_dbpage WHERE pgno=2;
} {1 {doltlite: sqlite_dbpage only supports pgno=1 (content-addressed chunk store has no page layout)}}

do_catchsql_test doltlite_recover_corruption-3.4 {
  SELECT pgno FROM sqlite_dbpage WHERE pgno=0;
} {1 {doltlite: sqlite_dbpage only supports pgno=1 (content-addressed chunk store has no page layout)}}

do_catchsql_test doltlite_recover_corruption-3.5 {
  UPDATE sqlite_dbpage SET data=zeroblob(4096) WHERE pgno=1;
} {1 {table sqlite_dbpage may not be modified}}

do_catchsql_test doltlite_recover_corruption-3.6 {
  INSERT INTO sqlite_dbpage VALUES(2, zeroblob(4096));
} {1 {table sqlite_dbpage may not be modified}}

do_execsql_test doltlite_recover_corruption-3.7 {
  SELECT count(*) FROM t1;
  PRAGMA integrity_check;
} {24 ok}

do_execsql_test doltlite_recover_corruption-3.8 {
  SELECT pgno FROM sqlite_dbpage WHERE schema='main';
} {1}

do_execsql_test doltlite_recover_corruption-4.1 {
  PRAGMA mmap_size=1000000;
  SELECT a FROM tw1;
  INSERT INTO tw1 VALUES('C');
  SELECT a FROM tw1 ORDER BY a;
  PRAGMA integrity_check;
} {0 B B C ok}

forcedelete rch1.db rch2.db rcor.db

finish_test
