set testdir [file dirname $argv0]
source $testdir/tester.tcl


do_execsql_test doltlite_recover_jrnlwal_4-1.1 {
  PRAGMA journal_mode;
  PRAGMA main.journal_mode;
} {wal wal}
do_execsql_test doltlite_recover_jrnlwal_4-1.2 {
  PRAGMA temp.journal_mode;
} {delete}
foreach {n mode} {3 delete 4 persist 5 truncate 6 memory 7 off} {
  do_test doltlite_recover_jrnlwal_4-1.$n {
    catchsql "PRAGMA journal_mode = $mode"
  } [list 0 wal]
}
do_execsql_test doltlite_recover_jrnlwal_4-1.8 {
  PRAGMA journal_mode = wal;
} {wal}
do_catchsql_test doltlite_recover_jrnlwal_4-1.9 {
  PRAGMA journal_mode = invalid;
} {0 wal}
do_test doltlite_recover_jrnlwal_4-1.10 {
  sqlite3_db_config db DEFENSIVE 1
  set r [catchsql {PRAGMA main.journal_mode = off}]
  sqlite3_db_config db DEFENSIVE 0
  set r
} {0 wal}
do_execsql_test doltlite_recover_jrnlwal_4-1.11 {
  PRAGMA temp.journal_mode;
  PRAGMA temp.journal_mode = persist;
  PRAGMA temp.journal_mode = delete;
  PRAGMA temp.journal_mode = wal;
} {off persist delete delete}
do_test doltlite_recover_jrnlwal_4-1.12 {
  db close
  sqlite3 db test.db
  execsql { PRAGMA journal_mode }
} {wal}
do_test doltlite_recover_jrnlwal_4-1.13 {
  db close
  sqlite3 db test.db
  execsql { PRAGMA main.journal_mode }
} {wal}

do_execsql_test doltlite_recover_jrnlwal_4-2.1 {
  PRAGMA locking_mode = EXCLUSIVE;
  CREATE TABLE t1(x INTEGER PRIMARY KEY);
  INSERT INTO t1 VALUES(1);
  SELECT * FROM t1;
} {exclusive 1}
do_execsql_test doltlite_recover_jrnlwal_4-2.2 {
  BEGIN;
  INSERT INTO t1 VALUES(2);
  ROLLBACK;
  SELECT * FROM t1;
} {1}
do_test doltlite_recover_jrnlwal_4-2.3 {
  execsql { BEGIN; INSERT INTO t1 VALUES(3); }
  set r [catchsql {PRAGMA journal_mode = delete}]
  lappend r [execsql {PRAGMA main.journal_mode}]
} [list 0 wal wal]
do_execsql_test doltlite_recover_jrnlwal_4-2.4 {
  ROLLBACK;
  SELECT * FROM t1;
} {1}
do_execsql_test doltlite_recover_jrnlwal_4-2.5 {
  PRAGMA journal_mode = wal;
  BEGIN;
  INSERT INTO t1 VALUES(9);
  ROLLBACK;
  SELECT * FROM t1;
} {wal 1}
do_execsql_test doltlite_recover_jrnlwal_4-2.6 {
  PRAGMA locking_mode = NORMAL;
} {normal}
do_test doltlite_recover_jrnlwal_4-2.7 {
  execsql { BEGIN IMMEDIATE; INSERT INTO t1 VALUES(4); }
  set r [catchsql {PRAGMA journal_mode = delete}]
  execsql { COMMIT }
  lappend r [execsql {SELECT x FROM t1 ORDER BY x}]
} [list 0 wal {1 4}]
do_execsql_test doltlite_recover_jrnlwal_4-2.8 {
  PRAGMA integrity_check;
} {ok}

do_test doltlite_recover_jrnlwal_4-3.1 {
  execsql { BEGIN; UPDATE t1 SET x=x+100 WHERE 1; }
  list [file exists test.db-journal] [file exists test.db-wal] \
       [file exists test.db-shm]
} {0 0 0}
do_test doltlite_recover_jrnlwal_4-3.2 {
  execsql { COMMIT }
  list [file exists test.db-journal] [file exists test.db-wal] \
       [file exists test.db-shm]
} {0 0 0}
do_execsql_test doltlite_recover_jrnlwal_4-3.3 {
  SELECT x FROM t1 ORDER BY x;
} {101 104}

do_test doltlite_recover_jrnlwal_4-4.1 {
  sqlite3 db2 test.db
  execsql { BEGIN; INSERT INTO t1 VALUES(7); }
  execsql { SELECT x FROM t1 ORDER BY x } db2
} {101 104}
do_test doltlite_recover_jrnlwal_4-4.2 {
  set r [catchsql { BEGIN; INSERT INTO t1 VALUES(8); } db2]
  catchsql { ROLLBACK } db2
  set r
} {1 {database is locked}}
do_test doltlite_recover_jrnlwal_4-4.3 {
  execsql { COMMIT }
  execsql { SELECT x FROM t1 ORDER BY x } db2
} {7 101 104}
do_test doltlite_recover_jrnlwal_4-4.4 {
  execsql { BEGIN EXCLUSIVE } db2
  catchsql { INSERT INTO t1 VALUES(9) }
} {1 {database is locked}}
do_test doltlite_recover_jrnlwal_4-4.5 {
  execsql { SELECT x FROM t1 ORDER BY x }
} {7 101 104}
do_test doltlite_recover_jrnlwal_4-4.6 {
  execsql { INSERT INTO t1 VALUES(10); COMMIT; } db2
  execsql { SELECT x FROM t1 ORDER BY x }
} {7 10 101 104}
do_test doltlite_recover_jrnlwal_4-4.7 {
  execsql { BEGIN; CREATE TABLE z9(q); }
  set r [execsql {SELECT count(*) FROM sqlite_master WHERE name='z9'} db2]
  execsql { ROLLBACK }
  set r
} {0}
do_test doltlite_recover_jrnlwal_4-4.8 {
  db2 close
  sqlite3 db2 test.db -readonly 1
  execsql { SELECT x FROM t1 ORDER BY x } db2
} {7 10 101 104}
do_test doltlite_recover_jrnlwal_4-4.9 {
  set r [catchsql { INSERT INTO t1 VALUES(11) } db2]
  db2 close
  set r
} {1 {attempt to write a readonly database}}

do_execsql_test doltlite_recover_jrnlwal_4-5.1 {
  PRAGMA wal_checkpoint;
} {0 0 0}
do_execsql_test doltlite_recover_jrnlwal_4-5.2 {
  PRAGMA wal_checkpoint = passive;
} {0 0 0}
foreach {n ckmode} {3 noop 4 full 5 truncate} {
  do_test doltlite_recover_jrnlwal_4-5.$n {
    catchsql "PRAGMA wal_checkpoint = $ckmode"
  } [list 0 {0 0 0}]
}
do_test doltlite_recover_jrnlwal_4-5.6 {
  sqlite3_wal_checkpoint_v2 db noop
} {0 0 0}
do_test doltlite_recover_jrnlwal_4-5.7 {
  sqlite3 db2 test.db
  execsql { BEGIN; SELECT count(*) FROM t1; } db2
  set r [execsql {PRAGMA wal_checkpoint}]
  execsql { COMMIT } db2
  db2 close
  set r
} {0 0 0}
do_execsql_test doltlite_recover_jrnlwal_4-5.8 {
  PRAGMA wal_autocheckpoint = 100;
  PRAGMA wal_autocheckpoint;
  PRAGMA wal_autocheckpoint = 1000;
} {100 100 1000}
do_test doltlite_recover_jrnlwal_4-5.9 {
  execsql { BEGIN; INSERT INTO t1 VALUES(12); }
  set r [execsql {PRAGMA wal_checkpoint}]
  execsql { ROLLBACK }
  set r
} {0 0 0}

do_execsql_test doltlite_recover_jrnlwal_4-6.1 {
  PRAGMA journal_size_limit;
} {-1}
do_execsql_test doltlite_recover_jrnlwal_4-6.2 {
  PRAGMA journal_size_limit = 10240;
} {-1}
do_execsql_test doltlite_recover_jrnlwal_4-6.3 {
  PRAGMA main.journal_size_limit = 20480;
  PRAGMA journal_size_limit;
} {-1 -1}

do_test doltlite_recover_jrnlwal_4-7.1 {
  forcedelete test2.db
  execsql {
    ATTACH 'test2.db' AS two;
    CREATE TABLE two.t2(c, d);
    PRAGMA two.journal_mode;
  }
} {wal}
do_test doltlite_recover_jrnlwal_4-7.2 {
  catchsql {PRAGMA two.journal_mode = delete}
} [list 0 wal]
do_execsql_test doltlite_recover_jrnlwal_4-7.3 {
  PRAGMA two.journal_size_limit = 10240;
} {-1}
do_catchsql_test doltlite_recover_jrnlwal_4-7.4 {
  BEGIN;
  INSERT INTO t1 VALUES(20);
  INSERT INTO two.t2 VALUES(1, 2);
  COMMIT;
} {1 {atomic commit across multiple file-backed databases is not supported}}
do_execsql_test doltlite_recover_jrnlwal_4-7.4a {
  SELECT count(*) FROM t1 WHERE x=20;
  SELECT count(*) FROM two.t2;
} {0 0}
do_execsql_test doltlite_recover_jrnlwal_4-7.4b {
  INSERT INTO t1 VALUES(20);
  INSERT INTO two.t2 VALUES(1, 2);
} {}
do_test doltlite_recover_jrnlwal_4-7.4c {
  glob -nocomplain test.db*mj*
} {}
do_execsql_test doltlite_recover_jrnlwal_4-7.5 {
  BEGIN;
  INSERT OR IGNORE INTO two.t2 SELECT x, x FROM t1;
  COMMIT;
  SELECT count(*) FROM two.t2;
} {6}
do_test doltlite_recover_jrnlwal_4-7.6 {
  execsql { ATTACH ':memory:' AS aux1 }
  list [execsql {PRAGMA aux1.journal_mode}] \
       [execsql {PRAGMA aux1.journal_mode = delete}]
} {memory memory}
do_test doltlite_recover_jrnlwal_4-7.7 {
  execsql { DETACH aux1; DETACH two; }
} {}
do_test doltlite_recover_jrnlwal_4-7.8 {
  db close
  sqlite3 db test.db
  execsql {
    ATTACH 'test2.db' AS two;
    SELECT count(*) FROM two.t2;
    PRAGMA two.integrity_check;
  }
} {6 ok}
do_test doltlite_recover_jrnlwal_4-7.9 {
  execsql { DETACH two }
} {}

do_test doltlite_recover_jrnlwal_4-8.1 {
  sqlite3 db3 :memory:
  list [execsql {PRAGMA main.journal_mode} db3] \
       [catchsql {PRAGMA main.journal_mode = wal} db3] \
       [catchsql {PRAGMA main.journal_mode = delete} db3]
} [list memory {0 memory} {0 memory}]
do_test doltlite_recover_jrnlwal_4-8.2 {
  execsql {
    CREATE TABLE m(x);
    INSERT INTO m VALUES(1);
    SELECT * FROM m;
    PRAGMA main.journal_mode;
  } db3
} {1 memory}
do_test doltlite_recover_jrnlwal_4-8.3 {
  db3 close
  sqlite3 db3 ""
  execsql {
    PRAGMA main.journal_mode;
    PRAGMA main.journal_mode = wal;
  } db3
} {delete delete}
do_test doltlite_recover_jrnlwal_4-8.4 {
  set r [execsql {
    CREATE TABLE m(x);
    INSERT INTO m VALUES(2);
    SELECT * FROM m;
  } db3]
  db3 close
  set r
} {2}
do_execsql_test doltlite_recover_jrnlwal_4-8.5 {
  CREATE TEMP TABLE tt(x);
  BEGIN;
  INSERT INTO tt VALUES(5);
  COMMIT;
  SELECT * FROM tt;
} {5}

do_test doltlite_recover_jrnlwal_4-9.1 {
  execsql {
    CREATE TABLE t3(i INTEGER PRIMARY KEY, x TEXT);
    WITH s(i) AS (SELECT 1 UNION ALL SELECT i+1 FROM s WHERE i<64)
      INSERT INTO t3 SELECT i, printf('row-%04d-%s', i, hex(zeroblob(40))) FROM s;
  }
  set ::sig [execsql {SELECT count(*), md5sum(x) FROM t3}]
  lindex $::sig 0
} {64}
do_execsql_test doltlite_recover_jrnlwal_4-9.2 {
  PRAGMA fullfsync = ON;
  PRAGMA fullfsync;
} {1}
do_test doltlite_recover_jrnlwal_4-9.3 {
  execsql {
    BEGIN;
    DELETE FROM t3 WHERE i%10!=0;
    INSERT INTO t3 SELECT i+1000, 'x'||x FROM t3;
    ROLLBACK;
  }
  expr {[execsql {SELECT count(*), md5sum(x) FROM t3}] eq $::sig}
} {1}
do_test doltlite_recover_jrnlwal_4-9.4 {
  execsql { PRAGMA fullfsync = OFF }
  set ::sqlite_sync_count 0
  set ::sqlite_fullsync_count 0
  execsql {
    INSERT INTO t3 VALUES(2000, 'sync-probe');
    DELETE FROM t3 WHERE i=2000;
  }
  list [expr {$::sqlite_sync_count > 0}] $::sqlite_fullsync_count \
       [expr {[execsql {SELECT count(*), md5sum(x) FROM t3}] eq $::sig}]
} {1 0 1}
do_test doltlite_recover_jrnlwal_4-9.5 {
  db close
  sqlite3 db test.db
  list [expr {[execsql {SELECT count(*), md5sum(x) FROM t3}] eq $::sig}] \
       [execsql {PRAGMA integrity_check}]
} {1 ok}

do_execsql_test doltlite_recover_jrnlwal_4-10.1 {
  PRAGMA main.cache_size = 10;
  PRAGMA main.cache_size;
} {10}
do_test doltlite_recover_jrnlwal_4-10.2 {
  sqlite3 db2 test.db
  set r [list [execsql {PRAGMA main.cache_size}] \
              [execsql {PRAGMA main.cache_size} db2] \
              [execsql {SELECT count(*) FROM t1} db2]]
  db2 close
  set r
} {10 -2000 5}
do_execsql_test doltlite_recover_jrnlwal_4-10.3 {
  CREATE TABLE drops(x);
  DROP TABLE drops;
  PRAGMA freelist_count;
} {0}
do_test doltlite_recover_jrnlwal_4-10.4 {
  list [execsql {PRAGMA auto_vacuum}] \
       [catchsql {PRAGMA auto_vacuum = 1}] \
       [catchsql {PRAGMA auto_vacuum = 2}] \
       [execsql {PRAGMA auto_vacuum}]
} {0 {0 {}} {0 {}} 0}
do_test doltlite_recover_jrnlwal_4-10.5 {
  list [catchsql {PRAGMA incremental_vacuum}] \
       [execsql {SELECT count(*) FROM t1}]
} {{0 {}} 5}
do_execsql_test doltlite_recover_jrnlwal_4-10.6 {
  PRAGMA cache_size = 1;
  CREATE TABLE abc(a, b, c);
  INSERT INTO abc VALUES(1, 2, zeroblob(2000));
  DELETE FROM abc;
  SELECT count(*) FROM abc;
} {0}
do_execsql_test doltlite_recover_jrnlwal_4-10.7 {
  PRAGMA user_version = 5;
  PRAGMA user_version;
} {5}
do_execsql_test doltlite_recover_jrnlwal_4-10.8 {
  PRAGMA lock_status;
} {main unlocked temp unknown}

do_test doltlite_recover_jrnlwal_4-11.1 {
  set ::h1 [execsql {SELECT dolt_hashof_table('t1')}]
  db close
  sqlite3 db test.db
  list [expr {[execsql {SELECT dolt_hashof_table('t1')}] eq $::h1}] \
       [execsql {SELECT x FROM t1 ORDER BY x}]
} {1 {7 10 20 101 104}}
do_execsql_test doltlite_recover_jrnlwal_4-11.2 {
  PRAGMA journal_mode;
  PRAGMA integrity_check;
} {wal ok}

finish_test
