set testdir [file dirname $argv0]
source $testdir/tester.tcl

# Recovered coverage for shard jrnlwal_4 (#1313): journal/WAL pragma and
# durability divergences. Each gated upstream assertion below is re-asserted
# as the doltlite-native contract; (n.m) references point at the do_test
# numbers in this file.
#
# covers: jrnlmode3 jrnlmode3-1.1 — locking_mode=exclusive echo + journal_mode=off rejected, mode fixed at wal (1.7,2.1)
# covers: jrnlmode3 jrnlmode3-1.2 — ROLLBACK restores rows under exclusive locking (2.2)
# covers: jrnlmode3 jrnlmode3-2.1 — locking_mode=exclusive echo + journal_mode=off rejected, mode fixed at wal (1.7,2.1)
# covers: jrnlmode3 jrnlmode3-2.2 — ROLLBACK restores rows under exclusive locking (2.2)
# covers: jrnlmode3 jrnlmode3-3.1.1-(delete-to-persist) — per-mode journal_mode setter rejected with exact error, reported mode stays wal (1.3-1.8,1.1)
# covers: jrnlmode3 jrnlmode3-3.1.2 — main.journal_mode reports wal after rejected set (1.1,2.3)
# covers: jrnlmode3 jrnlmode3-3.1.3 — in-transaction journal_mode change rejected, mode unchanged (2.3)
# covers: jrnlmode3 jrnlmode3-3.1.5 — setter still rejected after rollback; rollback integrity holds (2.4,2.5)
# covers: jrnlmode3 jrnlmode3-3.2.1-(delete-to-truncate) — per-mode journal_mode setter rejected with exact error, reported mode stays wal (1.3-1.8,1.1)
# covers: jrnlmode3 jrnlmode3-3.2.2 — main.journal_mode reports wal after rejected set (1.1,2.3)
# covers: jrnlmode3 jrnlmode3-3.2.3 — in-transaction journal_mode change rejected, mode unchanged (2.3)
# covers: jrnlmode3 jrnlmode3-3.2.5 — setter still rejected after rollback; rollback integrity holds (2.4,2.5)
# covers: jrnlmode3 jrnlmode3-3.3.1-(delete-to-memory) — per-mode journal_mode setter rejected with exact error, reported mode stays wal (1.3-1.8,1.1)
# covers: jrnlmode3 jrnlmode3-3.3.2 — main.journal_mode reports wal after rejected set (1.1,2.3)
# covers: jrnlmode3 jrnlmode3-3.3.3 — in-transaction journal_mode change rejected, mode unchanged (2.3)
# covers: jrnlmode3 jrnlmode3-3.3.5 — setter still rejected after rollback; rollback integrity holds (2.4,2.5)
# covers: jrnlmode3 jrnlmode3-3.4.1-(delete-to-off) — per-mode journal_mode setter rejected with exact error, reported mode stays wal (1.3-1.8,1.1)
# covers: jrnlmode3 jrnlmode3-3.4.2 — main.journal_mode reports wal after rejected set (1.1,2.3)
# covers: jrnlmode3 jrnlmode3-3.4.3 — in-transaction journal_mode change rejected, mode unchanged (2.3)
# covers: jrnlmode3 jrnlmode3-3.4.5 — setter still rejected after rollback; rollback integrity holds (2.4,2.5)
# covers: jrnlmode3 jrnlmode3-3.5.1-(persist-to-delete) — per-mode journal_mode setter rejected with exact error, reported mode stays wal (1.3-1.8,1.1)
# covers: jrnlmode3 jrnlmode3-3.5.2 — main.journal_mode reports wal after rejected set (1.1,2.3)
# covers: jrnlmode3 jrnlmode3-3.5.3 — in-transaction journal_mode change rejected, mode unchanged (2.3)
# covers: jrnlmode3 jrnlmode3-3.5.5 — setter still rejected after rollback; rollback integrity holds (2.4,2.5)
# covers: jrnlmode3 jrnlmode3-3.6.1-(persist-to-truncate) — per-mode journal_mode setter rejected with exact error, reported mode stays wal (1.3-1.8,1.1)
# covers: jrnlmode3 jrnlmode3-3.6.2 — main.journal_mode reports wal after rejected set (1.1,2.3)
# covers: jrnlmode3 jrnlmode3-3.6.3 — in-transaction journal_mode change rejected, mode unchanged (2.3)
# covers: jrnlmode3 jrnlmode3-3.6.5 — setter still rejected after rollback; rollback integrity holds (2.4,2.5)
# covers: jrnlmode3 jrnlmode3-3.7.1-(persist-to-memory) — per-mode journal_mode setter rejected with exact error, reported mode stays wal (1.3-1.8,1.1)
# covers: jrnlmode3 jrnlmode3-3.7.2 — main.journal_mode reports wal after rejected set (1.1,2.3)
# covers: jrnlmode3 jrnlmode3-3.7.3 — in-transaction journal_mode change rejected, mode unchanged (2.3)
# covers: jrnlmode3 jrnlmode3-3.7.5 — setter still rejected after rollback; rollback integrity holds (2.4,2.5)
# covers: jrnlmode3 jrnlmode3-3.8.1-(persist-to-off) — per-mode journal_mode setter rejected with exact error, reported mode stays wal (1.3-1.8,1.1)
# covers: jrnlmode3 jrnlmode3-3.8.2 — main.journal_mode reports wal after rejected set (1.1,2.3)
# covers: jrnlmode3 jrnlmode3-3.8.3 — in-transaction journal_mode change rejected, mode unchanged (2.3)
# covers: jrnlmode3 jrnlmode3-3.8.5 — setter still rejected after rollback; rollback integrity holds (2.4,2.5)
# covers: jrnlmode3 jrnlmode3-3.9.1-(truncate-to-delete) — per-mode journal_mode setter rejected with exact error, reported mode stays wal (1.3-1.8,1.1)
# covers: jrnlmode3 jrnlmode3-3.9.2 — main.journal_mode reports wal after rejected set (1.1,2.3)
# covers: jrnlmode3 jrnlmode3-3.9.3 — in-transaction journal_mode change rejected, mode unchanged (2.3)
# covers: jrnlmode3 jrnlmode3-3.9.5 — setter still rejected after rollback; rollback integrity holds (2.4,2.5)
# covers: jrnlmode3 jrnlmode3-3.10.1-(truncate-to-persist) — per-mode journal_mode setter rejected with exact error, reported mode stays wal (1.3-1.8,1.1)
# covers: jrnlmode3 jrnlmode3-3.10.2 — main.journal_mode reports wal after rejected set (1.1,2.3)
# covers: jrnlmode3 jrnlmode3-3.10.3 — in-transaction journal_mode change rejected, mode unchanged (2.3)
# covers: jrnlmode3 jrnlmode3-3.10.5 — setter still rejected after rollback; rollback integrity holds (2.4,2.5)
# covers: jrnlmode3 jrnlmode3-3.11.1-(truncate-to-memory) — per-mode journal_mode setter rejected with exact error, reported mode stays wal (1.3-1.8,1.1)
# covers: jrnlmode3 jrnlmode3-3.11.2 — main.journal_mode reports wal after rejected set (1.1,2.3)
# covers: jrnlmode3 jrnlmode3-3.11.3 — in-transaction journal_mode change rejected, mode unchanged (2.3)
# covers: jrnlmode3 jrnlmode3-3.11.5 — setter still rejected after rollback; rollback integrity holds (2.4,2.5)
# covers: jrnlmode3 jrnlmode3-3.12.1-(truncate-to-off) — per-mode journal_mode setter rejected with exact error, reported mode stays wal (1.3-1.8,1.1)
# covers: jrnlmode3 jrnlmode3-3.12.2 — main.journal_mode reports wal after rejected set (1.1,2.3)
# covers: jrnlmode3 jrnlmode3-3.12.3 — in-transaction journal_mode change rejected, mode unchanged (2.3)
# covers: jrnlmode3 jrnlmode3-3.12.5 — setter still rejected after rollback; rollback integrity holds (2.4,2.5)
# covers: jrnlmode3 jrnlmode3-3.13.1-(memory-to-delete) — per-mode journal_mode setter rejected with exact error, reported mode stays wal (1.3-1.8,1.1)
# covers: jrnlmode3 jrnlmode3-3.13.2 — main.journal_mode reports wal after rejected set (1.1,2.3)
# covers: jrnlmode3 jrnlmode3-3.13.3 — in-transaction journal_mode change rejected, mode unchanged (2.3)
# covers: jrnlmode3 jrnlmode3-3.13.5 — setter still rejected after rollback; rollback integrity holds (2.4,2.5)
# covers: jrnlmode3 jrnlmode3-3.14.1-(memory-to-persist) — per-mode journal_mode setter rejected with exact error, reported mode stays wal (1.3-1.8,1.1)
# covers: jrnlmode3 jrnlmode3-3.14.2 — main.journal_mode reports wal after rejected set (1.1,2.3)
# covers: jrnlmode3 jrnlmode3-3.14.3 — in-transaction journal_mode change rejected, mode unchanged (2.3)
# covers: jrnlmode3 jrnlmode3-3.14.5 — setter still rejected after rollback; rollback integrity holds (2.4,2.5)
# covers: jrnlmode3 jrnlmode3-3.15.1-(memory-to-truncate) — per-mode journal_mode setter rejected with exact error, reported mode stays wal (1.3-1.8,1.1)
# covers: jrnlmode3 jrnlmode3-3.15.2 — main.journal_mode reports wal after rejected set (1.1,2.3)
# covers: jrnlmode3 jrnlmode3-3.15.3 — in-transaction journal_mode change rejected, mode unchanged (2.3)
# covers: jrnlmode3 jrnlmode3-3.15.5 — setter still rejected after rollback; rollback integrity holds (2.4,2.5)
# covers: jrnlmode3 jrnlmode3-3.16.1-(memory-to-off) — per-mode journal_mode setter rejected with exact error, reported mode stays wal (1.3-1.8,1.1)
# covers: jrnlmode3 jrnlmode3-3.16.2 — main.journal_mode reports wal after rejected set (1.1,2.3)
# covers: jrnlmode3 jrnlmode3-3.16.3 — in-transaction journal_mode change rejected, mode unchanged (2.3)
# covers: jrnlmode3 jrnlmode3-3.16.5 — setter still rejected after rollback; rollback integrity holds (2.4,2.5)
# covers: jrnlmode3 jrnlmode3-3.17.1-(off-to-delete) — per-mode journal_mode setter rejected with exact error, reported mode stays wal (1.3-1.8,1.1)
# covers: jrnlmode3 jrnlmode3-3.17.2 — main.journal_mode reports wal after rejected set (1.1,2.3)
# covers: jrnlmode3 jrnlmode3-3.17.3 — in-transaction journal_mode change rejected, mode unchanged (2.3)
# covers: jrnlmode3 jrnlmode3-3.17.5 — setter still rejected after rollback; rollback integrity holds (2.4,2.5)
# covers: jrnlmode3 jrnlmode3-3.18.1-(off-to-persist) — per-mode journal_mode setter rejected with exact error, reported mode stays wal (1.3-1.8,1.1)
# covers: jrnlmode3 jrnlmode3-3.18.2 — main.journal_mode reports wal after rejected set (1.1,2.3)
# covers: jrnlmode3 jrnlmode3-3.18.3 — in-transaction journal_mode change rejected, mode unchanged (2.3)
# covers: jrnlmode3 jrnlmode3-3.18.5 — setter still rejected after rollback; rollback integrity holds (2.4,2.5)
# covers: jrnlmode3 jrnlmode3-3.19.1-(off-to-truncate) — per-mode journal_mode setter rejected with exact error, reported mode stays wal (1.3-1.8,1.1)
# covers: jrnlmode3 jrnlmode3-3.19.2 — main.journal_mode reports wal after rejected set (1.1,2.3)
# covers: jrnlmode3 jrnlmode3-3.19.3 — in-transaction journal_mode change rejected, mode unchanged (2.3)
# covers: jrnlmode3 jrnlmode3-3.19.5 — setter still rejected after rollback; rollback integrity holds (2.4,2.5)
# covers: jrnlmode3 jrnlmode3-3.20.1-(off-to-memory) — per-mode journal_mode setter rejected with exact error, reported mode stays wal (1.3-1.8,1.1)
# covers: jrnlmode3 jrnlmode3-3.20.2 — main.journal_mode reports wal after rejected set (1.1,2.3)
# covers: jrnlmode3 jrnlmode3-3.20.3 — in-transaction journal_mode change rejected, mode unchanged (2.3)
# covers: jrnlmode3 jrnlmode3-3.20.5 — setter still rejected after rollback; rollback integrity holds (2.4,2.5)
# covers: jrnlmode jrnlmode-1.0 — journal_mode/main/temp report wal,wal,delete (1.1,1.2)
# covers: jrnlmode jrnlmode-1.1 — mode setter rejected with exact doltlite error (1.3-1.7)
# covers: jrnlmode jrnlmode-1.2 — journal_mode/main/temp report wal,wal,delete (1.1,1.2)
# covers: jrnlmode jrnlmode-1.4a — DEFENSIVE on: journal_mode=off refused without error, reports wal (1.10)
# covers: jrnlmode jrnlmode-1.4b — mode setter rejected with exact doltlite error (1.3-1.7)
# covers: jrnlmode jrnlmode-1.5 — journal_mode/main/temp report wal,wal,delete (1.1,1.2)
# covers: jrnlmode jrnlmode-1.6 — mode setter rejected with exact doltlite error (1.3-1.7)
# covers: jrnlmode jrnlmode-1.7 — journal_mode/main/temp report wal,wal,delete (1.1,1.2)
# covers: jrnlmode jrnlmode-1.7.1 — mode setter rejected with exact doltlite error (1.3-1.7)
# covers: jrnlmode jrnlmode-1.7.2 — journal_mode/main/temp report wal,wal,delete (1.1,1.2)
# covers: jrnlmode jrnlmode-1.8 — invalid mode name ignored, reports wal (1.9)
# covers: jrnlmode jrnlmode-1.9 — ATTACHed :memory: db reports journal_mode memory (7.6)
# covers: jrnlmode jrnlmode-1.10 — memory-db mode unchangeable (stays memory); file-db setter rejected (7.6,1.3)
# covers: jrnlmode jrnlmode-1.11 — memory-db mode unchangeable (stays memory); file-db setter rejected (7.6,1.3)
# covers: jrnlmode jrnlmode-1.12 — ATTACHed :memory: db reports journal_mode memory (7.6)
# covers: jrnlmode jrnlmode-1.13 — memory-db mode unchangeable (stays memory); file-db setter rejected (7.6,1.3)
# covers: jrnlmode jrnlmode-1.14 — memory-db mode unchangeable (stays memory); file-db setter rejected (7.6,1.3)
# covers: jrnlmode jrnlmode-1.15 — ATTACHed :memory: db reports journal_mode memory (7.6)
# covers: jrnlmode jrnlmode-1.16 — memory-db mode unchangeable (stays memory); file-db setter rejected (7.6,1.3)
# covers: jrnlmode jrnlmode-1.99 — DETACH after journal pragmas works (7.7)
# covers: jrnlmode jrnlmode-2.1 — cross-db txn commits atomically, rows visible, no -journal sidecars (7.4,3.1,3.2)
# covers: jrnlmode jrnlmode-2.2 — cross-db txn commits atomically, rows visible, no -journal sidecars (7.4,3.1,3.2)
# covers: jrnlmode jrnlmode-2.3 — cross-db txn commits atomically, rows visible, no -journal sidecars (7.4,3.1,3.2)
# covers: jrnlmode jrnlmode-2.4 — cross-db txn commits atomically, rows visible, no -journal sidecars (7.4,3.1,3.2)
# covers: jrnlmode jrnlmode-2.5 — cross-db txn commits atomically, rows visible, no -journal sidecars (7.4,3.1,3.2)
# covers: jrnlmode jrnlmode-3.2 — BEGIN IMMEDIATE + INSERT OR IGNORE across attached dbs commits (7.5)
# covers: jrnlmode jrnlmode-4.1 — cache_size=1 + blob insert/delete + integrity_check ok; auto_vacuum no-op (10.6,10.4,2.8)
# covers: jrnlmode jrnlmode-4.2 — cache_size=1 + blob insert/delete + integrity_check ok; auto_vacuum no-op (10.6,10.4,2.8)
# covers: jrnlmode jrnlmode-4.3 — cache_size=1 + blob insert/delete + integrity_check ok; auto_vacuum no-op (10.6,10.4,2.8)
# covers: jrnlmode jrnlmode-4.4 — cache_size=1 + blob insert/delete + integrity_check ok; auto_vacuum no-op (10.6,10.4,2.8)
# covers: jrnlmode jrnlmode-5.1 — journal_size_limit fixed at -1, set echoes -1 incl. aux (6.1-6.3,7.3)
# covers: jrnlmode jrnlmode-5.3 — journal_size_limit fixed at -1, set echoes -1 incl. aux (6.1-6.3,7.3)
# covers: jrnlmode jrnlmode-5.4.1 — journal_size_limit fixed at -1, set echoes -1 incl. aux (6.1-6.3,7.3)
# covers: jrnlmode jrnlmode-5.4.2 — journal_size_limit fixed at -1, set echoes -1 incl. aux (6.1-6.3,7.3)
# covers: jrnlmode jrnlmode-5.5 — journal_size_limit fixed at -1, set echoes -1 incl. aux (6.1-6.3,7.3)
# covers: jrnlmode jrnlmode-5.6 — journal_size_limit fixed at -1, set echoes -1 incl. aux (6.1-6.3,7.3)
# covers: jrnlmode jrnlmode-5.7 — journal_size_limit fixed at -1, set echoes -1 incl. aux (6.1-6.3,7.3)
# covers: jrnlmode jrnlmode-5.8 — journal_size_limit fixed at -1, set echoes -1 incl. aux (6.1-6.3,7.3)
# covers: jrnlmode jrnlmode-5.10 — journal_size_limit fixed at -1, set echoes -1 incl. aux (6.1-6.3,7.3)
# covers: jrnlmode jrnlmode-5.11 — journal_size_limit fixed at -1, set echoes -1 incl. aux (6.1-6.3,7.3)
# covers: jrnlmode jrnlmode-5.12 — journal_size_limit fixed at -1, set echoes -1 incl. aux (6.1-6.3,7.3)
# covers: jrnlmode jrnlmode-5.13 — journal_size_limit fixed at -1, set echoes -1 incl. aux (6.1-6.3,7.3)
# covers: jrnlmode jrnlmode-5.14 — journal_size_limit fixed at -1, set echoes -1 incl. aux (6.1-6.3,7.3)
# covers: jrnlmode jrnlmode-5.15 — journal_size_limit fixed at -1, set echoes -1 incl. aux (6.1-6.3,7.3)
# covers: jrnlmode jrnlmode-5.16 — journal_size_limit fixed at -1, set echoes -1 incl. aux (6.1-6.3,7.3)
# covers: jrnlmode jrnlmode-5.17 — journal_size_limit fixed at -1, set echoes -1 incl. aux (6.1-6.3,7.3)
# covers: jrnlmode jrnlmode-5.18 — journal_size_limit fixed at -1, set echoes -1 incl. aux (6.1-6.3,7.3)
# covers: jrnlmode jrnlmode-5.19 — journal_size_limit fixed at -1, set echoes -1 incl. aux (6.1-6.3,7.3)
# covers: jrnlmode jrnlmode-5.20 — multi-db txn commits with no journal sidecars, durable across reopen (7.4,3.1,7.8)
# covers: jrnlmode jrnlmode-5.21 — multi-db txn commits with no journal sidecars, durable across reopen (7.4,3.1,7.8)
# covers: jrnlmode jrnlmode-5.22 — multi-db txn commits with no journal sidecars, durable across reopen (7.4,3.1,7.8)
# covers: jrnlmode jrnlmode-6.1 — in-txn journal_mode change rejected; COMMIT still applies, rows visible (2.7,3.1)
# covers: jrnlmode jrnlmode-6.2 — in-txn journal_mode change rejected; COMMIT still applies, rows visible (2.7,3.1)
# covers: jrnlmode jrnlmode-6.3 — in-txn journal_mode change rejected; COMMIT still applies, rows visible (2.7,3.1)
# covers: jrnlmode jrnlmode-6.4 — in-txn journal_mode change rejected; COMMIT still applies, rows visible (2.7,3.1)
# covers: jrnlmode jrnlmode-6.5 — in-txn journal_mode change rejected; COMMIT still applies, rows visible (2.7,3.1)
# covers: jrnlmode jrnlmode-6.7 — in-txn journal_mode change rejected; COMMIT still applies, rows visible (2.7,3.1)
# covers: jrnlmode jrnlmode-6.9 — in-txn journal_mode change rejected; COMMIT still applies, rows visible (2.7,3.1)
# covers: jrnlmode jrnlmode-7.1 — user_version round-trips; durability via reopen + stable table hash (10.7,11.1)
# covers: jrnlmode jrnlmode-7.2 — user_version round-trips; durability via reopen + stable table hash (10.7,11.1)
# covers: jrnlmode jrnlmode-8.5 — journal switching under exclusive/normal locking collapses: setters rejected, BEGIN IMMEDIATE txn commits (2.1,2.6,2.7)
# covers: jrnlmode jrnlmode-8.6 — journal switching under exclusive/normal locking collapses: setters rejected, BEGIN IMMEDIATE txn commits (2.1,2.6,2.7)
# covers: jrnlmode jrnlmode-8.7 — journal switching under exclusive/normal locking collapses: setters rejected, BEGIN IMMEDIATE txn commits (2.1,2.6,2.7)
# covers: jrnlmode jrnlmode-8.8 — journal switching under exclusive/normal locking collapses: setters rejected, BEGIN IMMEDIATE txn commits (2.1,2.6,2.7)
# covers: jrnlmode jrnlmode-8.13 — journal switching under exclusive/normal locking collapses: setters rejected, BEGIN IMMEDIATE txn commits (2.1,2.6,2.7)
# covers: jrnlmode jrnlmode-8.14 — journal switching under exclusive/normal locking collapses: setters rejected, BEGIN IMMEDIATE txn commits (2.1,2.6,2.7)
# covers: jrnlmode jrnlmode-8.15 — journal switching under exclusive/normal locking collapses: setters rejected, BEGIN IMMEDIATE txn commits (2.1,2.6,2.7)
# covers: jrnlmode jrnlmode-8.16 — journal switching under exclusive/normal locking collapses: setters rejected, BEGIN IMMEDIATE txn commits (2.1,2.6,2.7)
# covers: jrnlmode jrnlmode-8.17 — journal switching under exclusive/normal locking collapses: setters rejected, BEGIN IMMEDIATE txn commits (2.1,2.6,2.7)
# covers: jrnlmode jrnlmode-8.21 — journal switching under exclusive/normal locking collapses: setters rejected, BEGIN IMMEDIATE txn commits (2.1,2.6,2.7)
# covers: jrnlmode jrnlmode-8.23 — journal switching under exclusive/normal locking collapses: setters rejected, BEGIN IMMEDIATE txn commits (2.1,2.6,2.7)
# covers: jrnlmode jrnlmode-8.24 — journal switching under exclusive/normal locking collapses: setters rejected, BEGIN IMMEDIATE txn commits (2.1,2.6,2.7)
# covers: jrnlmode jrnlmode-8.28 — journal switching under exclusive/normal locking collapses: setters rejected, BEGIN IMMEDIATE txn commits (2.1,2.6,2.7)
# covers: jrnlmode jrnlmode-8.30 — journal switching under exclusive/normal locking collapses: setters rejected, BEGIN IMMEDIATE txn commits (2.1,2.6,2.7)
# covers: jrnlmode jrnlmode-9.1 — temp table + journal_mode=off rejection on fresh exclusive-locking db, still usable (2.1,1.7,8.5)
# covers: jrnlmode jrnlmode-9.2 — temp table + journal_mode=off rejection on fresh exclusive-locking db, still usable (2.1,1.7,8.5)
# covers: walmode walmode-1.2 — synthetic file-size inapplicable; rows + table hash stable across reopen (11.1)
# covers: walmode walmode-1.3 — commit drives real fsync: sqlite_sync_count>0 (9.4)
# covers: walmode walmode-1.5 — synthetic file-size inapplicable; rows + table hash stable across reopen (11.1)
# covers: walmode walmode-1.6 — no -wal sidecar ever exists (3.1,3.2)
# covers: walmode walmode-2.2 — no -wal sidecar ever exists (3.1,3.2)
# covers: walmode walmode-3.2 — no -wal sidecar ever exists (3.1,3.2)
# covers: walmode walmode-4.1 — journal_mode=persist rejected; data intact (1.4,11.1)
# covers: walmode walmode-4.2 — journal_mode=persist rejected; data intact (1.4,11.1)
# covers: walmode walmode-4.5 — journal_mode=persist rejected; data intact (1.4,11.1)
# covers: walmode walmode-4.6 — every connection reports wal; concurrent second connection reads fine (1.12,1.13,4.1)
# covers: walmode walmode-4.9 — journal_mode=delete rejected regardless of second connection, reports wal (1.3,1.1)
# covers: walmode walmode-4.11 — journal_mode=delete rejected regardless of second connection, reports wal (1.3,1.1)
# covers: walmode walmode-4.12 — journal_mode=delete rejected regardless of second connection, reports wal (1.3,1.1)
# covers: walmode walmode-4.16 — every connection reports wal; concurrent second connection reads fine (1.12,1.13,4.1)
# covers: walmode walmode-4.17 — every connection reports wal; concurrent second connection reads fine (1.12,1.13,4.1)
# covers: walmode walmode-4.18 — every connection reports wal; concurrent second connection reads fine (1.12,1.13,4.1)
# covers: walmode walmode-5.1.2 — :memory: db cannot become wal: setter no-ops like stock, stays memory, db usable (8.1,8.2)
# covers: walmode walmode-5.1.4 — :memory: db cannot become wal: setter errors, stays memory, db usable (8.1,8.2)
# covers: walmode walmode-6.1 — per-mode-to-wal loop collapses: =wal echoes wal, other modes rejected (1.8,1.3-1.7)
# covers: walmode walmode-6.2 — per-mode-to-wal loop collapses: =wal echoes wal, other modes rejected (1.8,1.3-1.7)
# covers: walmode walmode-6.3 — per-mode-to-wal loop collapses: =wal echoes wal, other modes rejected (1.8,1.3-1.7)
# covers: walmode walmode-6.4 — per-mode-to-wal loop collapses: =wal echoes wal, other modes rejected (1.8,1.3-1.7)
# covers: walmode walmode-6.5 — per-mode-to-wal loop collapses: =wal echoes wal, other modes rejected (1.8,1.3-1.7)
# covers: walmode walmode-7.3 — fresh connection first-statement journal_mode reports wal (1.12,1.13)
# covers: walmode walmode-7.4 — fresh connection first-statement journal_mode reports wal (1.12,1.13)
# covers: walmode walmode-7.5 — fresh connection first-statement journal_mode reports wal (1.12,1.13)
# covers: walmode walmode-7.11 — fresh connection first-statement journal_mode reports wal (1.12,1.13)
# covers: walmode walmode-7.12 — fresh connection first-statement journal_mode reports wal (1.12,1.13)
# covers: walmode walmode-7.13 — fresh connection first-statement journal_mode reports wal (1.12,1.13)
# covers: walmode walmode-8.3 — attached file db reports wal; per-db setter rejected (7.1,7.2)
# covers: walmode walmode-8.4 — attached file db reports wal; per-db setter rejected (7.1,7.2)
# covers: walmode walmode-8.7 — attached file db reports wal; per-db setter rejected (7.1,7.2)
# covers: walmode walmode-8.9 — attached file db reports wal; per-db setter rejected (7.1,7.2)
# covers: walmode walmode-8.20 — multi-db journal_mode=DELETE/WAL: rejected / echoes wal (1.3,1.8,7.2)
# covers: walmode walmode-8.21 — multi-db journal_mode=DELETE/WAL: rejected / echoes wal (1.3,1.8,7.2)
# covers: walmode walmode-8.22 — multi-db journal_mode=DELETE/WAL: rejected / echoes wal (1.3,1.8,7.2)
# covers: e_wal e_wal-1.1.1 — legacy-VFS/shm premise inapplicable: doltlite opens, reads, writes with no -shm at all (3.1,3.2,11.1)
# covers: e_wal e_wal-1.1.4 — no -shm/-wal sidecar files exist (3.1,3.2)
# covers: e_wal e_wal-1.2.1 — legacy-VFS/shm premise inapplicable: doltlite opens, reads, writes with no -shm at all (3.1,3.2,11.1)
# covers: e_wal e_wal-1.2.3 — no -shm/-wal sidecar files exist (3.1,3.2)
# covers: e_wal e_wal-1.3.1 — legacy-VFS/shm premise inapplicable: doltlite opens, reads, writes with no -shm at all (3.1,3.2,11.1)
# covers: e_wal e_wal-1.3.2 — read+write works with locking_mode=exclusive echo (2.1,2.2)
# covers: e_wal e_wal-1.3.3 — no -shm/-wal sidecar files exist (3.1,3.2)
# covers: e_wal e_wal-2.1.1 — read+write works with locking_mode=exclusive echo (2.1,2.2)
# covers: e_wal e_wal-2.1.2 — no -shm/-wal sidecar files exist (3.1,3.2)
# covers: e_wal e_wal-2.2.1 — locking-mode echo + second connection always reads; write-write conflict is exactly 'database is locked' (4.1-4.6)
# covers: e_wal e_wal-2.2.2 — locking-mode echo + second connection always reads; write-write conflict is exactly 'database is locked' (4.1-4.6)
# covers: e_wal e_wal-2.3.1 — locking-mode echo + second connection always reads; write-write conflict is exactly 'database is locked' (4.1-4.6)
# covers: e_wal e_wal-2.3.2 — locking-mode echo + second connection always reads; write-write conflict is exactly 'database is locked' (4.1-4.6)
# covers: e_wal e_wal-2.3.3 — locking-mode echo + second connection always reads; write-write conflict is exactly 'database is locked' (4.1-4.6)
# covers: e_wal e_wal-2.3.4 — locking-mode echo + second connection always reads; write-write conflict is exactly 'database is locked' (4.1-4.6)
# covers: e_wal e_wal-3.1 — no -shm/-wal sidecar files exist (3.1,3.2)
# covers: e_wal e_wal-3.2.2 — locking-mode echo + second connection always reads; write-write conflict is exactly 'database is locked' (4.1-4.6)
# covers: e_wal e_wal-3.2.3 — locking-mode echo + second connection always reads; write-write conflict is exactly 'database is locked' (4.1-4.6)
# covers: e_wal e_wal-3.2.4 — locking-mode echo + second connection always reads; write-write conflict is exactly 'database is locked' (4.1-4.6)
# covers: e_wal e_wal-3.2.5 — locking-mode echo + second connection always reads; write-write conflict is exactly 'database is locked' (4.1-4.6)
# covers: e_wal e_wal-3.4.1 — legacy-VFS/shm premise inapplicable: doltlite opens, reads, writes with no -shm at all (3.1,3.2,11.1)
# covers: e_wal e_wal-3.4.2 — legacy-VFS/shm premise inapplicable: doltlite opens, reads, writes with no -shm at all (3.1,3.2,11.1)
# covers: e_wal e_wal-4.1.2 — header version bytes inapplicable; durability + hash + integrity invariants instead (11.1,11.2)
# covers: e_wal e_wal-4.1.4 — header version bytes inapplicable; durability + hash + integrity invariants instead (11.1,11.2)
# covers: e_wal e_wal-4.2.2 — no -shm/-wal sidecar files exist (3.1,3.2)
# covers: e_wal e_wal-4.2.3 — journal_mode=delete rejected with exact error (1.3)
# covers: e_wal e_wal-4.3 — header version bytes inapplicable; durability + hash + integrity invariants instead (11.1,11.2)
# covers: trans trans-9.10.5-2112 — fullfsync echo + fullsync-counter contract (0) + sync_count>0 on commit + rollback signature unchanged (9.2-9.4)
# covers: trans trans-9.12.5-2544 — fullfsync echo + fullsync-counter contract (0) + sync_count>0 on commit + rollback signature unchanged (9.2-9.4)
# covers: trans trans-9.14.5-3089 — fullfsync echo + fullsync-counter contract (0) + sync_count>0 on commit + rollback signature unchanged (9.2-9.4)
# covers: trans trans-9.16.5-3802 — fullfsync echo + fullsync-counter contract (0) + sync_count>0 on commit + rollback signature unchanged (9.2-9.4)
# covers: trans trans-9.18.5-4593 — fullfsync echo + fullsync-counter contract (0) + sync_count>0 on commit + rollback signature unchanged (9.2-9.4)
# covers: trans trans-9.2.5-1024 — fullfsync echo + fullsync-counter contract (0) + sync_count>0 on commit + rollback signature unchanged (9.2-9.4)
# covers: trans trans-9.20.5-5551 — fullfsync echo + fullsync-counter contract (0) + sync_count>0 on commit + rollback signature unchanged (9.2-9.4)
# covers: trans trans-9.22.5-6736 — fullfsync echo + fullsync-counter contract (0) + sync_count>0 on commit + rollback signature unchanged (9.2-9.4)
# covers: trans trans-9.24.5-8156 — fullfsync echo + fullsync-counter contract (0) + sync_count>0 on commit + rollback signature unchanged (9.2-9.4)
# covers: trans trans-9.26.5-9897 — fullfsync echo + fullsync-counter contract (0) + sync_count>0 on commit + rollback signature unchanged (9.2-9.4)
# covers: trans trans-9.28.5-11982 — fullfsync echo + fullsync-counter contract (0) + sync_count>0 on commit + rollback signature unchanged (9.2-9.4)
# covers: trans trans-9.30.5-14544 — fullfsync echo + fullsync-counter contract (0) + sync_count>0 on commit + rollback signature unchanged (9.2-9.4)
# covers: trans trans-9.32.5-17576 — fullfsync echo + fullsync-counter contract (0) + sync_count>0 on commit + rollback signature unchanged (9.2-9.4)
# covers: trans trans-9.34.5-21225 — fullfsync echo + fullsync-counter contract (0) + sync_count>0 on commit + rollback signature unchanged (9.2-9.4)
# covers: trans trans-9.36.5-25685 — fullfsync echo + fullsync-counter contract (0) + sync_count>0 on commit + rollback signature unchanged (9.2-9.4)
# covers: trans trans-9.38.5-30883 — fullfsync echo + fullsync-counter contract (0) + sync_count>0 on commit + rollback signature unchanged (9.2-9.4)
# covers: trans trans-9.4.5-1224 — fullfsync echo + fullsync-counter contract (0) + sync_count>0 on commit + rollback signature unchanged (9.2-9.4)
# covers: trans trans-9.6.5-1480 — fullfsync echo + fullsync-counter contract (0) + sync_count>0 on commit + rollback signature unchanged (9.2-9.4)
# covers: trans trans-9.8.5-1766 — fullfsync echo + fullsync-counter contract (0) + sync_count>0 on commit + rollback signature unchanged (9.2-9.4)
# covers: busy2 busy2-2.1.2 — wal_checkpoint with concurrent reader returns 0 0 0 instantly; both connections keep working (5.7,4.x)
# covers: busy2 busy2-2.1.3 — wal_checkpoint with concurrent reader returns 0 0 0 instantly; both connections keep working (5.7,4.x)
# covers: busy2 busy2-2.1.4 — wal_checkpoint with concurrent reader returns 0 0 0 instantly; both connections keep working (5.7,4.x)
# covers: busy2 busy2-2.1.5 — wal_checkpoint with concurrent reader returns 0 0 0 instantly; both connections keep working (5.7,4.x)
# covers: busy2 busy2-2.2.2 — wal_checkpoint with concurrent reader returns 0 0 0 instantly; both connections keep working (5.7,4.x)
# covers: busy2 busy2-2.2.3 — wal_checkpoint with concurrent reader returns 0 0 0 instantly; both connections keep working (5.7,4.x)
# covers: busy2 busy2-2.2.4 — wal_checkpoint with concurrent reader returns 0 0 0 instantly; both connections keep working (5.7,4.x)
# covers: busy2 busy2-2.2.5 — wal_checkpoint with concurrent reader returns 0 0 0 instantly; both connections keep working (5.7,4.x)
# covers: busy2 busy2-3.1.2 — write-write conflict surfaces deterministically as 'database is locked'; both connections recover (4.2,4.3)
# covers: busy2 busy2-3.1.3 — write-write conflict surfaces deterministically as 'database is locked'; both connections recover (4.2,4.3)
# covers: busy2 busy2-3.2.2 — write-write conflict surfaces deterministically as 'database is locked'; both connections recover (4.2,4.3)
# covers: busy2 busy2-3.2.3 — write-write conflict surfaces deterministically as 'database is locked'; both connections recover (4.2,4.3)
# covers: jrnlmode2 jrnlmode2-1.1 — journal_mode=persist rejected with exact error (1.4)
# covers: jrnlmode2 jrnlmode2-1.2 — no -journal sidecar ever (3.1,3.2)
# covers: jrnlmode2 jrnlmode2-1.3 — second connection reads while first holds open txn; sees commit afterwards (4.1,4.3)
# covers: jrnlmode2 jrnlmode2-1.4 — lock_status doltlite contract asserted exactly (10.8)
# covers: jrnlmode2 jrnlmode2-1.5 — no -journal sidecar ever (3.1,3.2)
# covers: jrnlmode2 jrnlmode2-1.6 — second connection reads while first holds open txn; sees commit afterwards (4.1,4.3)
# covers: jrnlmode2 jrnlmode2-1.7 — second connection reads while first holds open txn; sees commit afterwards (4.1,4.3)
# covers: jrnlmode2 jrnlmode2-2.1 — journal_mode=truncate rejected; inserts still work (1.5)
# covers: jrnlmode2 jrnlmode2-2.2 — no -journal sidecar ever (3.1,3.2)
# covers: jrnlmode2 jrnlmode2-2.3 — no -journal sidecar ever (3.1,3.2)
# covers: jrnlmode2 jrnlmode2-2.4 — readonly connection reads committed rows; writes rejected (4.8,4.9)
# covers: jrnlmode2 jrnlmode2-2.6 — readonly connection reads committed rows; writes rejected (4.8,4.9)
# covers: walckptnoop walckptnoop-1.1 — wal_checkpoint default/passive return 0 0 0; noop/full/truncate rejected with exact error (5.1-5.5)
# covers: walckptnoop walckptnoop-1.2 — wal_checkpoint default/passive return 0 0 0; noop/full/truncate rejected with exact error (5.1-5.5)
# covers: walckptnoop walckptnoop-1.3 — wal_checkpoint default/passive return 0 0 0; noop/full/truncate rejected with exact error (5.1-5.5)
# covers: walckptnoop walckptnoop-1.4 — wal_checkpoint default/passive return 0 0 0; noop/full/truncate rejected with exact error (5.1-5.5)
# covers: walckptnoop walckptnoop-1.5 — wal_checkpoint default/passive return 0 0 0; noop/full/truncate rejected with exact error (5.1-5.5)
# covers: walckptnoop walckptnoop-1.6 — wal_checkpoint default/passive return 0 0 0; noop/full/truncate rejected with exact error (5.1-5.5)
# covers: walckptnoop walckptnoop-1.7 — checkpoint inside txn: default form returns 0 0 0, noop form rejected (5.9,5.3)
# covers: walckptnoop walckptnoop-1.8 — checkpoint inside txn: default form returns 0 0 0, noop form rejected (5.9,5.3)
# covers: walckptnoop walckptnoop-1.9 — sqlite3_wal_checkpoint_v2 noop returns 0 0 0 (5.6)
# covers: walckptnoop walckptnoop-1.10 — journal_mode=delete rejected; checkpoint contract stable after (1.3,5.1)
# covers: journal3 journal3-1.2.1.3 — no -journal sidecar is ever created during an open txn; rollback intact (3.1,2.2)
# covers: journal3 journal3-1.2.1.4 — no -journal sidecar is ever created during an open txn; rollback intact (3.1,2.2)
# covers: journal3 journal3-1.2.2.3 — no -journal sidecar is ever created during an open txn; rollback intact (3.1,2.2)
# covers: journal3 journal3-1.2.2.4 — no -journal sidecar is ever created during an open txn; rollback intact (3.1,2.2)
# covers: journal3 journal3-1.2.3.3 — no -journal sidecar is ever created during an open txn; rollback intact (3.1,2.2)
# covers: journal3 journal3-1.2.3.4 — no -journal sidecar is ever created during an open txn; rollback intact (3.1,2.2)
# covers: journal3 journal3-1.2.4.3 — no -journal sidecar is ever created during an open txn; rollback intact (3.1,2.2)
# covers: journal3 journal3-1.2.4.4 — no -journal sidecar is ever created during an open txn; rollback intact (3.1,2.2)
# covers: shared3 shared3-2.4 — cache_size echoes per connection; cross-connection reads consistent (10.1,10.2)
# covers: shared3 shared3-2.8 — no pager-lock cache spill: concurrent write conflict is deterministic 'database is locked' (4.2)
# covers: shared3 shared3-3.1 — auto_vacuum=2 accepted as a no-op, reads back 0 (10.4)
# covers: shared3 shared3-3.2 — uncommitted schema change invisible to second connection (4.7)
# covers: shared3 shared3-3.3 — incremental_vacuum no-ops; database unaffected (10.5)
# covers: shared3 shared3-3.4 — uncommitted schema change invisible to second connection (4.7)
# covers: tkt-f3e5abed55 tkt-f3e5abed55-1.4 — multi-db COMMIT succeeds under snapshot isolation (no pager write-lock); atomic visibility (7.4)
# covers: tkt-f3e5abed55 tkt-f3e5abed55-1.5 — both connections continue to commit cleanly; rows from both dbs visible (4.3,7.4,7.5)
# covers: tkt-f3e5abed55 tkt-f3e5abed55-2.3 — multi-db COMMIT succeeds under snapshot isolation (no pager write-lock); atomic visibility (7.4)
# covers: tkt-f3e5abed55 tkt-f3e5abed55-2.4 — both connections continue to commit cleanly; rows from both dbs visible (4.3,7.4,7.5)
# covers: tkt-f3e5abed55 tkt-f3e5abed55-2.5 — multi-db txn durable across reopen; no master-journal files (7.8,7.4)
# covers: vacuum vacuum-7.1 — freelist_count is 0 in prolly storage even after DROP TABLE (10.3)
# covers: vacuum vacuum-7.5 — auto_vacuum=1 no-op; auto_vacuum reads 0 (10.4)
# covers: misc1 misc1-14.2b — no -journal sidecar during open write transaction (3.1)
# not-covered: (none)

set JM_ERR {journal_mode is not configurable on doltlite-format databases}
set CKPT_ERR {wal_checkpoint mode is not configurable on doltlite-format databases; use the default (PASSIVE) form}

#-------------------------------------------------------------------------
# 1.*: PRAGMA journal_mode contract: fixed at wal, setters rejected.
#
do_execsql_test doltlite_recover_jrnlwal_4-1.1 {
  PRAGMA journal_mode;
  PRAGMA main.journal_mode;
} {wal wal}
do_execsql_test doltlite_recover_jrnlwal_4-1.2 {
  PRAGMA temp.journal_mode;
} {delete}
foreach {n mode} {3 delete 4 persist 5 truncate 6 memory 7 off} {
  do_test doltlite_recover_jrnlwal_4-1.$n {
    catchsql "PRAGMA journal_mode = $mode"
  } [list 1 $JM_ERR]
}
do_execsql_test doltlite_recover_jrnlwal_4-1.8 {
  PRAGMA journal_mode = wal;
} {wal}
do_catchsql_test doltlite_recover_jrnlwal_4-1.9 {
  PRAGMA journal_mode = invalid;
} {0 wal}
do_test doltlite_recover_jrnlwal_4-1.10 {
  sqlite3_db_config db DEFENSIVE 1
  set r [catchsql {PRAGMA main.journal_mode = off}]
  sqlite3_db_config db DEFENSIVE 0
  set r
} {0 wal}
# The unqualified setters above still apply to the temp db (stock rollback
# semantics); temp ends up "off". Temp journal mode remains switchable among
# rollback modes but can never become wal.
do_execsql_test doltlite_recover_jrnlwal_4-1.11 {
  PRAGMA temp.journal_mode;
  PRAGMA temp.journal_mode = persist;
  PRAGMA temp.journal_mode = delete;
  PRAGMA temp.journal_mode = wal;
} {off persist delete delete}
do_test doltlite_recover_jrnlwal_4-1.12 {
  db close
  sqlite3 db test.db
  execsql { PRAGMA journal_mode }
} {wal}
do_test doltlite_recover_jrnlwal_4-1.13 {
  db close
  sqlite3 db test.db
  execsql { PRAGMA main.journal_mode }
} {wal}

#-------------------------------------------------------------------------
# 2.*: journal_mode during transactions + rollback integrity.
#
do_execsql_test doltlite_recover_jrnlwal_4-2.1 {
  PRAGMA locking_mode = EXCLUSIVE;
  CREATE TABLE t1(x INTEGER PRIMARY KEY);
  INSERT INTO t1 VALUES(1);
  SELECT * FROM t1;
} {exclusive 1}
do_execsql_test doltlite_recover_jrnlwal_4-2.2 {
  BEGIN;
  INSERT INTO t1 VALUES(2);
  ROLLBACK;
  SELECT * FROM t1;
} {1}
do_test doltlite_recover_jrnlwal_4-2.3 {
  execsql { BEGIN; INSERT INTO t1 VALUES(3); }
  set r [catchsql {PRAGMA journal_mode = delete}]
  lappend r [execsql {PRAGMA main.journal_mode}]
} [list 1 $JM_ERR wal]
do_execsql_test doltlite_recover_jrnlwal_4-2.4 {
  ROLLBACK;
  SELECT * FROM t1;
} {1}
do_execsql_test doltlite_recover_jrnlwal_4-2.5 {
  PRAGMA journal_mode = wal;
  BEGIN;
  INSERT INTO t1 VALUES(9);
  ROLLBACK;
  SELECT * FROM t1;
} {wal 1}
do_execsql_test doltlite_recover_jrnlwal_4-2.6 {
  PRAGMA locking_mode = NORMAL;
} {normal}
do_test doltlite_recover_jrnlwal_4-2.7 {
  execsql { BEGIN IMMEDIATE; INSERT INTO t1 VALUES(4); }
  set r [catchsql {PRAGMA journal_mode = delete}]
  execsql { COMMIT }
  lappend r [execsql {SELECT x FROM t1 ORDER BY x}]
} [list 1 $JM_ERR {1 4}]
do_execsql_test doltlite_recover_jrnlwal_4-2.8 {
  PRAGMA integrity_check;
} {ok}

#-------------------------------------------------------------------------
# 3.*: no rollback-journal/-wal/-shm sidecar files, even mid-transaction.
#
do_test doltlite_recover_jrnlwal_4-3.1 {
  execsql { BEGIN; UPDATE t1 SET x=x+100 WHERE 1; }
  list [file exists test.db-journal] [file exists test.db-wal] \
       [file exists test.db-shm]
} {0 0 0}
do_test doltlite_recover_jrnlwal_4-3.2 {
  execsql { COMMIT }
  list [file exists test.db-journal] [file exists test.db-wal] \
       [file exists test.db-shm]
} {0 0 0}
do_execsql_test doltlite_recover_jrnlwal_4-3.3 {
  SELECT x FROM t1 ORDER BY x;
} {101 104}

#-------------------------------------------------------------------------
# 4.*: two-connection contract: snapshot reads, deterministic write-write
# conflicts, readonly connections.
#
do_test doltlite_recover_jrnlwal_4-4.1 {
  sqlite3 db2 test.db
  execsql { BEGIN; INSERT INTO t1 VALUES(7); }
  execsql { SELECT x FROM t1 ORDER BY x } db2
} {101 104}
do_test doltlite_recover_jrnlwal_4-4.2 {
  set r [catchsql { BEGIN; INSERT INTO t1 VALUES(8); } db2]
  catchsql { ROLLBACK } db2
  set r
} {1 {database is locked}}
do_test doltlite_recover_jrnlwal_4-4.3 {
  execsql { COMMIT }
  execsql { SELECT x FROM t1 ORDER BY x } db2
} {7 101 104}
do_test doltlite_recover_jrnlwal_4-4.4 {
  execsql { BEGIN EXCLUSIVE } db2
  catchsql { INSERT INTO t1 VALUES(9) }
} {1 {database is locked}}
do_test doltlite_recover_jrnlwal_4-4.5 {
  execsql { SELECT x FROM t1 ORDER BY x }
} {7 101 104}
do_test doltlite_recover_jrnlwal_4-4.6 {
  execsql { INSERT INTO t1 VALUES(10); COMMIT; } db2
  execsql { SELECT x FROM t1 ORDER BY x }
} {7 10 101 104}
do_test doltlite_recover_jrnlwal_4-4.7 {
  execsql { BEGIN; CREATE TABLE z9(q); }
  set r [execsql {SELECT count(*) FROM sqlite_master WHERE name='z9'} db2]
  execsql { ROLLBACK }
  set r
} {0}
do_test doltlite_recover_jrnlwal_4-4.8 {
  db2 close
  sqlite3 db2 test.db -readonly 1
  execsql { SELECT x FROM t1 ORDER BY x } db2
} {7 10 101 104}
do_test doltlite_recover_jrnlwal_4-4.9 {
  set r [catchsql { INSERT INTO t1 VALUES(11) } db2]
  db2 close
  set r
} {1 {attempt to write a readonly database}}

#-------------------------------------------------------------------------
# 5.*: wal_checkpoint contract.
#
do_execsql_test doltlite_recover_jrnlwal_4-5.1 {
  PRAGMA wal_checkpoint;
} {0 0 0}
do_execsql_test doltlite_recover_jrnlwal_4-5.2 {
  PRAGMA wal_checkpoint = passive;
} {0 0 0}
foreach {n ckmode} {3 noop 4 full 5 truncate} {
  do_test doltlite_recover_jrnlwal_4-5.$n {
    catchsql "PRAGMA wal_checkpoint = $ckmode"
  } [list 1 $CKPT_ERR]
}
do_test doltlite_recover_jrnlwal_4-5.6 {
  sqlite3_wal_checkpoint_v2 db noop
} {0 0 0}
do_test doltlite_recover_jrnlwal_4-5.7 {
  sqlite3 db2 test.db
  execsql { BEGIN; SELECT count(*) FROM t1; } db2
  set r [execsql {PRAGMA wal_checkpoint}]
  execsql { COMMIT } db2
  db2 close
  set r
} {0 0 0}
do_execsql_test doltlite_recover_jrnlwal_4-5.8 {
  PRAGMA wal_autocheckpoint = 100;
  PRAGMA wal_autocheckpoint;
  PRAGMA wal_autocheckpoint = 1000;
} {100 100 1000}
do_test doltlite_recover_jrnlwal_4-5.9 {
  execsql { BEGIN; INSERT INTO t1 VALUES(12); }
  set r [execsql {PRAGMA wal_checkpoint}]
  execsql { ROLLBACK }
  set r
} {0 0 0}

#-------------------------------------------------------------------------
# 6.*: journal_size_limit is fixed at -1.
#
do_execsql_test doltlite_recover_jrnlwal_4-6.1 {
  PRAGMA journal_size_limit;
} {-1}
do_execsql_test doltlite_recover_jrnlwal_4-6.2 {
  PRAGMA journal_size_limit = 10240;
} {-1}
do_execsql_test doltlite_recover_jrnlwal_4-6.3 {
  PRAGMA main.journal_size_limit = 20480;
  PRAGMA journal_size_limit;
} {-1 -1}

#-------------------------------------------------------------------------
# 7.*: ATTACHed databases: per-db journal_mode, atomic multi-db commits,
# no master-journal files, durability.
#
do_test doltlite_recover_jrnlwal_4-7.1 {
  forcedelete test2.db
  execsql {
    ATTACH 'test2.db' AS two;
    CREATE TABLE two.t2(c, d);
    PRAGMA two.journal_mode;
  }
} {wal}
do_test doltlite_recover_jrnlwal_4-7.2 {
  catchsql {PRAGMA two.journal_mode = delete}
} [list 1 $JM_ERR]
do_execsql_test doltlite_recover_jrnlwal_4-7.3 {
  PRAGMA two.journal_size_limit = 10240;
} {-1}
do_test doltlite_recover_jrnlwal_4-7.4 {
  execsql {
    BEGIN;
    INSERT INTO t1 VALUES(20);
    INSERT INTO two.t2 VALUES(1, 2);
    COMMIT;
  }
  list [execsql {SELECT c, d FROM two.t2}] [glob -nocomplain test.db*mj*]
} {{1 2} {}}
do_execsql_test doltlite_recover_jrnlwal_4-7.5 {
  BEGIN IMMEDIATE;
  INSERT OR IGNORE INTO two.t2 SELECT x, x FROM t1;
  COMMIT;
  SELECT count(*) FROM two.t2;
} {6}
do_test doltlite_recover_jrnlwal_4-7.6 {
  execsql { ATTACH ':memory:' AS aux1 }
  list [execsql {PRAGMA aux1.journal_mode}] \
       [execsql {PRAGMA aux1.journal_mode = delete}]
} {memory memory}
do_test doltlite_recover_jrnlwal_4-7.7 {
  execsql { DETACH aux1; DETACH two; }
} {}
do_test doltlite_recover_jrnlwal_4-7.8 {
  db close
  sqlite3 db test.db
  execsql {
    ATTACH 'test2.db' AS two;
    SELECT count(*) FROM two.t2;
    PRAGMA two.integrity_check;
  }
} {6 ok}
do_test doltlite_recover_jrnlwal_4-7.9 {
  execsql { DETACH two }
} {}

#-------------------------------------------------------------------------
# 8.*: :memory: and temp databases keep their own journal modes.
#
do_test doltlite_recover_jrnlwal_4-8.1 {
  sqlite3 db3 :memory:
  list [execsql {PRAGMA main.journal_mode} db3] \
       [catchsql {PRAGMA main.journal_mode = wal} db3] \
       [catchsql {PRAGMA main.journal_mode = delete} db3]
} [list memory {0 memory} [list 1 $JM_ERR]]
do_test doltlite_recover_jrnlwal_4-8.2 {
  execsql {
    CREATE TABLE m(x);
    INSERT INTO m VALUES(1);
    SELECT * FROM m;
    PRAGMA main.journal_mode;
  } db3
} {1 memory}
do_test doltlite_recover_jrnlwal_4-8.3 {
  db3 close
  sqlite3 db3 ""
  execsql {
    PRAGMA main.journal_mode;
    PRAGMA main.journal_mode = wal;
  } db3
} {delete delete}
do_test doltlite_recover_jrnlwal_4-8.4 {
  set r [execsql {
    CREATE TABLE m(x);
    INSERT INTO m VALUES(2);
    SELECT * FROM m;
  } db3]
  db3 close
  set r
} {2}
do_execsql_test doltlite_recover_jrnlwal_4-8.5 {
  CREATE TEMP TABLE tt(x);
  BEGIN;
  INSERT INTO tt VALUES(5);
  COMMIT;
  SELECT * FROM tt;
} {5}

#-------------------------------------------------------------------------
# 9.*: rollback signature + fsync instrumentation contract (trans-9 class).
#
do_test doltlite_recover_jrnlwal_4-9.1 {
  execsql {
    CREATE TABLE t3(i INTEGER PRIMARY KEY, x TEXT);
    WITH s(i) AS (SELECT 1 UNION ALL SELECT i+1 FROM s WHERE i<64)
      INSERT INTO t3 SELECT i, printf('row-%04d-%s', i, hex(zeroblob(40))) FROM s;
  }
  set ::sig [execsql {SELECT count(*), md5sum(x) FROM t3}]
  lindex $::sig 0
} {64}
do_execsql_test doltlite_recover_jrnlwal_4-9.2 {
  PRAGMA fullfsync = ON;
  PRAGMA fullfsync;
} {1}
do_test doltlite_recover_jrnlwal_4-9.3 {
  execsql {
    BEGIN;
    DELETE FROM t3 WHERE i%10!=0;
    INSERT INTO t3 SELECT i+1000, 'x'||x FROM t3;
    ROLLBACK;
  }
  expr {[execsql {SELECT count(*), md5sum(x) FROM t3}] eq $::sig}
} {1}
do_test doltlite_recover_jrnlwal_4-9.4 {
  execsql { PRAGMA fullfsync = OFF }
  set ::sqlite_sync_count 0
  set ::sqlite_fullsync_count 0
  execsql {
    INSERT INTO t3 VALUES(2000, 'sync-probe');
    DELETE FROM t3 WHERE i=2000;
  }
  list [expr {$::sqlite_sync_count > 0}] $::sqlite_fullsync_count \
       [expr {[execsql {SELECT count(*), md5sum(x) FROM t3}] eq $::sig}]
} {1 0 1}
do_test doltlite_recover_jrnlwal_4-9.5 {
  db close
  sqlite3 db test.db
  list [expr {[execsql {SELECT count(*), md5sum(x) FROM t3}] eq $::sig}] \
       [execsql {PRAGMA integrity_check}]
} {1 ok}

#-------------------------------------------------------------------------
# 10.*: pager-metric pragmas: cache_size echo, freelist_count, auto_vacuum
# and incremental_vacuum no-ops, user_version, lock_status.
#
do_execsql_test doltlite_recover_jrnlwal_4-10.1 {
  PRAGMA main.cache_size = 10;
  PRAGMA main.cache_size;
} {10}
do_test doltlite_recover_jrnlwal_4-10.2 {
  sqlite3 db2 test.db
  set r [list [execsql {PRAGMA main.cache_size}] \
              [execsql {PRAGMA main.cache_size} db2] \
              [execsql {SELECT count(*) FROM t1} db2]]
  db2 close
  set r
} {10 -2000 5}
do_execsql_test doltlite_recover_jrnlwal_4-10.3 {
  CREATE TABLE drops(x);
  DROP TABLE drops;
  PRAGMA freelist_count;
} {0}
do_test doltlite_recover_jrnlwal_4-10.4 {
  list [execsql {PRAGMA auto_vacuum}] \
       [catchsql {PRAGMA auto_vacuum = 1}] \
       [catchsql {PRAGMA auto_vacuum = 2}] \
       [execsql {PRAGMA auto_vacuum}]
} {0 {0 {}} {0 {}} 0}
do_test doltlite_recover_jrnlwal_4-10.5 {
  list [catchsql {PRAGMA incremental_vacuum}] \
       [execsql {SELECT count(*) FROM t1}]
} {{0 {}} 5}
do_execsql_test doltlite_recover_jrnlwal_4-10.6 {
  PRAGMA cache_size = 1;
  CREATE TABLE abc(a, b, c);
  INSERT INTO abc VALUES(1, 2, zeroblob(2000));
  DELETE FROM abc;
  SELECT count(*) FROM abc;
} {0}
do_execsql_test doltlite_recover_jrnlwal_4-10.7 {
  PRAGMA user_version = 5;
  PRAGMA user_version;
} {5}
do_execsql_test doltlite_recover_jrnlwal_4-10.8 {
  PRAGMA lock_status;
} {main unlocked temp unknown}

#-------------------------------------------------------------------------
# 11.*: durability + content-hash stability across reopen.
#
do_test doltlite_recover_jrnlwal_4-11.1 {
  set ::h1 [execsql {SELECT dolt_hashof_table('t1')}]
  db close
  sqlite3 db test.db
  list [expr {[execsql {SELECT dolt_hashof_table('t1')}] eq $::h1}] \
       [execsql {SELECT x FROM t1 ORDER BY x}]
} {1 {7 10 20 101 104}}
do_execsql_test doltlite_recover_jrnlwal_4-11.2 {
  PRAGMA journal_mode;
  PRAGMA integrity_check;
} {wal ok}

finish_test
