set testdir [file dirname $argv0]
source $testdir/tester.tcl


do_test doltlite_recover_ordering-1.1 {
  execsql {
    CREATE TABLE tkt2526(a,b,c PRIMARY KEY);
    INSERT INTO tkt2526 VALUES('x','y',1);
    INSERT INTO tkt2526 VALUES('x','z',2);
  }
  catchsql {
    SELECT count(a) AS cn FROM tkt2526 GROUP BY a HAVING cn<max(cn)
  }
} {1 {misuse of aliased aggregate cn}}
do_test doltlite_recover_ordering-1.2 {
  execsql {SELECT a, count(a) FROM tkt2526 GROUP BY a ORDER BY a}
} {x 2}

do_test doltlite_recover_ordering-2.1 {
  execsql {
    CREATE TABLE t3(
      a text,
      b int,
      c float,
      PRIMARY KEY(b)
    );
  }
  for {set i 1} {$i<=50} {incr i} {
    execsql "INSERT INTO t3 VALUES('x${i}x',$i,0.$i)"
  }
  execsql {SELECT c FROM t3 WHERE b==10}
} {0.1}
do_test doltlite_recover_ordering-2.2 {
  set res [list]
  db eval {EXPLAIN QUERY PLAN SELECT c FROM t3 WHERE b==10} x {
    lappend res [set x(detail)]
  }
  set res
} {{SEARCH t3 USING PRIMARY KEY (b=?)}}

do_test doltlite_recover_ordering-3.1 {
  execsql {
   CREATE TABLE t5(
      a int UNIQUE,
      b float PRIMARY KEY,
      c varchar(10),
      UNIQUE(a,c)
   );
   INSERT INTO t5 VALUES(1,2,3);
   SELECT * FROM t5;
  }
} {1 2.0 3}
do_test doltlite_recover_ordering-3.2 {
  execsql {
    SELECT name FROM sqlite_master WHERE type='index' AND tbl_name='t5'
    ORDER BY name
  }
} {sqlite_autoindex_t5_1 sqlite_autoindex_t5_2 sqlite_autoindex_t5_3}
do_test doltlite_recover_ordering-3.3 {
  catchsql {INSERT INTO t5 VALUES(2,2,4)}
} {1 {UNIQUE constraint failed: t5.b}}
do_test doltlite_recover_ordering-3.4 {
  catchsql {INSERT INTO t5 VALUES(1,3,4)}
} {1 {UNIQUE constraint failed: t5.a}}
do_test doltlite_recover_ordering-3.5 {
  catchsql {DROP INDEX 'sqlite_autoindex_t5_1'}
} {1 {index associated with UNIQUE or PRIMARY KEY constraint cannot be dropped}}
do_test doltlite_recover_ordering-3.6 {
  catchsql {DROP INDEX 'sqlite_autoindex_t5_3'}
} {1 {index associated with UNIQUE or PRIMARY KEY constraint cannot be dropped}}

do_test doltlite_recover_ordering-4.1 {
  execsql {
    CREATE TABLE t7(c, d UNIQUE, UNIQUE(c), PRIMARY KEY(c, d) );
    SELECT name FROM sqlite_master WHERE tbl_name = 't7' AND type = 'index'
    ORDER BY name;
  }
} {sqlite_autoindex_t7_1 sqlite_autoindex_t7_2 sqlite_autoindex_t7_3}
do_test doltlite_recover_ordering-4.2 {
  execsql {INSERT INTO t7 VALUES(1, 2)}
  list [catchsql {INSERT INTO t7 VALUES(1, 3)}] \
       [catchsql {INSERT INTO t7 VALUES(2, 2)}]
} {{1 {UNIQUE constraint failed: t7.c}} {1 {UNIQUE constraint failed: t7.d}}}
do_test doltlite_recover_ordering-4.3 {
  catchsql {DROP INDEX sqlite_autoindex_t7_1}
} {1 {index associated with UNIQUE or PRIMARY KEY constraint cannot be dropped}}
do_test doltlite_recover_ordering-4.4 {
  catchsql {DROP INDEX sqlite_autoindex_t7_2}
} {1 {index associated with UNIQUE or PRIMARY KEY constraint cannot be dropped}}

do_test doltlite_recover_ordering-5.1 {
  execsql {
    CREATE TABLE collate4t2(
      a PRIMARY KEY COLLATE NOCASE,
      b UNIQUE
    );
    INSERT INTO collate4t2 VALUES( 'a', 'a' );
    INSERT INTO collate4t2 VALUES( 'B', 'B' );
  }
} {}
do_test doltlite_recover_ordering-5.2 {
  catchsql {INSERT INTO collate4t2 VALUES(NULL, NULL)}
} {1 {NOT NULL constraint failed: collate4t2.a}}
do_test doltlite_recover_ordering-5.3 {
  catchsql {INSERT INTO collate4t2 VALUES('A', 'x')}
} {1 {UNIQUE constraint failed: collate4t2.a}}
do_test doltlite_recover_ordering-5.4 {
  execsql {SELECT a FROM collate4t2 ORDER BY a}
} {a B}
do_test doltlite_recover_ordering-5.5 {
  execsql {SELECT a FROM collate4t2 ORDER BY a COLLATE BINARY}
} {B a}

do_test doltlite_recover_ordering-6.1 {
  execsql {
    CREATE TABLE sales(emp TEXT PRIMARY KEY, region, total);
    INSERT INTO sales VALUES
        ('Alice',     'North', 34),
        ('Frank',     'South', 22),
        ('Charles',   'North', 45),
        ('Darrell',   'South', 8),
        ('Grant',     'South', 23),
        ('Brad' ,     'North', 22),
        ('Elizabeth', 'South', 99),
        ('Horace',    'East',   1);
  }
  execsql {
    SELECT emp, region, (
      SELECT sum(total) OVER (
        ORDER BY total RANGE BETWEEN UNBOUNDED PRECEDING AND UNBOUNDED FOLLOWING
      ) || outer.emp FROM sales
    ) FROM sales AS outer ORDER BY outer.emp;
  }
} {Alice North 254Alice Brad North 254Brad Charles North 254Charles Darrell South 254Darrell Elizabeth South 254Elizabeth Frank South 254Frank Grant South 254Grant Horace East 254Horace}
do_test doltlite_recover_ordering-6.2 {
  execsql {
    SELECT emp, region, (
      SELECT sum(total) FILTER (WHERE sales.emp!=outer.emp) OVER (
        ORDER BY total RANGE BETWEEN UNBOUNDED PRECEDING AND UNBOUNDED FOLLOWING
      ) FROM sales
    ) FROM sales AS outer ORDER BY outer.emp;
  }
} {Alice North 220 Brad North 232 Charles North 209 Darrell South 246 Elizabeth South 155 Frank South 232 Grant South 231 Horace East 253}

do_test doltlite_recover_ordering-7.1 {
  execsql {
    CREATE TABLE b1(one PRIMARY KEY, two);
    INSERT INTO b1 VALUES(1, 'o');
    INSERT INTO b1 VALUES(4, 'f');
    INSERT INTO b1 VALUES(3, 't');
    INSERT INTO b1 VALUES(2, 't');
    INSERT INTO b1 VALUES(5, 'f');
    INSERT INTO b1 VALUES(7, 's');
    INSERT INTO b1 VALUES(6, 's');
  }
  execsql {
    SELECT (one==2 OR two=='o') AS g, count(*), sum(one)
    FROM b1 GROUP BY g ORDER BY g
  }
} {0 5 25 1 2 3}
do_test doltlite_recover_ordering-7.2 {
  execsql {
    SELECT (one==2 OR two=='o') AS g, group_concat(one)
    FROM b1 GROUP BY g ORDER BY g
  }
} {0 3,4,5,6,7 1 1,2}

do_test doltlite_recover_ordering-8.1 {
  execsql {
    CREATE TABLE de(d PRIMARY KEY, e);
    INSERT INTO de VALUES('Ubon', 120000);
    INSERT INTO de VALUES('Khon Kaen', 200000);
  }
  sqlite3 db2 test.db
  execsql {
    BEGIN;
    INSERT INTO de VALUES('Pataya', 30000);
  } db2
  db2 close
  execsql {SELECT * FROM de ORDER BY d}
} {{Khon Kaen} 200000 Ubon 120000}
do_test doltlite_recover_ordering-8.2 {
  execsql {
    INSERT INTO de VALUES('Chiang Mai', 100000);
    SELECT d FROM de ORDER BY d;
  }
} {{Chiang Mai} {Khon Kaen} Ubon}

do_test doltlite_recover_ordering-9.1 {
  execsql {
    CREATE TABLE cf1(a PRIMARY KEY, b, c);
    CREATE INDEX cfi1 ON cf1(b);
    INSERT INTO cf1 VALUES(1, 2,  zeroblob(600));
    INSERT INTO cf1 VALUES(3, 4,  zeroblob(600));
    INSERT INTO cf1 VALUES(5, 6,  zeroblob(600));
    INSERT INTO cf1 VALUES(7, 8,  zeroblob(600));
    INSERT INTO cf1 VALUES(9, 10, zeroblob(600));
    BEGIN;
    UPDATE cf1 SET b=b+1;
  }
  set result [list]
  db eval { SELECT a, b FROM cf1 ORDER BY a } {
    if {$a==5} { catch { sqlite3_db_cacheflush db } }
    lappend result $a $b
  }
  set result
} {1 3 3 5 5 7 7 9 9 11}
do_test doltlite_recover_ordering-9.2 {
  sqlite3_get_autocommit db
} {0}
do_test doltlite_recover_ordering-9.3 {
  execsql {
    INSERT INTO cf1 VALUES(11, 12, zeroblob(600));
    COMMIT;
  }
  execsql {SELECT a, b FROM cf1 ORDER BY a}
} {1 3 3 5 5 7 7 9 9 11 11 12}
do_test doltlite_recover_ordering-9.4 {
  db close
  sqlite3 db test.db
  execsql {SELECT a, b FROM cf1 ORDER BY a}
} {1 3 3 5 5 7 7 9 9 11 11 12}
do_test doltlite_recover_ordering-9.5 {
  execsql {PRAGMA integrity_check}
} {ok}

do_test doltlite_recover_ordering-10.1 {
  execsql {
    BEGIN;
    UPDATE cf1 SET b=b-1;
  }
  catch { sqlite3_db_cacheflush db }
  catch { sqlite3_db_release_memory db }
  catch { sqlite3_db_cacheflush db }
  execsql { SELECT a, b FROM cf1 ORDER BY a }
} {1 2 3 4 5 6 7 8 9 10 11 11}
do_test doltlite_recover_ordering-10.2 {
  execsql {ROLLBACK}
  execsql {SELECT a, b FROM cf1 ORDER BY a}
} {1 3 3 5 5 7 7 9 9 11 11 12}
do_test doltlite_recover_ordering-10.3 {
  execsql {PRAGMA integrity_check}
} {ok}

do_test doltlite_recover_ordering-11.1 {
  execsql {
    CREATE TABLE x1(a, b, c);
    CREATE INDEX x1b ON x1(b);
    CREATE TABLE x2(q);
    INSERT INTO x1 VALUES(1, 2, 3);
    ALTER TABLE x1 RENAME b TO bbb;
  }
  execsql {
    SELECT sql FROM sqlite_master
    WHERE name IN ('x1','x1b','x2') ORDER BY name
  }
} {{CREATE TABLE x1(a, bbb, c)} {CREATE INDEX x1b ON x1(bbb)} {CREATE TABLE x2(q)}}
do_test doltlite_recover_ordering-11.2 {
  execsql {SELECT bbb FROM x1 WHERE bbb=2 ORDER BY a}
} {2}

do_test doltlite_recover_ordering-12.1 {
  execsql {
    CREATE TABLE lt1(a,b);
    WITH RECURSIVE c(x) AS (VALUES(1) UNION ALL SELECT x+1 FROM c WHERE x<1000)
      INSERT INTO lt1(a,b) SELECT 1, (x*17)%1000 + 1000 FROM c;
    INSERT INTO lt1(a,b) VALUES(2,2),(3,1006),(4,4),(5,9999);
    CREATE INDEX lt1ab ON lt1(a,b);
    CREATE TABLE lt2(x,y);
    INSERT INTO lt2(x,y) VALUES('a',1),('a',2),('a',3),('a',4);
    INSERT INTO lt2(x,y) VALUES('b',1),('c',2),('d',3),('e',4);
    CREATE INDEX lt2xy ON lt2(x,y);
  }
  execsql {
    SELECT a, b, '|' FROM lt2, lt1
    WHERE lt2.x='a' AND lt1.a=lt2.y ORDER BY lt1.b LIMIT 5
  }
} {2 2 | 4 4 | 1 1000 | 1 1001 | 1 1002 |}
do_test doltlite_recover_ordering-12.2 {
  execsql {
    SELECT a, b, '|' FROM lt2, lt1
    WHERE lt2.x='a' AND lt1.a=lt2.y ORDER BY +lt1.b LIMIT 5
  }
} {2 2 | 4 4 | 1 1000 | 1 1001 | 1 1002 |}
do_test doltlite_recover_ordering-12.3 {
  set res [list]
  db eval {
    EXPLAIN QUERY PLAN SELECT a, b, '|' FROM lt2, lt1
    WHERE lt2.x='a' AND lt1.a=lt2.y ORDER BY lt1.b LIMIT 5
  } x {
    lappend res [set x(detail)]
  }
  set res
} {{SEARCH lt2 USING COVERING INDEX lt2xy (x=?)} {SEARCH lt1 USING COVERING INDEX lt1ab (a=?)} {USE TEMP B-TREE FOR ORDER BY}}
do_test doltlite_recover_ordering-12.4 {
  set res [list]
  db eval {
    EXPLAIN QUERY PLAN SELECT a, b, '|' FROM lt2, lt1
    WHERE lt2.x='a' AND lt1.a=lt2.y ORDER BY +lt1.b LIMIT 5
  } x {
    lappend res [set x(detail)]
  }
  set res
} {{SEARCH lt2 USING COVERING INDEX lt2xy (x=?)} {SEARCH lt1 USING COVERING INDEX lt1ab (a=?)} {USE TEMP B-TREE FOR ORDER BY}}

finish_test
