set testdir [file dirname $argv0]
source $testdir/tester.tcl
database_may_be_corrupt

set testprefix doltlite_recover_rtree

ifcapable !rtree { finish_test ; return }


do_execsql_test 1.1 {
  CREATE VIRTUAL TABLE t1 USING rtree_i32(id, x1, x2);
}
do_test 1.2 {
  for {set i 1} {$i<=50} {incr i} {
    execsql { INSERT INTO t1 VALUES($i, $i, $i+2) }
  }
} {}
do_execsql_test 1.3 {
  SELECT count(*) FROM t1;
} {50}
do_execsql_test 1.4 {
  DELETE FROM t1_node;
}
do_catchsql_test 1.5 {
  DELETE FROM t1 WHERE id=1;
} {1 {database disk image is malformed}}
do_execsql_test 1.6 {
  DROP TABLE t1;
  CREATE VIRTUAL TABLE t1 USING rtree_i32(id, x1, x2);
  INSERT INTO t1 VALUES(1, 1, 3);
  SELECT * FROM t1;
} {1 1 3}

db close
forcedelete test.db
sqlite3 db test.db

do_execsql_test 2.1 {
  CREATE VIRTUAL TABLE t1 USING rtree_i32(id, x1, x2);
  INSERT INTO t1 VALUES(1, 1, 3), (2, 2, 4), (3, 3, 5);
  DELETE FROM t1_node;
}
do_test 2.2 {
  db close
  sqlite3 db test.db
} {}
do_execsql_test 2.3 {
  DROP TABLE t1;
  CREATE VIRTUAL TABLE t1 USING rtree_i32(id, x1, x2);
}
do_execsql_test 2.4 {
  INSERT INTO t1 VALUES(7, 7, 9);
  SELECT * FROM t1;
} {7 7 9}

finish_test
