set testdir [file dirname $argv0]
source $testdir/tester.tcl


db close
forcedelete rloc1.db rloc1b.db rloc1e.db
sqlite3 db rloc1.db
set DB [sqlite3_connection_pointer db]

do_test doltlite_recover_locking_1-1.1 {
  execsql {
    CREATE TABLE t1(a PRIMARY KEY, b, c);
    INSERT INTO t1 VALUES('one', 'I', 1);
    INSERT INTO t1 VALUES('two', 'II', 2);
    INSERT INTO t1 VALUES('three','III',3);
    INSERT INTO t1 VALUES('four','IV',4);
    INSERT INTO t1 VALUES('five','V',5);
    SELECT * FROM t1 ORDER BY a;
  }
} {five V 5 four IV 4 one I 1 three III 3 two II 2}
do_test doltlite_recover_locking_1-1.2 {
  execsql {SELECT * FROM t1}
} [execsql {SELECT * FROM t1 ORDER BY a}]
do_test doltlite_recover_locking_1-1.3 {
  execsql {SELECT a FROM t1 WHERE c>3 ORDER BY c}
} {four five}
do_test doltlite_recover_locking_1-1.4 {
  execsql {
    PRAGMA encoding=UTF16le;
    SELECT a FROM t1 WHERE c>3 ORDER BY c;
  }
} {four five}
do_test doltlite_recover_locking_1-1.5 {
  execsql {
    PRAGMA encoding=UTF16be;
    SELECT * FROM t1 WHERE a='four';
  }
} {four IV 4}

do_test doltlite_recover_locking_1-2.1 {
  execsql {PRAGMA encoding}
} {UTF-8}
do_test doltlite_recover_locking_1-2.2 {
  execsql {PRAGMA encoding=UTF8; PRAGMA encoding;}
} {UTF-8}
do_test doltlite_recover_locking_1-2.3 {
  execsql {PRAGMA encoding=UTF16le; PRAGMA encoding;}
} {UTF-8}
do_test doltlite_recover_locking_1-2.4 {
  execsql {PRAGMA encoding=UTF16be; PRAGMA encoding;}
} {UTF-8}
do_test doltlite_recover_locking_1-2.5 {
  sqlite3 dbe rloc1e.db
  dbe eval {
    PRAGMA encoding='UTF-16le';
    PRAGMA encoding;
  }
} {UTF-8}
do_test doltlite_recover_locking_1-2.6 {
  dbe eval {
    CREATE TABLE zz(t);
    INSERT INTO zz VALUES(char(8364,233,20013));
    PRAGMA encoding;
  }
} {UTF-8}
do_test doltlite_recover_locking_1-2.7 {
  dbe close
  sqlite3 dbe rloc1e.db
  dbe eval {
    SELECT unicode(t), unicode(substr(t,2,1)), unicode(substr(t,3,1)), length(t) FROM zz;
    PRAGMA encoding;
  }
} {8364 233 20013 3 UTF-8}
do_test doltlite_recover_locking_1-2.8 {
  sqlite3 dbe2 rloc1e.db
  set res [dbe2 eval {SELECT name FROM sqlite_master ORDER BY name; PRAGMA encoding;}]
  dbe2 close
  dbe close
  set res
} {zz UTF-8}

do_test doltlite_recover_locking_1-3.1 {
  sqlite3 dbx rloc1b.db
  dbx eval {CREATE TABLE abc(a,b,c); INSERT INTO abc VALUES(1,2,3);}
  dbx close
  execsql {
    ATTACH 'rloc1b.db' AS aux;
    SELECT * FROM aux.abc;
  }
} {1 2 3}
do_test doltlite_recover_locking_1-3.2 {
  execsql {DETACH aux}
} {}

set ::values [list one two three four five]
set ::test_collate_enc INVALID
proc test_collate {enc lhs rhs} {
  set ::test_collate_enc $enc
  set l [lsearch -exact $::values $lhs]
  set r [lsearch -exact $::values $rhs]
  return [expr $l - $r]
}
do_test doltlite_recover_locking_1-4.0 {
  execsql {
    CREATE TABLE t5(a);
    INSERT INTO t5 VALUES('one');
    INSERT INTO t5 VALUES('two');
    INSERT INTO t5 VALUES('five');
    INSERT INTO t5 VALUES('three');
    INSERT INTO t5 VALUES('four');
  }
} {}
do_test doltlite_recover_locking_1-4.1 {
  add_test_collate $DB 1 1 1
  set res [execsql {SELECT * FROM t5 ORDER BY 1 COLLATE test_collate}]
  lappend res $::test_collate_enc
} {one two three four five UTF-8}
do_test doltlite_recover_locking_1-4.2 {
  add_test_collate $DB 0 1 0
  set res [execsql {SELECT a FROM t5 ORDER BY 1 COLLATE test_collate}]
  lappend res $::test_collate_enc
} {one two three four five UTF-16LE}
do_test doltlite_recover_locking_1-4.3 {
  add_test_collate $DB 0 0 1
  set res [execsql {SELECT a AS aa FROM t5 ORDER BY 1 COLLATE test_collate}]
  lappend res $::test_collate_enc
} {one two three four five UTF-16BE}
do_test doltlite_recover_locking_1-4.4 {
  add_test_collate $DB 0 0 0
  add_test_collate_needed $DB
  set res [execsql {SELECT a FROM t5 ORDER BY a COLLATE test_collate}]
  lappend res $::test_collate_enc
} {one two three four five UTF-8}

proc test_function {enc arg} { return "$enc $arg" }
do_test doltlite_recover_locking_1-5.1 {
  add_test_function $DB 1 1 1
  execsql {SELECT test_function('sqlite')}
} {{UTF-8 sqlite}}
db close
sqlite3 db rloc1.db
set DB [sqlite3_connection_pointer db]
do_test doltlite_recover_locking_1-5.2 {
  add_test_function $DB 0 1 0
  execsql {SELECT test_function('sqlite')}
} {{UTF-16LE sqlite}}
db close
sqlite3 db rloc1.db
set DB [sqlite3_connection_pointer db]
do_test doltlite_recover_locking_1-5.3 {
  add_test_function $DB 0 0 1
  execsql {SELECT test_function('sqlite')}
} {{UTF-16BE sqlite}}

do_test doltlite_recover_locking_1-6.1 {
  execsql {
    PRAGMA encoding=UTF16le;
    WITH separator(x) AS (VALUES(',a,'),(',bc,')),
         value(y) AS (VALUES(1),(x'5585d09013455178cd11ce4a'))
    SELECT hex(group_concat(y,x) OVER (ORDER BY x ROWS BETWEEN 1 PRECEDING AND 1 PRECEDING))
    FROM separator, value;
  }
} {{} 31 5585D09013455178CD11CE4A 31}
do_test doltlite_recover_locking_1-6.2 {
  execsql {
    PRAGMA encoding=UTF16be;
    WITH separator(x) AS (VALUES(',a,'),(',bc,')),
         value(y) AS (VALUES(1),(x'5585d09013455178cd11ce4a'))
    SELECT hex(group_concat(y,x) OVER (ORDER BY x ROWS BETWEEN 1 PRECEDING AND 1 PRECEDING))
    FROM separator, value;
  }
} {{} 31 5585D09013455178CD11CE4A 31}

do_test doltlite_recover_locking_1-7.1 {
  list [sqlite3_enable_shared_cache 1] [sqlite3_enable_shared_cache]
} {0 0}
do_test doltlite_recover_locking_1-7.2 {
  execsql {CREATE TABLE c1(a PRIMARY KEY, b); INSERT INTO c1 VALUES(1,2);}
  sqlite3 db2 rloc1.db
  db2 eval {SELECT * FROM c1}
} {1 2}
do_test doltlite_recover_locking_1-7.3 {
  execsql {BEGIN; INSERT INTO c1 VALUES(3,4); CREATE TABLE c2(x);}
  db2 eval {SELECT * FROM c1 ORDER BY a}
} {1 2}
do_test doltlite_recover_locking_1-7.4 {
  catchsql {INSERT INTO c1 VALUES(5,6)} db2
} {1 {database is locked}}
do_test doltlite_recover_locking_1-7.5 {
  execsql {COMMIT}
  list [execsql {SELECT * FROM c1 ORDER BY a}] [db2 eval {SELECT * FROM c1 ORDER BY a}]
} {{1 2 3 4} {1 2 3 4}}
do_test doltlite_recover_locking_1-7.6 {
  execsql {BEGIN EXCLUSIVE}
  list [db2 eval {SELECT * FROM c1 ORDER BY a}] [catchsql {INSERT INTO c1 VALUES(7,8)} db2]
} {{1 2 3 4} {1 {database is locked}}}
do_test doltlite_recover_locking_1-7.7 {
  list [catchsql {BEGIN EXCLUSIVE} db2] [catchsql {BEGIN IMMEDIATE} db2]
} {{1 {database is locked}} {1 {database is locked}}}
do_test doltlite_recover_locking_1-7.8 {
  db2 eval {BEGIN; SELECT count(*) FROM c1; COMMIT;}
} {2}
do_test doltlite_recover_locking_1-7.9 {
  execsql {INSERT INTO c1 VALUES(7,8); COMMIT;}
  db2 eval {SELECT * FROM c1 ORDER BY a}
} {1 2 3 4 7 8}
do_test doltlite_recover_locking_1-7.10 {
  set ::S1 [sqlite3_prepare db2 "SELECT a FROM c1 ORDER BY a" -1 TAIL]
  list [sqlite3_step $::S1] [catchsql {BEGIN EXCLUSIVE}] \
       [catchsql {INSERT INTO c1 VALUES(9,10)}] [catchsql {COMMIT}]
} {SQLITE_ROW {0 {}} {0 {}} {0 {}}}
do_test doltlite_recover_locking_1-7.11 {
  set res {}
  while {[sqlite3_step $::S1] eq "SQLITE_ROW"} {
    lappend res [sqlite3_column_text $::S1 0]
  }
  lappend res [sqlite3_finalize $::S1]
} {3 7 SQLITE_OK}
do_test doltlite_recover_locking_1-7.12 {
  list [db2 eval {SELECT count(*) FROM c1}] [execsql {SELECT count(*) FROM c1}] \
       [execsql {PRAGMA integrity_check}] [db2 eval {PRAGMA integrity_check}]
} {4 4 ok ok}
do_test doltlite_recover_locking_1-7.13 {
  db2 eval {BEGIN; SELECT count(*) FROM c1;}
  set res [list [catchsql {BEGIN EXCLUSIVE}] [catchsql {COMMIT}]]
  db2 eval {COMMIT}
  set res
} {{0 {}} {0 {}}}
do_test doltlite_recover_locking_1-7.14 {
  execsql {BEGIN; SELECT count(*) FROM c1;}
  set w [catchsql {INSERT INTO c1 VALUES(11,12)} db2]
  set during [execsql {SELECT count(*) FROM c1}]
  execsql {COMMIT}
  list $w $during [execsql {SELECT count(*) FROM c1}]
} {{0 {}} 4 5}
do_test doltlite_recover_locking_1-7.15 {
  db2 eval {BEGIN; SELECT count(*) FROM c1;}
  execsql {BEGIN}
  set w [catchsql {INSERT INTO c1 VALUES(13,14)}]
  execsql {COMMIT}
  set in2 [db2 eval {SELECT count(*) FROM c1}]
  db2 eval {COMMIT}
  list $w $in2 [db2 eval {SELECT count(*) FROM c1}]
} {{0 {}} 5 6}
do_test doltlite_recover_locking_1-7.16 {
  sqlite3 db3 rloc1.db
  set res [db3 eval {BEGIN; ROLLBACK; SELECT count(*) FROM c1;}]
  db3 close
  set res
} {6}
do_test doltlite_recover_locking_1-7.17 {
  set got {}
  db eval {SELECT a FROM c1 ORDER BY a} {
    lappend got $a
    if {$a==1} {
      lappend got [catch {db2 eval {INSERT INTO c1 VALUES(0,0)}}]
    }
  }
  set got
} {1 0 3 7 9 11 13}
do_test doltlite_recover_locking_1-7.18 {
  set n 0
  set w {}
  db eval {SELECT a FROM c1 ORDER BY a} {
    incr n
    if {$n==2} { set w [catch {db2 eval {DELETE FROM c1}}] }
  }
  list $n $w [execsql {SELECT count(*) FROM c1}]
} {7 0 0}
do_test doltlite_recover_locking_1-7.19 {
  execsql {INSERT INTO c1 VALUES(1,2),(2,3),(3,4)}
  set got {}
  db eval {SELECT a FROM c1 ORDER BY a} {
    if {$a==1} {
      lappend got [catch {db eval {DROP TABLE c1}} msg] $msg
    }
  }
  set got
} {1 {database table is locked}}
do_test doltlite_recover_locking_1-7.20 {
  db2 eval {PRAGMA read_uncommitted=1}
  execsql {BEGIN; INSERT INTO c1 VALUES(4,5);}
  set res [db2 eval {SELECT count(*) FROM c1}]
  execsql {COMMIT}
  list $res [db2 eval {SELECT count(*) FROM c1}]
} {3 4}
do_test doltlite_recover_locking_1-7.21 {
  sqlite3 db4 rloc1b.db
  execsql {ATTACH 'rloc1b.db' AS aux}
  db4 eval {BEGIN IMMEDIATE; INSERT INTO abc VALUES(4,5,6);}
  set r1 [catchsql {BEGIN EXCLUSIVE}]
  db4 eval {COMMIT}
  db4 close
  set r2 [execsql {SELECT count(*) FROM aux.abc}]
  set r3 [catchsql {INSERT INTO aux.abc VALUES(7,8,9)}]
  list $r1 $r2 $r3 [execsql {SELECT count(*) FROM aux.abc}]
} {{1 {database is locked}} 2 {0 {}} 3}
do_test doltlite_recover_locking_1-7.22 {
  execsql {DETACH aux}
  db2 close
} {}

do_test doltlite_recover_locking_1-8.1 {
  execsql {
    DELETE FROM c1;
    INSERT INTO c1 VALUES(1,2),(4,5),(7,8);
    PRAGMA locking_mode=exclusive;
  }
} {exclusive}
do_test doltlite_recover_locking_1-8.2 {
  execsql {SELECT count(*) FROM c1}
  sqlite3 db2 rloc1.db
  db2 eval {INSERT INTO c1 VALUES(10,11); SELECT count(*) FROM c1;}
} {4}
do_test doltlite_recover_locking_1-8.3 {
  execsql {SELECT count(*) FROM c1}
} {4}
do_test doltlite_recover_locking_1-8.4 {
  db2 eval {BEGIN; INSERT INTO c1 VALUES(13,14); ROLLBACK; SELECT count(*) FROM c1;}
} {4}
do_test doltlite_recover_locking_1-8.5 {
  execsql {INSERT INTO c1 VALUES(16,17)}
  db2 eval {SELECT count(*) FROM c1}
} {5}
do_test doltlite_recover_locking_1-8.6 {
  execsql {PRAGMA locking_mode=normal}
  list [execsql {SELECT count(*) FROM c1}] [db2 eval {SELECT count(*) FROM c1}]
} {5 5}
do_test doltlite_recover_locking_1-8.7 {
  execsql {
    PRAGMA locking_mode=exclusive;
    BEGIN;
    DELETE FROM c1;
    COMMIT;
    INSERT INTO c1 VALUES('A','B');
  }
  db2 close
  db close
  sqlite3 db rloc1.db
  set DB [sqlite3_connection_pointer db]
  execsql {SELECT * FROM c1}
} {A B}
do_test doltlite_recover_locking_1-8.8 {
  execsql {
    BEGIN;
    UPDATE c1 SET a=1, b=2;
    ROLLBACK;
    SELECT * FROM c1;
  }
} {A B}
do_test doltlite_recover_locking_1-8.9 {
  execsql {
    CREATE TABLE abc2(a UNIQUE, b UNIQUE, c UNIQUE);
    PRAGMA locking_mode=exclusive;
    BEGIN;
    INSERT INTO abc2 VALUES(1,2,3);
    INSERT INTO abc2 SELECT a+1, b+1, c+1 FROM abc2;
  }
  set conflict [catchsql {INSERT INTO abc2 SELECT a, b, c FROM abc2}]
  execsql {COMMIT}
  list $conflict [execsql {SELECT * FROM abc2 ORDER BY a}] \
       [execsql {PRAGMA locking_mode=normal}]
} {{1 {UNIQUE constraint failed: abc2.c}} {1 2 3 2 3 4} normal}
do_test doltlite_recover_locking_1-8.10 {
  execsql {BEGIN; INSERT INTO abc2 VALUES(10,11,12);}
  sqlite3 db2 rloc1.db
  set res [db2 eval {SELECT count(*) FROM abc2}]
  execsql {ROLLBACK}
  list $res [db2 eval {SELECT count(*) FROM abc2}] [execsql {SELECT count(*) FROM abc2}]
} {2 2 2}
do_test doltlite_recover_locking_1-8.11 {
  db2 close
  execsql {
    PRAGMA locking_mode = EXCLUSIVE;
    PRAGMA journal_mode = WAL;
    PRAGMA locking_mode = NORMAL;
    PRAGMA user_version;
  }
} {exclusive wal normal 0}
do_test doltlite_recover_locking_1-8.12 {
  catchsql {PRAGMA journal_mode = DELETE}
} {0 wal}
do_test doltlite_recover_locking_1-8.13 {
  db close
  sqlite3 db rloc1.db
  set DB [sqlite3_connection_pointer db]
  list [catchsql {PRAGMA journal_mode = DELETE}] \
       [execsql {INSERT INTO abc2 VALUES(7,8,9); SELECT count(*) FROM abc2;}] \
       [execsql {PRAGMA integrity_check}]
} {{0 wal} 3 ok}

do_test doltlite_recover_locking_1-9.1 {
  execsql {CREATE TABLE x1(a PRIMARY KEY, b)}
  execsql {INSERT INTO x1 VALUES(1,'one'),(2,'two')}
  sqlite3 db2 rloc1.db
  set sig1 [execsql {SELECT count(*), group_concat(b) FROM (SELECT b FROM x1 ORDER BY a)}]
  db2 eval {UPDATE x1 SET b='TWO' WHERE a=2}
  set sig2 [execsql {SELECT count(*), group_concat(b) FROM (SELECT b FROM x1 ORDER BY a)}]
  list $sig1 $sig2
} {{2 one,two} {2 one,TWO}}
do_test doltlite_recover_locking_1-9.2 {
  execsql {PRAGMA locking_mode=exclusive; SELECT count(*) FROM x1;}
  db2 eval {UPDATE x1 SET b='II' WHERE a=2}
  set res [execsql {SELECT b FROM x1 WHERE a=2}]
  execsql {PRAGMA locking_mode=normal}
  list $res [execsql {PRAGMA integrity_check}]
} {II ok}
do_test doltlite_recover_locking_1-9.3 {
  set h0 [execsql {SELECT dolt_hashof_table('x1')}]
  execsql {INSERT INTO x1 VALUES(3,'three')}
  set h1 [execsql {SELECT dolt_hashof_table('x1')}]
  execsql {INSERT INTO x1 VALUES(4,'four')}
  set h2 [execsql {SELECT dolt_hashof_table('x1')}]
  execsql {PRAGMA locking_mode=exclusive}
  execsql {INSERT INTO x1 VALUES(5,'five')}
  set h3 [execsql {SELECT dolt_hashof_table('x1')}]
  execsql {SELECT count(*) FROM x1}
  set h4 [execsql {SELECT dolt_hashof_table('x1')}]
  execsql {PRAGMA locking_mode=normal}
  set h5 [execsql {SELECT dolt_hashof_table('x1')}]
  execsql {INSERT INTO x1 VALUES(6,'six')}
  set h6 [execsql {SELECT dolt_hashof_table('x1')}]
  list [expr {$h0 ne $h1}] [expr {$h1 ne $h2}] [expr {$h2 ne $h3}] \
       [expr {$h3 eq $h4}] [expr {$h4 eq $h5}] [expr {$h5 ne $h6}]
} {1 1 1 1 1 1}
do_test doltlite_recover_locking_1-9.4 {
  db2 close
} {}

# Missing parent: stock-compatible CANTOPEN at open (no deferred phantom).
do_test doltlite_recover_locking_1-10.1 {
  set dbh [sqlite3_open /bogus/path/rloc1.db {}]
  list [sqlite3_errcode $dbh] [sqlite3_errmsg $dbh]
} {SQLITE_CANTOPEN {unable to open database file}}
do_test doltlite_recover_locking_1-10.2 {
  sqlite3_close $dbh
  set rc [catch {sqlite3 dbb /bogus/path/rloc1.db} msg]
  list $rc $msg
} {1 {unable to open database file}}
do_test doltlite_recover_locking_1-10.3 {
  sqlite3_db_config db DEFENSIVE 0
  set r1 [catchsql {
    PRAGMA writable_schema=ON;
    INSERT INTO sqlite_master VALUES(NULL,NULL,NULL,NULL,NULL);
  }]
  catchsql {PRAGMA writable_schema=OFF}
  db close
  set r2 [catch {sqlite3 db rloc1.db}]
  set DB [sqlite3_connection_pointer db]
  list $r1 $r2 [execsql {SELECT count(*) FROM x1}] \
       [execsql {CREATE TABLE post(a); INSERT INTO post VALUES(1); SELECT * FROM post;}] \
       [execsql {PRAGMA integrity_check}]
} {{0 {}} 0 6 1 ok}
do_test doltlite_recover_locking_1-10.4 {
  execsql {
    CREATE TABLE t2(a);
    INSERT INTO t2 VALUES(1);
    INSERT INTO t2 VALUES(2);
    BEGIN;
    INSERT INTO t2 VALUES(3);
  }
  set ::STMT [sqlite3_prepare $DB "SELECT a FROM t2 ORDER BY a" -1 TAIL]
  sqlite3_step $::STMT
  catchsql {ROLLBACK}
  lrange [execsql {PRAGMA lock_status}] 0 1
} {main unlocked}
do_test doltlite_recover_locking_1-10.5 {
  list [sqlite3_step $::STMT] [sqlite3_step $::STMT] [sqlite3_step $::STMT]
} {SQLITE_ROW SQLITE_ROW SQLITE_DONE}
# A data-only ROLLBACK no longer expires the statement (matches stock): after
# the scan drains at 10.5, re-stepping auto-resets and reseeks the restored
# tree, and finalize succeeds.
do_test doltlite_recover_locking_1-10.6 {
  sqlite3_step $::STMT
} {SQLITE_ROW}
do_test doltlite_recover_locking_1-10.7 {
  sqlite3_finalize $::STMT
} {SQLITE_OK}
do_test doltlite_recover_locking_1-10.8 {
  execsql {SELECT a FROM t2 ORDER BY a}
} {1 2}

do_test doltlite_recover_locking_1-11.1 {
  execsql {
    CREATE TABLE tbl2(f1 int PRIMARY KEY, f2 int);
    INSERT INTO tbl2 VALUES(1,10),(2,20),(3,30);
    CREATE INDEX idx1 ON tbl2(f2);
  }
  set eqp [execsql {EXPLAIN QUERY PLAN SELECT f1 FROM tbl2 WHERE f2=20}]
  list [regexp {SEARCH tbl2 USING COVERING INDEX idx1} $eqp] \
       [execsql {SELECT f1 FROM tbl2 WHERE f2=20}]
} {1 2}
do_test doltlite_recover_locking_1-11.2 {
  execsql {DROP INDEX idx1}
  # Distinct SQL text: a cached EXPLAIN statement replays its compiled plan
  # without a cookie check (stock does the same), so a fresh prepare is what
  # actually tests that the planner stopped using the dropped index.
  set eqp [execsql {EXPLAIN QUERY PLAN SELECT f1 FROM tbl2 WHERE f2=20 AND 1}]
  list [regexp {SCAN tbl2} $eqp] [execsql {SELECT f1 FROM tbl2 WHERE f2=20}]
} {1 2}

db close
forcedelete rloc1.db rloc1b.db rloc1e.db
sqlite3 db test.db
finish_test
