set testdir [file dirname $argv0]
source $testdir/tester.tcl


do_test doltlite_recover_rawformat_2-1.1 {
  execsql {PRAGMA page_size}
} {1024}

do_test doltlite_recover_rawformat_2-1.2 {
  execsql {CREATE TABLE t1(x)}
  execsql {INSERT INTO t1 VALUES('one'),('two'),('three')}
  execsql {PRAGMA page_size=2048}
  execsql {PRAGMA page_size}
} {2048}

do_test doltlite_recover_rawformat_2-1.3 {
  execsql {PRAGMA page_size=511}
  set a [execsql {PRAGMA page_size}]
  execsql {PRAGMA page_size=1234}
  set b [execsql {PRAGMA page_size}]
  execsql {PRAGMA page_size=65537}
  set c [execsql {PRAGMA page_size}]
  list $a $b $c
} {2048 2048 2048}

do_test doltlite_recover_rawformat_2-1.4 {
  set h0 [db one {SELECT dolt_hashof_table('t1')}]
  execsql {PRAGMA page_size=8192}
  set h1 [db one {SELECT dolt_hashof_table('t1')}]
  list [execsql {PRAGMA page_size}] [expr {$h0 eq $h1}]
} {8192 1}

do_test doltlite_recover_rawformat_2-1.5 {
  execsql {
    BEGIN;
    INSERT INTO t1 SELECT x||x FROM t1;
    INSERT INTO t1 SELECT x||x FROM t1;
    INSERT INTO t1 SELECT x||x FROM t1;
    INSERT INTO t1 SELECT x||x FROM t1;
  }
  set mid [execsql {SELECT count(*) FROM t1}]
  execsql {ROLLBACK}
  list $mid [execsql {SELECT count(*) FROM t1}] \
      [execsql {PRAGMA integrity_check}]
} {48 3 ok}

do_test doltlite_recover_rawformat_2-1.6 {
  db close
  sqlite3 db test.db
  list [execsql {PRAGMA page_size}] \
      [execsql {SELECT x FROM t1 ORDER BY x}] \
      [expr {[file size test.db] > 0}]
} {1024 {one three two} 1}

do_test doltlite_recover_rawformat_2-1.7 {
  execsql {
    BEGIN;
    SELECT count(*) FROM sqlite_master;
    PRAGMA page_size=2048;
    COMMIT;
  }
  db close
  sqlite3 db test.db
  list [execsql {PRAGMA page_size}] [execsql {PRAGMA integrity_check}]
} {1024 ok}

foreach pgsz {1024 2048 4096 8192} {
  do_test doltlite_recover_rawformat_2-2.$pgsz.1 {
    db close
    forcedelete test.db
    sqlite3 db test.db
    execsql "PRAGMA page_size=$pgsz"
    execsql {BEGIN}
    execsql {CREATE TABLE abc(a, b, c)}
    for {set n 0} {$n < 300} {incr n} {
      execsql "INSERT INTO abc VALUES($n, [expr 2*$n], [expr 3*$n])"
    }
    execsql {COMMIT}
    set ::sig [db eval {SELECT count(*), md5sum(a), md5sum(b), md5sum(c) FROM abc}]
    execsql {BEGIN}
    execsql {INSERT INTO abc SELECT a+10000, 0, 0 FROM abc WHERE a%2==0}
    execsql {DELETE FROM abc WHERE a%3==1}
    execsql {UPDATE abc SET b=b+1 WHERE a%5==0}
    db close
    sqlite3 db test.db
    expr {$::sig eq [db eval {SELECT count(*), md5sum(a), md5sum(b), md5sum(c) FROM abc}]}
  } {1}
  do_test doltlite_recover_rawformat_2-2.$pgsz.2 {
    execsql {PRAGMA integrity_check}
  } {ok}
}

do_test doltlite_recover_rawformat_2-3.1 {
  db close
  forcedelete test.db test2.db
  sqlite3 db test.db
  execsql {
    CREATE TABLE t1(x, y);
    INSERT INTO t1 VALUES(1, 2);
    ATTACH 'test2.db' AS aux;
    CREATE TABLE aux.t2(x, y);
    INSERT INTO t2 VALUES(3, 4);
  }
  catchsql {PRAGMA main.journal_mode = delete}
} {0 wal}

do_test doltlite_recover_rawformat_2-3.1b {
  list [catchsql {PRAGMA aux.journal_mode = delete}] \
      [execsql {PRAGMA main.journal_mode = wal}] \
      [execsql {PRAGMA aux.journal_mode = wal}]
} {{0 wal} wal wal}

do_test doltlite_recover_rawformat_2-3.2 {
  execsql {
    BEGIN;
      INSERT INTO t1 VALUES(5, 6);
      INSERT INTO t2 VALUES(7, 8);
    COMMIT;
  }
  db close
  sqlite3 db test.db
  execsql {ATTACH 'test2.db' AS aux}
  execsql {
    SELECT * FROM t1 ORDER BY x;
    SELECT * FROM t2 ORDER BY x;
  }
} {1 2 5 6 3 4 7 8}

do_test doltlite_recover_rawformat_2-3.3 {
  list [execsql {PRAGMA main.integrity_check}] \
      [execsql {PRAGMA aux.integrity_check}]
} {ok ok}

proc rf2_garbage_file {name bytes} {
  forcedelete $name
  set fd [open $name w]
  fconfigure $fd -translation binary
  puts -nonewline $fd $bytes
  close $fd
}

do_test doltlite_recover_rawformat_2-3.4 {
  db close
  rf2_garbage_file test.db "SQ"
  set rc [list [catch {
    sqlite3 db test.db
    execsql { CREATE TABLE g1(a, b) }
  } msg] $msg]
  catch {db close}
  set fd [open test.db r]
  fconfigure $fd -translation binary
  set data [read $fd]
  close $fd
  list $rc $data
} {{1 {file is not a database}} SQ}

do_test doltlite_recover_rawformat_2-3.5 {
  rf2_garbage_file test.db "SQL"
  set rc [list [catch {
    sqlite3 db test.db
    execsql { CREATE TABLE g1(a, b) }
  } msg] $msg]
  catch {db close}
  set fd [open test.db r]
  fconfigure $fd -translation binary
  set data [read $fd]
  close $fd
  list $rc $data
} {{1 {file is not a database}} SQL}

do_test doltlite_recover_rawformat_2-3.6 {
  forcedelete test.db
  sqlite3 db test.db
  execsql {CREATE TABLE s8(a, b); INSERT INTO s8 VALUES(1, 2);}
  set r1 [file_control_chunksize_test db main 4096]
  set r2 [file_control_chunksize_test db main 16]
  list $r1 $r2 [execsql {SELECT * FROM s8 ORDER BY a}]
} {{} {} {1 2}}

do_test doltlite_recover_rawformat_2-3.7 {
  set res [file_control_sizehint_test db main 100]
  execsql {INSERT INTO s8 VALUES(3, 4)}
  db close
  sqlite3 db test.db
  list $res [execsql {SELECT * FROM s8 ORDER BY a}] \
      [execsql {PRAGMA integrity_check}]
} {{} {1 2 3 4} ok}

do_test doltlite_recover_rawformat_2-3.8 {
  db close
  forcedelete test.db
  sqlite3 db test.db
  execsql {CREATE TABLE s9(a, b); INSERT INTO s9 VALUES(1, 2);}
  file_control_chunksize_test db main 4096
  file_control_sizehint_test db main 8192
  set sz [file size test.db]
  execsql {INSERT INTO s9 VALUES(3, 4)}
  db close
  sqlite3 db test.db
  list $sz [execsql {SELECT * FROM s9 ORDER BY a}] \
      [execsql {PRAGMA integrity_check}]
} {8192 {1 2 3 4} ok}

do_test doltlite_recover_rawformat_2-4.1 {
  db close
  forcedelete test.db
  sqlite3 db test.db
  execsql {PRAGMA encoding = 'UTF-16le'}
  execsql {PRAGMA encoding}
} {UTF-8}

do_test doltlite_recover_rawformat_2-4.2 {
  execsql {
    SELECT quote(CAST('ghi' AS blob)), quote(CAST(456 AS blob)),
           quote(CAST(1.78 AS blob));
  }
} {X'676869' X'343536' X'312E3738'}

do_test doltlite_recover_rawformat_2-4.3 {
  sqlite3 db2 :memory:
  db2 eval {PRAGMA encoding = 'UTF-16be'}
  set res [db2 eval {
    SELECT quote(CAST('ghi' AS blob)), quote(CAST(456 AS blob)),
           quote(CAST(1.78 AS blob));
  }]
  db2 close
  set res
} {X'676869' X'343536' X'312E3738'}

do_test doltlite_recover_rawformat_2-4.4 {
  execsql {
    SELECT CAST(X'676869' AS text) == 'ghi',
           CAST(X'670068006900' AS text);
  }
} {1 g}

do_test doltlite_recover_rawformat_2-4.5 {
  execsql {
    SELECT CAST(X'31002E0032003300' AS REAL),
           CAST(X'003100320033' AS INTEGER),
           typeof(CAST(X'31002E0032003300' AS REAL)),
           typeof(CAST(X'003100320033' AS INTEGER));
  }
} {1.0 0 real integer}

do_test doltlite_recover_rawformat_2-4.6 {
  sqlite3 dbe1 :memory: ; dbe1 eval { PRAGMA encoding = 'utf-8' }
  sqlite3 dbe2 :memory: ; dbe2 eval { PRAGMA encoding = 'utf-16le' }
  sqlite3 dbe3 :memory: ; dbe3 eval { PRAGMA encoding = 'utf-16be' }
  set res {}
  foreach castexpr {
    { CAST(123 AS BLOB)    }
    { CAST('' AS BLOB)     }
    { CAST('abcd' AS BLOB) }
    { CAST(X'abcd' AS TEXT) }
    { CAST(X'' AS TEXT)     }
  } {
    set r1 [dbe1 eval "SELECT typeof($castexpr), quote($castexpr)"]
    set r2 [dbe2 eval "SELECT typeof($castexpr), quote($castexpr)"]
    set r3 [dbe3 eval "SELECT typeof($castexpr), quote($castexpr)"]
    lappend res [expr {$r1 eq $r2 && $r2 eq $r3}]
  }
  dbe1 close
  dbe2 close
  dbe3 close
  set res
} {1 1 1 1 1}

do_test doltlite_recover_rawformat_2-4.7 {
  execsql {
    CREATE TABLE te(a);
    INSERT INTO te VALUES(x'61006200630064006500');
  }
  list [execsql {PRAGMA encoding}] \
      [execsql {SELECT CAST(a AS text) FROM te}] \
      [execsql {SELECT CAST(x'61006200630064006500' AS text)}] \
      [execsql {SELECT hex(a) FROM te}] \
      [execsql {SELECT count(*) FROM te WHERE CAST(a AS text) LIKE 'abc%'}]
} {UTF-8 a a 61006200630064006500 0}

do_test doltlite_recover_rawformat_2-4.8 {
  forcedelete test3.db
  sqlite3 db3 test3.db
  db3 eval {
    PRAGMA encoding='utf8';
    CREATE TABLE u1(x);
    INSERT INTO u1 VALUES('hello');
  }
  db3 close
  execsql {ATTACH 'test3.db' AS enc3aux}
  set res [execsql {SELECT x FROM enc3aux.u1}]
  execsql {DETACH enc3aux}
  set res
} {hello}

do_test doltlite_recover_rawformat_2-4.9 {
  sqlite3 db2 :memory:
  db2 eval {PRAGMA encoding = 'UTF-16be'}
  set r [list [db2 eval {PRAGMA encoding}] [db2 eval {SELECT 1+'1.0'}] \
      [db2 eval {SELECT 1+substr('9223372036854775807',1,3)}]]
  db2 close
  set r
} {UTF-8 2.0 923}

do_test doltlite_recover_rawformat_2-5.1 {
  db close
  forcedelete test.db test2.db
  sqlite3 db test.db
  execsql {
    CREATE TABLE t1(a, b);
    INSERT INTO t1 VALUES(1, 100);
    INSERT INTO t1 VALUES(2, 300);
  }
  execsql {PRAGMA schema_version = 10}
  set sv [db one {PRAGMA schema_version}]
  list [expr {$sv == 10}] [expr {$sv % 2}]
} {1 0}

# In-session the cookie behaves like stock (writes stick, reads stable);
# a reopen re-derives it from the catalog hash instead of persisting the
# written value, so cross-reopen only stability is asserted.
do_test doltlite_recover_rawformat_2-5.2 {
  set sv0 [db one {PRAGMA schema_version}]
  execsql {SELECT count(*) FROM t1}
  set sv1 [db one {PRAGMA schema_version}]
  db close
  sqlite3 db test.db
  set sv2 [db one {PRAGMA schema_version}]
  set sv3 [db one {PRAGMA schema_version}]
  list [expr {$sv0 == $sv1}] [expr {$sv2 == $sv3}]
} {1 1}

do_test doltlite_recover_rawformat_2-5.3 {
  set sv0 [db one {PRAGMA schema_version}]
  execsql {ALTER TABLE t1 ADD c}
  set sv1 [db one {PRAGMA schema_version}]
  list [expr {$sv0 != $sv1}] [execsql {SELECT * FROM t1 ORDER BY a}]
} {1 {1 100 {} 2 300 {}}}

do_test doltlite_recover_rawformat_2-5.4 {
  set sv0 [db one {PRAGMA schema_version}]
  execsql {ALTER TABLE t1 ADD d DEFAULT 'hello world'}
  set sv1 [db one {PRAGMA schema_version}]
  list [expr {$sv0 != $sv1}] [execsql {SELECT * FROM t1 ORDER BY a}]
} {1 {1 100 {} {hello world} 2 300 {} {hello world}}}

do_test doltlite_recover_rawformat_2-5.5 {
  execsql {
    ATTACH 'test2.db' AS aux;
    CREATE TABLE aux.t1 AS SELECT a, b FROM t1;
  }
  set sv0 [db one {PRAGMA aux.schema_version}]
  execsql {ALTER TABLE aux.t1 ADD COLUMN c VARCHAR(128)}
  set sv1 [db one {PRAGMA aux.schema_version}]
  execsql {ALTER TABLE aux.t1 ADD COLUMN d DEFAULT 1000}
  set sv2 [db one {PRAGMA aux.schema_version}]
  list [expr {$sv0 != $sv1}] [expr {$sv1 != $sv2}] \
      [execsql {SELECT * FROM aux.t1 ORDER BY a}]
} {1 1 {1 100 {} 1000 2 300 {} 1000}}

do_test doltlite_recover_rawformat_2-5.6 {
  execsql {VACUUM}
  execsql {
    CREATE TABLE abc2(a, b, c);
    INSERT INTO abc2 VALUES(1, 2, 3);
    ALTER TABLE abc2 ADD d DEFAULT NULL;
    ALTER TABLE abc2 ADD e DEFAULT 10;
    ALTER TABLE abc2 ADD f DEFAULT NULL;
  }
  execsql {VACUUM}
  db close
  sqlite3 db test.db
  list [execsql {SELECT * FROM abc2}] [execsql {PRAGMA integrity_check}]
} {{1 2 3 {} 10 {}} ok}

do_test doltlite_recover_rawformat_2-6.1 {
  db close
  forcedelete test.db test2.db
  sqlite3 db test.db
  execsql {
    CREATE TABLE t2(a, b);
    INSERT INTO t2 VALUES(1, 2);
    INSERT INTO t2 VALUES(2, 4);
    INSERT INTO t2 SELECT a+2, (a+2)*2 FROM t2;
    INSERT INTO t2 SELECT a+4, (a+4)*2 FROM t2;
    INSERT INTO t2 SELECT a+8, (a+8)*2 FROM t2;
    CREATE INDEX t2i1 ON t2(a, b);
    CREATE VIEW v1 AS SELECT a+b AS s FROM t2;
    CREATE TRIGGER r1 AFTER INSERT ON t2 BEGIN
      SELECT 'hello';
    END;
    ANALYZE;
  }
  execsql {PRAGMA integrity_check}
} {ok}

do_test doltlite_recover_rawformat_2-6.2 {
  forcedelete rf2bu1.db
  db backup rf2bu1.db
  sqlite3 db2 rf2bu1.db
  set res [list \
    [db2 eval {SELECT a, b FROM t2 ORDER BY a}] \
    [db2 eval {SELECT s FROM v1 ORDER BY s}] \
    [db2 eval {SELECT name FROM sqlite_master WHERE name IN ('t2','t2i1','v1','r1') ORDER BY name}] \
    [db2 eval {PRAGMA integrity_check}]]
  db2 close
  expr {$res eq [list \
    [db eval {SELECT a, b FROM t2 ORDER BY a}] \
    [db eval {SELECT s FROM v1 ORDER BY s}] \
    [db eval {SELECT name FROM sqlite_master WHERE name IN ('t2','t2i1','v1','r1') ORDER BY name}] \
    {ok}]}
} {1}

do_test doltlite_recover_rawformat_2-6.3 {
  execsql {DELETE FROM t2; DROP TRIGGER r1;}
  db restore rf2bu1.db
  list [execsql {SELECT count(*) FROM t2}] \
      [execsql {SELECT count(*) FROM sqlite_master WHERE name='r1'}] \
      [execsql {PRAGMA integrity_check}]
} {16 1 ok}

do_test doltlite_recover_rawformat_2-6.4 {
  set r1 [catch {db restore temp rf2bu1.db} m1]
  set r2 [catch {db backup temp rf2bu2.db} m2]
  list $r1 $m1 $r2 $m2 [execsql {SELECT count(*) FROM t2}]
} {1 {restore failed: cannot backup between a legacy SQLite database and a doltlite database} 1 {backup failed: cannot backup between a legacy SQLite database and a doltlite database} 16}

do_test doltlite_recover_rawformat_2-6.5 {
  rf2_garbage_file rf2bug.db "This is not a valid database file"
  set rc [catch {db backup rf2bug.db} msg]
  list $rc $msg [execsql {SELECT count(*) FROM t2}]
} {1 {backup failed: file is not a database} 16}

do_test doltlite_recover_rawformat_2-6.6 {
  set rc [catch {db backup aux1 rf2bu3.db} msg]
  list $rc $msg [execsql {SELECT count(*) FROM t2}]
} {1 {backup failed: unknown database aux1} 16}

do_test doltlite_recover_rawformat_2-6.7 {
  set rc [catch {db restore rf2bug.db} msg]
  list $rc $msg [execsql {SELECT count(*) FROM t2}]
} {1 {restore failed: file is not a database} 16}

do_test doltlite_recover_rawformat_2-6.8 {
  set rc [catch {db restore aux1 rf2bu1.db} msg]
  list $rc $msg [execsql {SELECT count(*) FROM t2}]
} {1 {restore failed: unknown database aux1} 16}

do_test doltlite_recover_rawformat_2-6.9 {
  sqlite3 dbm :memory:
  set rc [catch {dbm backup rf2bu4.db} msg]
  dbm close
  list $rc $msg
} {1 {backup failed: cannot backup in-memory doltlite database}}

do_test doltlite_recover_rawformat_2-6.10 {
  forcedelete rf2empty.db rf2bu5.db
  sqlite3 dbe rf2empty.db
  set rc [catch {dbe backup rf2bu5.db} msg]
  dbe close
  sqlite3 db2 rf2bu5.db
  set res [list $rc $msg \
    [db2 eval {SELECT count(*) FROM sqlite_master}] \
    [db2 eval {PRAGMA integrity_check}]]
  db2 close
  set res
} {0 {} 0 ok}

do_test doltlite_recover_rawformat_2-7.1 {
  sqlite3 dbd {}
  set rc [catch {dbd deserialize [string repeat \x00 512]} msg]
  set usable [dbd eval {SELECT 11+22}]
  dbd close
  list $rc $msg $usable
} {1 {unable to set MEMDB content} 33}

do_test doltlite_recover_rawformat_2-7.2 {
  sqlite3 dbd {}
  set img "SQLite format 3\x00[string repeat \x5a 496]"
  set rc [catch {dbd deserialize $img} msg]
  set usable [dbd eval {CREATE TABLE qq(x); INSERT INTO qq VALUES(7); SELECT x FROM qq}]
  dbd close
  list $rc $msg $usable [execsql {PRAGMA integrity_check}]
} {1 {unable to set MEMDB content} 7 ok}

do_test doltlite_recover_rawformat_2-8.1 {
  db close
  forcedelete test.db test2.db
  sqlite3 db test.db
  execsql {
    CREATE TABLE v1(x);
    INSERT INTO v1 VALUES('hello');
    ATTACH 'test2.db' AS x2;
    CREATE TABLE x2.v2(y);
    INSERT INTO x2.v2 VALUES('out there');
  }
  set h0 [db one {SELECT dolt_hashof_table('v1')}]
  execsql {VACUUM}
  set h1 [db one {SELECT dolt_hashof_table('v1')}]
  list [expr {$h0 eq $h1}] [execsql {SELECT x FROM v1}] \
      [execsql {SELECT y FROM x2.v2}] [execsql {PRAGMA integrity_check}]
} {1 hello {{out there}} ok}

do_test doltlite_recover_rawformat_2-8.2 {
  execsql {VACUUM x2}
  list [execsql {SELECT y FROM x2.v2}] [execsql {PRAGMA x2.integrity_check}]
} {{{out there}} ok}

do_test doltlite_recover_rawformat_2-8.3 {
  catchsql {VACUUM nosuch}
} {1 {unknown database nosuch}}

do_test doltlite_recover_rawformat_2-8.4 {
  set a [execsql {PRAGMA auto_vacuum}]
  set b [catchsql {PRAGMA auto_vacuum = 1}]
  set c [execsql {PRAGMA auto_vacuum}]
  set d [catchsql {VACUUM}]
  list $a $b $c $d
} {0 {0 {}} 0 {0 {}}}

do_test doltlite_recover_rawformat_2-8.5 {
  execsql {DELETE FROM v1}
  execsql {VACUUM}
  list [execsql {SELECT count(*) FROM v1}] [execsql {PRAGMA integrity_check}]
} {0 ok}

do_test doltlite_recover_rawformat_2-9.1 {
  list [execsql {PRAGMA secure_delete}] \
      [execsql {PRAGMA secure_delete = 1}] \
      [execsql {PRAGMA secure_delete = 0}]
} {0 0 0}

do_test doltlite_recover_rawformat_2-9.2 {
  execsql {CREATE TABLE sd1(i INTEGER PRIMARY KEY, x, y)}
  for {set i 1} {$i <= 40} {incr i} {
    set blob [string repeat "val-$i-x" 64]
    db eval {INSERT INTO sd1 VALUES($i, $i, $blob)}
  }
  execsql {DELETE FROM sd1 WHERE i = 1}
  execsql {DELETE FROM sd1 WHERE i > 30}
  db close
  sqlite3 db test.db
  list [execsql {SELECT count(*) FROM sd1}] \
      [execsql {SELECT count(*) FROM sd1 WHERE i = 1 OR i > 30}] \
      [execsql {SELECT count(*) FROM sd1 WHERE y LIKE '%val-1-x%'}] \
      [execsql {SELECT x FROM sd1 WHERE i = 30}] \
      [execsql {PRAGMA integrity_check}]
} {29 0 0 30 ok}

do_test doltlite_recover_rawformat_2-10.1 {
  set r1 [file_control_reservebytes db 8]
  execsql {VACUUM}
  set r2 [file_control_reservebytes db 16]
  execsql {VACUUM}
  sqlite3 db2 test.db
  set res [list $r1 $r2 \
    [db2 eval {PRAGMA integrity_check}] \
    [db2 eval {SELECT count(*) FROM sd1}]]
  db2 close
  set res
} {SQLITE_OK SQLITE_OK ok 29}

do_test doltlite_recover_rawformat_2-11.1 {
  db close
  forcedelete test.db
  sqlite3 db test.db
  execsql {
    CREATE TABLE t1(a, b);
    INSERT INTO t1 VALUES(1, 2);
    INSERT INTO t1 VALUES(3, 4);
  }
  set rows [execsql {SELECT * FROM t1 ORDER BY a}]
  execsql {DROP TABLE t1}
  execsql {VACUUM}
  list $rows [execsql {SELECT count(*) FROM sqlite_master}] \
      [expr {[file size test.db] > 0}] \
      [catchsql {CREATE TABLE t1(a); INSERT INTO t1 VALUES(9); SELECT a FROM t1}] \
      [execsql {PRAGMA integrity_check}]
} {{1 2 3 4} 0 1 {0 9} ok}

do_test doltlite_recover_rawformat_2-12.1 {
  execsql {
    CREATE TABLE c4a(a COLLATE NOCASE);
    CREATE TABLE c4b(b);
    INSERT INTO c4a VALUES('a'),('A'),('b'),('B'),('c'),('C'),('d'),('D'),('e'),('D');
    INSERT INTO c4b VALUES('A'),('Z');
    CREATE INDEX c4i1 ON c4a(a);
  }
  set rows [execsql {SELECT * FROM c4b, c4a WHERE a = b}]
  set plan [execsql {EXPLAIN QUERY PLAN SELECT * FROM c4b, c4a WHERE a = b}]
  list $rows [string match "*c4i1*" $plan]
} {{A a A A} 1}

do_test doltlite_recover_rawformat_2-12.2 {
  execsql {CREATE TABLE collate4t1(a PRIMARY KEY COLLATE NOCASE)}
  catchsql {
    INSERT INTO collate4t1 VALUES('abc');
    INSERT INTO collate4t1 VALUES('ABC');
  }
} {1 {UNIQUE constraint failed: collate4t1.a}}

do_test doltlite_recover_rawformat_2-12.3 {
  list [execsql {SELECT * FROM collate4t1}] [catchsql {
    INSERT INTO collate4t1 VALUES(1);
    UPDATE collate4t1 SET a = 'abc';
  }]
} {abc {1 {UNIQUE constraint failed: collate4t1.a}}}

do_test doltlite_recover_rawformat_2-12.4 {
  db collate TEXT rf2_text_collate
  proc rf2_text_collate {a b} { return [string compare $a $b] }
  execsql {CREATE TABLE c4c(x COLLATE TEXT)}
  catchsql {CREATE INDEX c4ci ON c4c(x)}
} {1 {doltlite does not support indexes with custom collation 'TEXT'}}

do_test doltlite_recover_rawformat_2-13.1 {
  execsql {
    CREATE TABLE zb(a, b, c, d);
    INSERT INTO zb VALUES(2, 3, 4, zeroblob(1000000));
  }
  db close
  sqlite3 db test.db
  execsql {
    SELECT length(d), typeof(d), d == zeroblob(1000000),
           hex(substr(d, 1, 4)), hex(substr(d, 999997, 4))
    FROM zb;
  }
} {1000000 blob 1 00000000 00000000}

do_test doltlite_recover_rawformat_2-14.1 {
  execsql {
    CREATE TABLE test1(f1 int, f2 int);
    INSERT INTO test1 VALUES(11, 22);
    CREATE TABLE t4(x);
    INSERT INTO t4 VALUES(1);
    INSERT INTO t4 SELECT x+1 FROM t4;
    DROP TABLE t4;
    CREATE TABLE t4(x);
    INSERT INTO t4 VALUES(1);
    INSERT INTO t4 SELECT x+1 FROM t4;
  }
  list [execsql {SELECT x FROM t4 ORDER BY x}] \
      [execsql {SELECT name FROM sqlite_master WHERE name IN ('t4','test1') ORDER BY name}] \
      [execsql {SELECT * FROM test1}]
} {{1 2} {t4 test1} {11 22}}

do_test doltlite_recover_rawformat_2-15.1 {
  execsql {CREATE TABLE mm1(x, y)}
  for {set i 1} {$i <= 20} {incr i} {
    db eval {INSERT INTO mm1 VALUES($i, $i)}
  }
  execsql {CREATE INDEX mm1i1 ON mm1(x DESC)}
  set plan [execsql {EXPLAIN QUERY PLAN SELECT min(x) FROM mm1}]
  list [execsql {SELECT min(x) FROM mm1}] [execsql {SELECT max(x) FROM mm1}] \
      [string match "*mm1i1*" $plan]
} {1 20 1}

do_test doltlite_recover_rawformat_2-16.1 {
  execsql {
    CREATE TABLE jt1(x int, y int);
    CREATE TABLE jt2(a int, b int, c int);
  }
  for {set i 1} {$i <= 50} {incr i} {
    db eval {INSERT INTO jt1(x, y) VALUES($i, $i*$i)}
  }
  execsql {
    INSERT INTO jt2 SELECT x, x*y, y*y FROM jt1;
    CREATE INDEX idxjt2 ON jt2(c);
  }
  set plan [execsql {
    EXPLAIN QUERY PLAN SELECT jt1.x FROM jt2, jt1 WHERE jt2.c==256 AND jt1.x==jt2.a
  }]
  list [execsql {SELECT jt1.x FROM jt2, jt1 WHERE jt2.c==256 AND jt1.x==jt2.a}] \
      [string match "*idxjt2*" $plan]
} {4 1}

do_test doltlite_recover_rawformat_2-17.1 {
  execsql {
    CREATE TABLE dc1(ii INTEGER PRIMARY KEY, tt INTEGER, rr REAL);
    WITH s(i) AS (
      SELECT 1 UNION ALL SELECT i+1 FROM s WHERE i<5000
    )
    INSERT INTO dc1 SELECT NULL, i, 5.0 FROM s;
    ALTER TABLE dc1 DROP COLUMN tt;
  }
  list [execsql {SELECT count(*), count(DISTINCT rr), min(rr) FROM dc1}] \
      [execsql {PRAGMA integrity_check}]
} {{5000 1 5.0} ok}

do_test doltlite_recover_rawformat_2-18.1 {
  db close
  rf2_garbage_file test.db "This is not really a database\n"
  set rc [list [catch {
    sqlite3 db test.db
    execsql { CREATE TABLE m5(a, b, c) }
  } msg] $msg]
  catch {db close}
  set fd [open test.db r]
  fconfigure $fd -translation binary
  set data [read $fd]
  close $fd
  forcedelete test.db
  sqlite3 db test.db
  list $rc $data
} {{1 {file is not a database}} {This is not really a database
}}

ifcapable fts3 {
  do_test doltlite_recover_rawformat_2-19.1 {
    execsql {CREATE VIRTUAL TABLE ft USING fts4(content)}
    execsql {INSERT INTO ft(docid, content)
             VALUES(5, 'joseph died in egypt and joseph was put in a coffin in egypt')}
    execsql {INSERT INTO ft(docid, content)
             VALUES(7, 'unrelated words entirely here')}
    proc rf2_mit {blob} {
      set scan(littleEndian) i*
      set scan(bigEndian) I*
      binary scan $blob $scan($::tcl_platform(byteOrder)) r
      return $r
    }
    db func mit rf2_mit
    execsql {
      SELECT docid, mit(matchinfo(ft, 'pcxnal')) FROM ft
       WHERE ft MATCH 'joseph died in egypt'
       ORDER BY docid;
    }
  } {5 {4 1 2 2 1 1 1 1 3 3 1 2 2 1 2 9 13}}
}

finish_test
