# 2026-06-12
#
# The author disclaims copyright to this source code.  In place of
# a legal notice, here is a blessing:
#
#    May you do good and not evil.
#    May you find forgiveness for yourself and forgive others.
#    May you share freely, never taking more than you give.
#
#***********************************************************************
# Focused DoltLite coverage for PRAGMA data_version semantics from
# pragma3.test.
#

set testdir [file dirname $argv0]
source $testdir/tester.tcl

do_execsql_test doltlite_data_version-1.1 {
  PRAGMA data_version;
} {1}

do_execsql_test doltlite_data_version-1.2 {
  PRAGMA data_version;
  BEGIN IMMEDIATE;
  PRAGMA data_version;
  CREATE TABLE t1(a);
  INSERT INTO t1 VALUES(100),(200),(300);
  PRAGMA data_version;
  COMMIT;
  SELECT * FROM t1;
  PRAGMA data_version;
} {1 1 1 100 200 300 1}

sqlite3 db2 test.db

do_test doltlite_data_version-1.3 {
  db2 eval {
    SELECT * FROM t1;
    PRAGMA data_version;
  }
} {100 200 300 1}

do_execsql_test doltlite_data_version-1.4 {
  PRAGMA data_version;
  BEGIN IMMEDIATE;
  INSERT INTO t1 VALUES(400),(500);
  PRAGMA data_version;
  COMMIT;
  SELECT * FROM t1;
  PRAGMA data_version;
} {1 1 100 200 300 400 500 1}

do_test doltlite_data_version-1.5 {
  db2 eval {
    SELECT * FROM t1;
    PRAGMA data_version;
    BEGIN IMMEDIATE;
    UPDATE t1 SET a=a+1;
    PRAGMA data_version;
    COMMIT;
    SELECT * FROM t1;
    PRAGMA data_version;
  }
} {100 200 300 400 500 2 2 101 201 301 401 501 2}

do_execsql_test doltlite_data_version-1.6 {
  SELECT * FROM t1;
  PRAGMA data_version;
} {101 201 301 401 501 2}

do_test doltlite_data_version-1.7 {
  db eval {
    BEGIN;
    PRAGMA data_version;
    UPDATE t1 SET a=555 WHERE a=501;
    PRAGMA data_version;
    SELECT * FROM t1 ORDER BY a;
    PRAGMA data_version;
  }
} {2 2 101 201 301 401 555 2}

do_test doltlite_data_version-1.8 {
  db2 eval {
    PRAGMA data_version;
  }
} {2}

do_execsql_test doltlite_data_version-1.9 {
  COMMIT;
  PRAGMA data_version;
} {2}

do_test doltlite_data_version-1.10 {
  db2 eval {
    PRAGMA data_version;
  }
} {3}

db2 close
finish_test
