set testdir [file dirname $argv0]
source $testdir/tester.tcl


do_execsql_test doltlite_recover_withoutrowid-1.1 {
  CREATE TABLE fd1(a PRIMARY KEY, b);
  INSERT INTO fd1 VALUES(1,'a'),(2,'b'),(3,'c'),(4,'d'),(5,'e'),(6,'f'),(7,'g'),(8,'h');
  DELETE FROM fd1 WHERE a=2;
  SELECT a FROM fd1 ORDER BY a;
} {1 3 4 5 6 7 8}
do_execsql_test doltlite_recover_withoutrowid-1.2 {
  DELETE FROM fd1 WHERE a=3 AND b='c';
  DELETE FROM fd1 WHERE a=4 AND b='zzz';
  SELECT a FROM fd1 ORDER BY a;
} {1 4 5 6 7 8}
do_execsql_test doltlite_recover_withoutrowid-1.3 {
  DELETE FROM fd1 WHERE a>5;
  SELECT a, b FROM fd1 ORDER BY a;
} {1 a 4 d 5 e}
do_execsql_test doltlite_recover_withoutrowid-1.4 {
  PRAGMA integrity_check;
} {ok}

do_execsql_test doltlite_recover_withoutrowid-2.1 {
  PRAGMA foreign_keys = 1;
  CREATE TABLE fm1(
    x PRIMARY KEY,
    y REFERENCES fm1 ON DELETE RESTRICT ON UPDATE SET DEFAULT
  );
  INSERT INTO fm1 VALUES('abc', 'abc');
  INSERT INTO fm1 VALUES('def', 'def');
  INSERT INTO fm1 VALUES('ghi', 'ghi');
  DELETE FROM fm1 WHERE x<>'abc';
  UPDATE fm1 SET x='jkl', y='jkl';
  SELECT * FROM fm1;
} {jkl jkl}
do_catchsql_test doltlite_recover_withoutrowid-2.2 {
  INSERT INTO fm1 VALUES('mno', 'nope');
} {1 {FOREIGN KEY constraint failed}}
do_execsql_test doltlite_recover_withoutrowid-2.3 {
  CREATE TABLE fmx(a, b, PRIMARY KEY(a, b));
  CREATE TABLE fmy(c, d,
    FOREIGN KEY(d, c) REFERENCES fmx DEFERRABLE INITIALLY DEFERRED
  );
  CREATE TABLE fmz(e, f, FOREIGN KEY(e, f) REFERENCES fmx);
  DROP TABLE fmy;
  DROP TABLE fmx;
  SELECT name FROM sqlite_master WHERE name IN ('fmx','fmy','fmz') ORDER BY name;
} {fmz}

do_test doltlite_recover_withoutrowid-3.1 {
  execsql {
    CREATE TABLE nn5(a PRIMARY KEY);
    CREATE TABLE nn8(a PRIMARY KEY) WITHOUT ROWID;
    INSERT INTO nn5 VALUES('x'),('y');
    INSERT INTO nn8 VALUES('x'),('y');
  }
  set counts {}
  foreach t {nn5 nn8} {
    set n 0
    db eval "EXPLAIN SELECT * FROM $t WHERE a IS ?" r {
      if {$r(opcode)=="Next"} {incr n}
    }
    lappend counts $n
  }
  set counts
} {0 0}
do_execsql_test doltlite_recover_withoutrowid-3.2 {
  SELECT * FROM nn5 WHERE a IS 'x';
  SELECT * FROM nn8 WHERE a IS 'x';
  SELECT count(*) FROM nn5 WHERE a IS NULL;
} {x x 0}

do_execsql_test doltlite_recover_withoutrowid-4.1 {
  CREATE TABLE u3(a PRIMARY KEY, b, c);
  CREATE INDEX u3i ON u3(b);
  UPDATE u3 SET c=1 WHERE a='nosuch';
  INSERT INTO u3 VALUES('k1', 10, 0), ('k2', 20, 0);
  UPDATE u3 SET c=1 WHERE a='k2';
  SELECT a, c FROM u3 ORDER BY a;
} {k1 0 k2 1}

do_execsql_test doltlite_recover_withoutrowid-5.1 {
  CREATE TABLE wf4(a,b,c,d,e, PRIMARY KEY(a,b,c));
  CREATE INDEX wf4adc ON wf4(a,d,c);
  CREATE UNIQUE INDEX wf4aebc ON wf4(a,e,b,c);
  EXPLAIN QUERY PLAN SELECT d FROM wf4 WHERE a=? AND b=?;
} {/a=. AND b=./}

do_execsql_test doltlite_recover_withoutrowid-6.1 {
  CREATE TABLE wr1(a PRIMARY KEY,b,c);
  CREATE TABLE wr1w(a PRIMARY KEY,b,c) WITHOUT ROWID;
  INSERT INTO wr1 VALUES(1565,681,1148),(1429,1190,1619),(425,358,1306);
  INSERT INTO wr1w SELECT a,b,c FROM wr1;
  SELECT a,b,c FROM wr1 ORDER BY a;
  SELECT a,b,c FROM wr1w ORDER BY a;
} {425 358 1306 1429 1190 1619 1565 681 1148 425 358 1306 1429 1190 1619 1565 681 1148}
do_execsql_test doltlite_recover_withoutrowid-6.2 {
  SELECT count(rowid) FROM wr1;
} {3}
do_execsql_test doltlite_recover_withoutrowid-6.3 {
  SELECT count(_rowid_) FROM wr1;
} {3}
do_execsql_test doltlite_recover_withoutrowid-6.4 {
  SELECT count(oid) FROM wr1;
} {3}
do_catchsql_test doltlite_recover_withoutrowid-6.4b {
  SELECT rowid FROM wr1w;
} {1 {no such column: rowid}}
do_execsql_test doltlite_recover_withoutrowid-6.5 {
  CREATE TABLE wrnn(a, b, c, d, e, PRIMARY KEY(c,a,e));
  INSERT INTO wrnn VALUES(1,2,3,4,5);
} {}
do_catchsql_test doltlite_recover_withoutrowid-6.6 {
  INSERT INTO wrnn VALUES(NULL, 3,4,5,6);
} {1 {NOT NULL constraint failed: wrnn.a}}
do_catchsql_test doltlite_recover_withoutrowid-6.7 {
  INSERT INTO wrnn VALUES(3,4,NULL,7,8);
} {1 {NOT NULL constraint failed: wrnn.c}}
do_catchsql_test doltlite_recover_withoutrowid-6.8 {
  INSERT INTO wrnn VALUES(4,5,6,7,NULL);
} {1 {NOT NULL constraint failed: wrnn.e}}
do_execsql_test doltlite_recover_withoutrowid-6.9 {
  SELECT count(*) FROM wrnn;
} {1}

do_test doltlite_recover_withoutrowid-7.1 {
  execsql {CREATE TABLE k1(a TEXT PRIMARY KEY)}
  set bigstr abcdefghijklmnopqrstuvwxyzABCDEFGHIJKLMNOPQRSTUVWXYZ
  for {set i 0} {$i<100} {incr i} {
    set x [format %5d [expr $i*2]]
    execsql "INSERT INTO k1 VALUES('$x-$bigstr')"
  }
  execsql {
    BEGIN;
    UPDATE k1 SET a = a||'x' WHERE substr(a,5,1)='0' OR substr(a,5,1)='2';
  }
} {}
do_catchsql_test doltlite_recover_withoutrowid-7.2 {
  UPDATE k1 SET a = CASE WHEN a<'  100' THEN substr(a,1,10) ELSE '9999' END;
} {1 {UNIQUE constraint failed: k1.a}}
do_execsql_test doltlite_recover_withoutrowid-7.3 {
  COMMIT;
  SELECT count(*) FROM k1;
} {100}
do_execsql_test doltlite_recover_withoutrowid-7.4 {
  PRAGMA integrity_check;
} {ok}

do_execsql_test doltlite_recover_withoutrowid-8.1 {
  CREATE TABLE w4(x,y,z,PRIMARY KEY(x,y));
  INSERT INTO w4 VALUES(1,1,11),(1,2,12),(1,3,13),(2,2,22);
  SELECT x,y FROM w4 WHERE x IN (1,9,2,5) AND y IN (1,3,NULL,2) AND z!=13 ORDER BY x,y;
} {1 1 1 2 2 2}
do_execsql_test doltlite_recover_withoutrowid-8.2 {
  SELECT x,y FROM w4 WHERE x IN (1,9,NULL,2) AND y IN (1,3,2) AND z!=13 ORDER BY x,y;
} {1 1 1 2 2 2}

do_execsql_test doltlite_recover_withoutrowid-9.1 {
  CREATE TABLE d3(a, b, c);
  CREATE UNIQUE INDEX di3 ON d3(a, b);
  INSERT INTO d3 VALUES(1,'one','i'),(3,'three','iii'),(6,'six','vi'),
                       (2,'two','ii'),(4,'four','iv'),(5,'five','v');
  CREATE TABLE d4(x PRIMARY KEY, y);
  INSERT INTO d4 VALUES('a','one'),('b','two');
  SELECT y FROM d4 WHERE x='a';
} {one}
do_execsql_test doltlite_recover_withoutrowid-9.2 {
  SELECT a, b FROM d3 WHERE
        (a=1 AND b=(SELECT y FROM d4 WHERE x='a'))
     OR (a=2 AND b='two') ORDER BY a;
} {1 one 2 two}
do_execsql_test doltlite_recover_withoutrowid-9.3 {
  SELECT a, b FROM d3 WHERE
        (a=2 AND b='two')
     OR (a=1 AND b=(SELECT y FROM d4 WHERE x='a')) ORDER BY a;
} {1 one 2 two}
do_execsql_test doltlite_recover_withoutrowid-9.4 {
  SELECT a, b FROM d3 WHERE
        (a=2 AND b=(SELECT y FROM d4 WHERE x='b'))
     OR (a=1 AND b=(SELECT y FROM d4 WHERE x='a')) ORDER BY a;
} {1 one 2 two}

proc wr_plan {sql} {
  set res {}
  db eval "EXPLAIN QUERY PLAN $sql" r {lappend res $r(detail)}
  join $res {; }
}
do_execsql_test doltlite_recover_withoutrowid-10.1 {
  CREATE TABLE ga(a1 PRIMARY KEY, a2);
  CREATE TABLE gb(b1 PRIMARY KEY, b2);
  INSERT INTO ga VALUES(10, 5), (11, 6);
  INSERT INTO gb VALUES(10, 'ten'), (11, 'eleven');
} {}
do_test doltlite_recover_withoutrowid-10.2 {
  set p1 [wr_plan {SELECT * FROM ga, gb WHERE b1=a1 AND a2=5}]
  set p2 [wr_plan {SELECT * FROM ga, gb WHERE a1=b1 AND a2=5}]
  set p3 [wr_plan {SELECT * FROM ga, gb WHERE a2=5 AND b1=a1}]
  set p4 [wr_plan {SELECT * FROM ga, gb WHERE a2=5 AND a1=b1}]
  list [expr {$p1 eq $p2}] [expr {$p1 eq $p3}] [expr {$p1 eq $p4}] \
       [string match {*SEARCH gb USING PRIMARY KEY (b1=?)*} $p1]
} {1 1 1 1}
do_execsql_test doltlite_recover_withoutrowid-10.3 {
  SELECT * FROM ga, gb WHERE a2=5 AND a1=b1;
} {10 5 10 ten}

do_execsql_test doltlite_recover_withoutrowid-11.1 {
  CREATE TABLE lt1(a INT PRIMARY KEY, b, c, d, e);
  CREATE TABLE lt2(a INT PRIMARY KEY, f, g, h, i);
  CREATE TABLE lt3(a INT PRIMARY KEY, j, k, l, m);
  CREATE VIEW lv4 AS SELECT * FROM lt2 UNION ALL SELECT * FROM lt3;
  INSERT INTO lt1 VALUES(5,'b','c','d','e');
  INSERT INTO lt2 VALUES(5,'f','g','h','i');
  INSERT INTO lt3 VALUES(9,5,'k','l','m');
  SELECT * FROM lt1, lv4 WHERE lt1.a=5 AND lv4.a=lt1.a;
} {5 b c d e 5 f g h i}
do_test doltlite_recover_withoutrowid-11.2 {
  set q120 {SELECT * FROM lt1, lt2, lt3
            WHERE lt1.a=lt2.a AND lt2.a=lt3.j AND lt3.j=5 ORDER BY lt1.a}
  set q121 {SELECT * FROM lt1, lt2, lt3
            WHERE lt1.a=lt2.a AND lt2.a=lt3.j AND lt3.j=abs(5) ORDER BY lt1.a}
  set q122 {SELECT * FROM lt1, lt2, lt3
            WHERE lt1.a=lt2.a AND lt2.a=lt3.j AND lt3.j=coalesce(5,random()) ORDER BY lt1.a}
  set p120 [wr_plan $q120]
  set p121 [wr_plan $q121]
  set p122 [wr_plan $q122]
  list [expr {$p120 eq $p121}] [expr {$p120 eq $p122}] \
       [string match {*SEARCH lt1 USING PRIMARY KEY (a=?)*} $p120] \
       [expr {[execsql $q120] eq [execsql $q121]}] \
       [expr {[execsql $q120] eq [execsql $q122]}]
} {1 0 1 1 1}
do_execsql_test doltlite_recover_withoutrowid-11.3 {
  SELECT * FROM lt1, lt2, lt3
   WHERE lt1.a=lt2.a AND lt2.a=lt3.j AND lt3.j=5 ORDER BY lt1.a;
} {5 b c d e 5 f g h i 9 5 k l m}

do_catchsql_test doltlite_recover_withoutrowid-12.1 {
  CREATE TABLE tk1(i INT PRIMARY KEY, a, b);
  INSERT INTO tk1 VALUES(NULL,'one','i');
} {1 {NOT NULL constraint failed: tk1.i}}
do_execsql_test doltlite_recover_withoutrowid-12.2 {
  INSERT INTO tk1 VALUES(1,'one','i');
  CREATE INDEX tki1a ON tk1(a);
  CREATE INDEX tki1b ON tk1(b);
  SELECT (SELECT 1
            FROM (SELECT 1 FROM tk1 WHERE a=1 OR b='i')
           WHERE a='o'
              OR b IN (SELECT a=('b' IN (SELECT 'a'))))
    FROM tk1;
} {{}}

do_execsql_test doltlite_recover_withoutrowid-13.1 {
  CREATE TABLE t70a(
     a INT CHECK( rowid!=33 ),
     b TEXT PRIMARY KEY
  );
} {}
do_execsql_test doltlite_recover_withoutrowid-13.2 {
  INSERT INTO t70a(a,b) VALUES(99,'hello');
  SELECT a, b FROM t70a;
} {99 hello}

do_execsql_test doltlite_recover_withoutrowid-14.1 {
  CREATE TABLE a1(lbl, c, b INTEGER, a TEXT, PRIMARY KEY(a, b));
  INSERT INTO a1 (lbl, c, b, a) VALUES(3,  '0x03', 1, 1);
  INSERT INTO a1 (lbl, c, b, a) VALUES(14, '0x0E', 2, 2);
  INSERT INTO a1 (lbl, c, b, a) VALUES(15, '0x0F', 3, 3);
  INSERT INTO a1 (lbl, c, b, a) VALUES(92, '0x5C', 4, 4);
  CREATE TABLE a2(x BLOB, y BLOB);
  INSERT INTO a2(x, y) VALUES(1, 1);
  INSERT INTO a2(x, y) VALUES(2, '2');
  INSERT INTO a2(x, y) VALUES('3', 3);
  INSERT INTO a2(x, y) VALUES('4', '4');
} {}
do_execsql_test doltlite_recover_withoutrowid-14.2 {
  SELECT x, typeof(x), y, typeof(y) FROM a2 ORDER BY rowid;
} {1 integer 1 integer 2 integer 2 text 3 text 3 integer 4 text 4 text}
do_execsql_test doltlite_recover_withoutrowid-14.3 {
  SELECT (SELECT lbl FROM a1 WHERE a=x AND b=y) FROM a2 ORDER BY rowid;
} {{} {} 15 92}
do_execsql_test doltlite_recover_withoutrowid-14.4 {
  SELECT (SELECT lbl FROM a1 WHERE (a, b) = (x, y)) FROM a2 ORDER BY rowid;
} {{} {} 15 92}
do_execsql_test doltlite_recover_withoutrowid-14.5 {
  SELECT a1.lbl FROM a1, a2 WHERE a=x AND b=y ORDER BY 1;
} {15 92}
do_execsql_test doltlite_recover_withoutrowid-14.6 {
  SELECT a1.lbl FROM a1, a2 WHERE (a, b) = (x, y) ORDER BY 1;
} {15 92}
do_execsql_test doltlite_recover_withoutrowid-14.7 {
  SELECT a1.lbl FROM a1, a2
   WHERE coalesce(NULL,x)=a AND coalesce(NULL,y)=b ORDER BY 1;
} {3 14 15 92}
do_execsql_test doltlite_recover_withoutrowid-14.8 {
  SELECT a1.lbl FROM a1, a2
   WHERE (coalesce(NULL,x), coalesce(NULL,y)) = (a, b) ORDER BY 1;
} {3 14 15 92}
do_execsql_test doltlite_recover_withoutrowid-14.9 {
  SELECT a1.lbl FROM a1, a2 WHERE +x=a AND +y=b ORDER BY 1;
} {3 14 15 92}
do_execsql_test doltlite_recover_withoutrowid-14.10 {
  SELECT a1.lbl FROM a1, a2 WHERE (+x, +y) = (a, b) ORDER BY 1;
} {3 14 15 92}
do_execsql_test doltlite_recover_withoutrowid-14.11 {
  SELECT (SELECT lbl FROM a1 WHERE a=+x AND b=+y) FROM a2 ORDER BY rowid;
} {3 14 15 92}
do_execsql_test doltlite_recover_withoutrowid-14.12 {
  SELECT (SELECT lbl FROM a1 WHERE (a, b) = (+x, +y)) FROM a2 ORDER BY rowid;
} {3 14 15 92}
do_execsql_test doltlite_recover_withoutrowid-14.13 {
  SELECT (SELECT lbl FROM a1 WHERE (+x, +y) = (a, b)) FROM a2 ORDER BY rowid;
} {3 14 15 92}
do_execsql_test doltlite_recover_withoutrowid-14.14 {
  SELECT a1.lbl FROM a1 WHERE (a, b) IN (SELECT x, y FROM a2) ORDER BY 1;
} {15 92}
do_execsql_test doltlite_recover_withoutrowid-14.15 {
  SELECT a1.lbl FROM a1, a2 WHERE EXISTS (
    SELECT 1 FROM a1 WHERE a=x AND b=y
  ) ORDER BY 1;
} {3 3 14 14 15 15 92 92}

do_execsql_test doltlite_recover_withoutrowid-15.1 {
  CREATE TABLE wt3(a, b, PRIMARY KEY(a COLLATE nocase, a));
  INSERT INTO wt3 VALUES('abc',1);
  INSERT INTO wt3 VALUES('ABC',2);
  SELECT a, b FROM wt3 ORDER BY b;
} {abc 1 ABC 2}
do_catchsql_test doltlite_recover_withoutrowid-15.2 {
  INSERT INTO wt3 VALUES('abc',3);
} {1 {UNIQUE constraint failed: wt3.a, wt3.a}}

do_execsql_test doltlite_recover_withoutrowid-16.1 {
  CREATE TABLE sk2(a TEXT, b INT, c INT, d INT, PRIMARY KEY(a,b,c));
  INSERT INTO sk2 VALUES('abc',345,7,8),('def',345,9,10),('ghi',346,11,12);
  ANALYZE;
  UPDATE sqlite_stat1 SET stat='10000 5000 2000 10' WHERE tbl='sk2';
  ANALYZE sqlite_master;
  SELECT a,b,c,d,'|' FROM sk2 WHERE d<>99 AND b=345 ORDER BY a;
} {abc 345 7 8 | def 345 9 10 |}
do_execsql_test doltlite_recover_withoutrowid-16.2 {
  EXPLAIN QUERY PLAN
  SELECT a,b,c,d,'|' FROM sk2 WHERE d<>99 AND b=345 ORDER BY a;
} {/* PRIMARY KEY (ANY(a) AND b=?)*/}
do_execsql_test doltlite_recover_withoutrowid-16.3 {
  CREATE TABLE skt1 (c1, c2, c3, c4, PRIMARY KEY(c4, c3));
  INSERT INTO skt1 VALUES(3,0,1,7);
  INSERT INTO skt1 VALUES(0,4,1,8);
  INSERT INTO skt1 VALUES(5,6,1,9);
  INSERT INTO skt1 VALUES(0,4,1,10);
  ANALYZE;
  UPDATE sqlite_stat1 SET stat='18 18 6' WHERE tbl='skt1';
  ANALYZE sqlite_master;
  SELECT DISTINCT quote(c1), quote(c2), quote(c3), '|'
    FROM skt1 WHERE skt1.c3 = 1 ORDER BY 1, 2;
} {0 4 1 | 3 0 1 | 5 6 1 |}
do_execsql_test doltlite_recover_withoutrowid-16.4 {
  EXPLAIN QUERY PLAN
  SELECT DISTINCT quote(c1), quote(c2), quote(c3), quote(c4), '|'
    FROM skt1 WHERE skt1.c3 = 1;
} {/* PRIMARY KEY (ANY(c4) AND c3=?)*/}
do_execsql_test doltlite_recover_withoutrowid-16.5 {
  CREATE TABLE people(
    name TEXT PRIMARY KEY,
    role TEXT NOT NULL,
    height INT NOT NULL,
    CHECK( role IN ('student','teacher') )
  );
  CREATE INDEX people_idx1 ON people(role, height);
  INSERT INTO people VALUES('Alice','student',156),('Bob','student',161),
   ('Cindy','student',155),('David','student',181),('Emily','teacher',158),
   ('Fred','student',163),('Ginny','student',169),('Harold','student',172),
   ('Imma','student',179),('Jack','student',181),('Karen','student',163),
   ('Logan','student',177),('Megan','teacher',159),('Nathan','student',163),
   ('Olivia','student',161),('Patrick','teacher',180),('Quiana','student',182),
   ('Robert','student',159),('Sally','student',166),('Tom','student',171),
   ('Ursula','student',170),('Vance','student',179),('Willma','student',175),
   ('Xavier','teacher',185),('Yvonne','student',149),('Zach','student',170);
  ANALYZE sqlite_master;
  INSERT INTO sqlite_stat1 VALUES('people','people_idx1','1000000 250000 2000');
  ANALYZE sqlite_master;
  SELECT name FROM people WHERE height>=180 ORDER BY +name;
} {David Jack Patrick Quiana Xavier}

do_test doltlite_recover_withoutrowid-17.1 {
  execsql {
    BEGIN;
    CREATE TABLE q1(a PRIMARY KEY, b UNIQUE);
  }
  for {set i 0} {$i < 500} {incr i} {
    execsql { INSERT INTO q1 VALUES($i, $i*$i) }
  }
  execsql COMMIT
  execsql { SELECT count(*) FROM q1 }
} {500}
do_execsql_test doltlite_recover_withoutrowid-17.2 {
  SELECT * FROM q1 WHERE a = 1 OR a = 2 ORDER BY a;
} {1 1 2 4}
do_test doltlite_recover_withoutrowid-17.3 {
  set p [wr_plan {SELECT * FROM q1 WHERE a = 1 OR a = 2}]
  string match {*SCAN q1*} $p
} {0}
do_execsql_test doltlite_recover_withoutrowid-17.4 {
  SELECT * FROM q1 WHERE a = 1 OR a = 2 OR b = 9 ORDER BY a;
} {1 1 2 4 3 9}
do_test doltlite_recover_withoutrowid-17.5 {
  set p [wr_plan {SELECT * FROM q1 WHERE a = 1 OR a = 2 OR b = 9}]
  string match {*SCAN q1*} $p
} {0}

do_execsql_test doltlite_recover_withoutrowid-18.1 {
  CREATE TABLE r1(field);
  CREATE TABLE r2(col PRIMARY KEY, descr);
  INSERT INTO r1 VALUES('abcd');
  INSERT INTO r2 VALUES('abcd', 'A nice description');
  INSERT INTO r2 VALUES('efgh', 'Another description');
  SELECT r1.field AS Field, r2.descr AS Descr
    FROM r1 INNER JOIN r2 ON r1.field = r2.col ORDER BY r1.field;
} {abcd {A nice description}}

do_execsql_test doltlite_recover_withoutrowid-19.1 {
  CREATE TABLE vreal(a PRIMARY KEY, b, c);
  INSERT INTO vreal VALUES(1, 2, 3);
  UPDATE vreal SET a = 2;
  SELECT * FROM vreal;
} {2 2 3}
do_execsql_test doltlite_recover_withoutrowid-19.2 {
  DELETE FROM vreal;
  SELECT count(*) FROM vreal;
} {0}
do_execsql_test doltlite_recover_withoutrowid-19.3 {
  BEGIN;
  INSERT INTO vreal VALUES(1, 2, 3);
  INSERT INTO vreal VALUES(4, 5, 6);
  INSERT INTO vreal VALUES(7, 8, 9);
  COMMIT;
  SELECT * FROM vreal ORDER BY a;
} {1 2 3 4 5 6 7 8 9}
do_execsql_test doltlite_recover_withoutrowid-19.4 {
  CREATE TABLE sreal(a, b, c UNIQUE);
  BEGIN;
  INSERT INTO sreal SELECT * FROM vreal;
  DELETE FROM vreal;
  COMMIT;
  SELECT * FROM sreal ORDER BY a;
  SELECT count(*) FROM vreal;
} {1 2 3 4 5 6 7 8 9 0}
do_execsql_test doltlite_recover_withoutrowid-19.5 {
  BEGIN;
  INSERT INTO vreal SELECT * FROM sreal;
  DELETE FROM sreal;
  ROLLBACK;
  SELECT * FROM sreal ORDER BY a;
  SELECT count(*) FROM vreal;
} {1 2 3 4 5 6 7 8 9 0}
do_catchsql_test doltlite_recover_withoutrowid-19.6 {
  INSERT INTO sreal VALUES(10, 11, 3);
} {1 {UNIQUE constraint failed: sreal.c}}
do_test doltlite_recover_withoutrowid-19.7 {
  register_echo_module [sqlite3_connection_pointer db]
  execsql {
    CREATE TABLE rreal(a INTEGER PRIMARY KEY, b, c);
    CREATE VIRTUAL TABLE recho USING echo(rreal);
  }
  set ::echo_module [list]
  execsql { INSERT INTO recho VALUES(1, 2, 3) }
  string match {*xBegin echo(rreal) xSync echo(rreal) xCommit echo(rreal)} \
      $::echo_module
} {1}
do_test doltlite_recover_withoutrowid-19.8 {
  set ::echo_module [list]
  set ::echo_module_sync_fail rreal
  set res [catchsql { INSERT INTO recho VALUES(4, 5, 6) }]
  unset ::echo_module_sync_fail
  list $res [string match \
      {*xBegin echo(rreal) xSync echo(rreal) xRollback echo(rreal)} \
      $::echo_module]
} {{1 {unknown error}} 1}
do_execsql_test doltlite_recover_withoutrowid-19.9 {
  SELECT * FROM rreal;
} {1 2 3}

do_test doltlite_recover_withoutrowid-20.1 {
  execsql {
    CREATE TABLE bt1(a PRIMARY KEY, b);
    INSERT INTO bt1 VALUES(1, zeroblob(600));
    INSERT INTO bt1 VALUES(2, zeroblob(600));
    INSERT INTO bt1 VALUES(3, zeroblob(600));
  }
  db close
  sqlite3 db test.db
  execsql { SELECT count(*) FROM bt1 }
} {3}
do_execsql_test doltlite_recover_withoutrowid-20.2 {
  SELECT length(b) FROM bt1 WHERE a=2;
} {600}
do_execsql_test doltlite_recover_withoutrowid-20.3 {
  SELECT length(b) FROM bt1 WHERE a=2;
} {600}
do_execsql_test doltlite_recover_withoutrowid-20.4 {
  SELECT length(b) FROM bt1 WHERE a=1;
} {600}
do_execsql_test doltlite_recover_withoutrowid-20.5 {
  INSERT INTO bt1 VALUES(4, zeroblob(600));
  INSERT INTO bt1 VALUES(5, zeroblob(600));
  SELECT a, length(b) FROM bt1 ORDER BY a;
} {1 600 2 600 3 600 4 600 5 600}
do_execsql_test doltlite_recover_withoutrowid-20.6 {
  UPDATE bt1 SET b=zeroblob(1000);
  SELECT a, length(b) FROM bt1 ORDER BY a;
} {1 1000 2 1000 3 1000 4 1000 5 1000}
do_execsql_test doltlite_recover_withoutrowid-20.7 {
  PRAGMA integrity_check;
} {ok}

do_execsql_test doltlite_recover_withoutrowid-21.1 {
  CREATE TABLE test1(f1 int, f2 int primary key);
  INSERT INTO test1 VALUES(15, 32768), (16, 65536), (17, 131072);
  SELECT f1 FROM test1 WHERE f2=65536;
} {16}
do_catchsql_test doltlite_recover_withoutrowid-21.2 {
  INSERT INTO test1 VALUES(99, 65536);
} {1 {UNIQUE constraint failed: test1.f2}}
do_test doltlite_recover_withoutrowid-21.3 {
  execsql {
    CREATE TABLE t7(c UNIQUE PRIMARY KEY);
    INSERT INTO t7 VALUES(1);
  }
  catchsql { INSERT INTO t7 VALUES(1) }
} {1 {UNIQUE constraint failed: t7.c}}
do_test doltlite_recover_withoutrowid-21.4 {
  execsql {
    DROP TABLE t7;
    CREATE TABLE t7(c UNIQUE PRIMARY KEY);
    INSERT INTO t7 VALUES(1);
  }
  catchsql { INSERT INTO t7 VALUES(1) }
} {1 {UNIQUE constraint failed: t7.c}}
do_test doltlite_recover_withoutrowid-21.5 {
  execsql {
    DROP TABLE t7;
    CREATE TABLE t7(c PRIMARY KEY, UNIQUE(c));
    INSERT INTO t7 VALUES(1);
  }
  catchsql { INSERT INTO t7 VALUES(1) }
} {1 {UNIQUE constraint failed: t7.c}}
do_test doltlite_recover_withoutrowid-21.6 {
  execsql {
    DROP TABLE t7;
    CREATE TABLE t7(c, d, UNIQUE(c, d), PRIMARY KEY(c, d));
    INSERT INTO t7 VALUES(1, 1);
    INSERT INTO t7 VALUES(1, 2);
  }
  catchsql { INSERT INTO t7 VALUES(1, 1) }
} {1 {UNIQUE constraint failed: t7.c, t7.d}}
do_test doltlite_recover_withoutrowid-21.7 {
  execsql {
    DROP TABLE t7;
    CREATE TABLE t7(c, d, UNIQUE(c), PRIMARY KEY(c, d));
    INSERT INTO t7 VALUES(1, 1);
  }
  catchsql { INSERT INTO t7 VALUES(1, 2) }
} {1 {UNIQUE constraint failed: t7.c}}

do_test doltlite_recover_withoutrowid-22.1 {
  execsql {
    PRAGMA foreign_keys = 1;
    CREATE TABLE fbp(a PRIMARY KEY, b);
    CREATE TABLE fbc(id INTEGER PRIMARY KEY, b REFERENCES fbp(a));
    INSERT INTO fbp VALUES('hello', 'world');
    INSERT INTO fbc VALUES(1, 'hello');
  }
  set rc [catch { set fd [db incrblob fbc b 1] } msg]
  list $rc $msg
} {1 {cannot open foreign key column for writing}}
do_test doltlite_recover_withoutrowid-22.2 {
  set rc [catch { set fd [db incrblob -readonly fbc b 1] } msg]
  close $fd
  set rc
} {0}
do_test doltlite_recover_withoutrowid-22.3 {
  execsql { PRAGMA foreign_keys = off }
  set rc [catch { set fd [db incrblob fbc b 1] } msg]
  close $fd
  execsql { PRAGMA foreign_keys = on }
  set rc
} {0}

do_execsql_test doltlite_recover_withoutrowid-23.1 {
  CREATE TABLE pp(a UNIQUE, b, c, PRIMARY KEY(b, c));
  CREATE TABLE cc(d, e, f UNIQUE, FOREIGN KEY(d, e) REFERENCES pp);
  INSERT INTO pp VALUES(1, 2, 3);
  INSERT INTO cc VALUES(2, 3, 1);
} {}
do_catchsql_test doltlite_recover_withoutrowid-23.2 {
  REPLACE INTO pp VALUES(1, 4, 5);
} {1 {FOREIGN KEY constraint failed}}
do_execsql_test doltlite_recover_withoutrowid-23.3 {
  SELECT * FROM pp;
  SELECT * FROM cc;
} {1 2 3 2 3 1}
do_test doltlite_recover_withoutrowid-23.4 {
  execsql BEGIN
  catchsql { REPLACE INTO pp VALUES(1, 4, 5) }
} {1 {FOREIGN KEY constraint failed}}
do_execsql_test doltlite_recover_withoutrowid-23.5 {
  COMMIT;
  SELECT * FROM pp;
  SELECT * FROM cc;
} {1 2 3 2 3 1}
do_execsql_test doltlite_recover_withoutrowid-23.6 {
  REPLACE INTO pp VALUES(2, 2, 3);
  SELECT * FROM pp;
  SELECT * FROM cc;
} {2 2 3 2 3 1}
do_execsql_test doltlite_recover_withoutrowid-23.7 {
  REPLACE INTO pp VALUES(2, 2, 3);
  SELECT * FROM pp;
  SELECT * FROM cc;
} {2 2 3 2 3 1}

do_test doltlite_recover_withoutrowid-24.1 {
  set cols500 {}
  set cols501 {}
  for {set i 0} {$i < 500} {incr i} { lappend cols500 "c$i" }
  for {set i 0} {$i < 501} {incr i} { lappend cols501 "c$i" }
  sqlite3_limit db SQLITE_LIMIT_COLUMN 500
  set r1 [catchsql "CREATE TABLE ctok([join $cols500 ,])"]
  set r2 [catchsql "CREATE TABLE ct11([join $cols501 ,])"]
  sqlite3_limit db SQLITE_LIMIT_COLUMN 2000
  list $r1 $r2
} {{0 {}} {1 {too many columns on ct11}}}
do_execsql_test doltlite_recover_withoutrowid-24.2 {
  CREATE TABLE et1(x PRIMARY KEY, y);
  CREATE TABLE et2(x, y, PRIMARY KEY(x, y));
} {}
do_catchsql_test doltlite_recover_withoutrowid-24.3 {
  INSERT INTO et1 VALUES(NULL, 0);
} {1 {NOT NULL constraint failed: et1.x}}
do_catchsql_test doltlite_recover_withoutrowid-24.4 {
  INSERT INTO et2 VALUES(NULL, 'zero');
} {1 {NOT NULL constraint failed: et2.x}}
do_catchsql_test doltlite_recover_withoutrowid-24.5 {
  INSERT INTO et2 VALUES(0, NULL);
} {1 {NOT NULL constraint failed: et2.y}}
do_catchsql_test doltlite_recover_withoutrowid-24.6 {
  INSERT INTO et2 VALUES(NULL, NULL);
} {1 {NOT NULL constraint failed: et2.x}}
do_execsql_test doltlite_recover_withoutrowid-24.7 {
  CREATE TABLE etu(x UNIQUE, y);
  INSERT INTO etu VALUES(NULL, 0);
  INSERT INTO etu VALUES(NULL, 0);
  INSERT INTO etu VALUES(NULL, 0);
  SELECT count(*) FROM etu WHERE x IS NULL;
} {3}
do_execsql_test doltlite_recover_withoutrowid-24.8 {
  SELECT count(*) FROM et1 WHERE x IS NULL;
  SELECT count(*) FROM et2 WHERE x IS NULL;
  SELECT count(*) FROM et2 WHERE y IS NULL;
} {0 0 0}
do_test doltlite_recover_withoutrowid-24.9 {
  execsql {
    CREATE TABLE ei1(a TEXT PRIMARY KEY, b);
    INSERT INTO ei1 VALUES('k', 1);
  }
  catchsql { INSERT INTO ei1 VALUES('k', 2) }
} {1 {UNIQUE constraint failed: ei1.a}}
do_test doltlite_recover_withoutrowid-24.10 {
  execsql {
    CREATE TABLE ei4(a PRIMARY KEY, b TEXT UNIQUE);
    INSERT INTO ei4 VALUES(1, 'x');
  }
  list [catchsql { INSERT INTO ei4 VALUES(1, 'y') }] \
       [catchsql { INSERT INTO ei4 VALUES(2, 'x') }]
} {{1 {UNIQUE constraint failed: ei4.a}} {1 {UNIQUE constraint failed: ei4.b}}}
do_test doltlite_recover_withoutrowid-24.11 {
  execsql {
    CREATE TABLE ei5(a PRIMARY KEY, b, c, UNIQUE(c, b));
    INSERT INTO ei5 VALUES(1, 'b', 'c');
  }
  list [catchsql { INSERT INTO ei5 VALUES(1, 'q', 'r') }] \
       [catchsql { INSERT INTO ei5 VALUES(2, 'b', 'c') }]
} {{1 {UNIQUE constraint failed: ei5.a}} {1 {UNIQUE constraint failed: ei5.c, ei5.b}}}
do_execsql_test doltlite_recover_withoutrowid-24.12 {
  CREATE TABLE eq1(a, b PRIMARY KEY);
  INSERT INTO eq1 VALUES('x', 5);
  EXPLAIN QUERY PLAN SELECT * FROM eq1 WHERE b = 5;
} {/*SEARCH eq1 USING PRIMARY KEY (b=?)*/}
do_execsql_test doltlite_recover_withoutrowid-24.13 {
  SELECT * FROM eq1 WHERE b = 5;
} {x 5}
do_execsql_test doltlite_recover_withoutrowid-24.14 {
  CREATE TABLE t1_re(a PRIMARY KEY ON CONFLICT REPLACE, b);
  INSERT INTO t1_re VALUES(1, 'one');
  INSERT INTO t1_re VALUES(2, 'two');
  BEGIN;
  INSERT INTO t1_re VALUES(3, 'three');
  INSERT INTO t1_re SELECT ((a%2)*a+3), 'string' FROM t1_re;
  SELECT * FROM t1_re ORDER BY a;
} {1 one 2 two 3 string 4 string 6 string}
do_test doltlite_recover_withoutrowid-24.15 {
  set ac [sqlite3_get_autocommit db]
  execsql COMMIT
  set ac
} {0}
do_test doltlite_recover_withoutrowid-24.16 {
  set res {}
  foreach create {
    {CREATE TABLE et5(pk integer, v integer, primary key(pk, v))}
    {CREATE TABLE et5(pk int, v integer, primary key(pk, v))}
    {CREATE TABLE et5(pk int, v integer, primary key(pk))}
    {CREATE TABLE et5(pk int primary key, v integer)}
  } {
    catchsql { DROP TABLE et5 }
    execsql $create
    lappend res [lindex [catchsql { SELECT rowid FROM et5 }] 0]
  }
  set res
} {0 0 0 0}
do_test doltlite_recover_withoutrowid-24.17 {
  execsql {
    CREATE TABLE et6(pk INT primary key);
    CREATE TABLE et7(pk BIGINT primary key);
    CREATE TABLE et8(pk SHORT INTEGER primary key);
    CREATE TABLE et9(pk UNSIGNED INTEGER primary key);
  }
  list [lindex [catchsql {SELECT rowid FROM et6}] 0] \
       [lindex [catchsql {SELECT rowid FROM et7}] 0] \
       [lindex [catchsql {SELECT rowid FROM et8}] 0] \
       [lindex [catchsql {SELECT rowid FROM et9}] 0]
} {0 0 0 0}
do_execsql_test doltlite_recover_withoutrowid-24.18 {
  INSERT INTO et6 VALUES('2.0');
  INSERT INTO et7 VALUES('2.0');
  INSERT INTO et8 VALUES('2.0');
  INSERT INTO et9 VALUES('2.0');
  SELECT typeof(pk), pk FROM et6;
  SELECT typeof(pk), pk FROM et7;
  SELECT typeof(pk), pk FROM et8;
  SELECT typeof(pk), pk FROM et9;
} {integer 2 integer 2 integer 2 integer 2}
do_catchsql_test doltlite_recover_withoutrowid-24.19 {
  INSERT INTO et6 VALUES(2);
} {1 {UNIQUE constraint failed: et6.pk}}
do_test doltlite_recover_withoutrowid-24.20 {
  execsql { CREATE TABLE etd(x INTEGER PRIMARY KEY DESC, y, z) }
  list [catchsql { SELECT rowid FROM etd }] \
       [execsql { INSERT INTO etd VALUES(5,1,2); SELECT x,y,z FROM etd }]
} {{0 {}} {5 1 2}}

do_execsql_test doltlite_recover_withoutrowid-25.1 {
  CREATE TABLE kt1(a COLLATE nocase PRIMARY KEY);
  CREATE TABLE kt2(b REFERENCES kt1);
  INSERT INTO kt1 VALUES('oNe');
  INSERT INTO kt2 VALUES('one');
  INSERT INTO kt2 VALUES('ONE');
  UPDATE kt2 SET b = 'OnE';
  UPDATE kt1 SET a = 'ONE';
} {}
do_catchsql_test doltlite_recover_withoutrowid-25.2 {
  DELETE FROM kt1 WHERE a='one';
} {1 {FOREIGN KEY constraint failed}}
do_execsql_test doltlite_recover_withoutrowid-25.3 {
  CREATE TABLE at1(a NUMERIC PRIMARY KEY);
  CREATE TABLE at2(b TEXT REFERENCES at1);
  INSERT INTO at1 VALUES(1);
  INSERT INTO at1 VALUES(2);
  INSERT INTO at1 VALUES('three');
  INSERT INTO at2 VALUES('2.0');
} {}
do_catchsql_test doltlite_recover_withoutrowid-25.4 {
  DELETE FROM at1 WHERE a=2;
} {1 {FOREIGN KEY constraint failed}}
do_execsql_test doltlite_recover_withoutrowid-25.5 {
  DELETE FROM at1 WHERE a=1;
  SELECT count(*) FROM at1;
} {2}
do_execsql_test doltlite_recover_withoutrowid-25.6 {
  CREATE TABLE pA(x PRIMARY KEY);
  CREATE TABLE cA(c REFERENCES pA ON DELETE SET NULL);
  CREATE TABLE cB(c REFERENCES pA ON UPDATE SET NULL);
  INSERT INTO pA VALUES(X'ABCD');
  INSERT INTO pA VALUES(X'1234');
  INSERT INTO cA VALUES(X'ABCD');
  INSERT INTO cB VALUES(X'1234');
  DELETE FROM pA WHERE x=X'ABCD';
  SELECT quote(x) FROM pA;
} {X'1234'}
do_execsql_test doltlite_recover_withoutrowid-25.7 {
  SELECT quote(c) FROM cA;
} {NULL}
do_execsql_test doltlite_recover_withoutrowid-25.8 {
  UPDATE pA SET x = X'8765' WHERE x=X'1234';
  SELECT quote(x) FROM pA;
} {X'8765'}
do_execsql_test doltlite_recover_withoutrowid-25.9 {
  SELECT quote(c) FROM cB;
} {NULL}
do_execsql_test doltlite_recover_withoutrowid-25.10 {
  CREATE TABLE pD(x PRIMARY KEY);
  CREATE TABLE cD(c DEFAULT X'0000' REFERENCES pD ON DELETE SET DEFAULT);
  CREATE TABLE cE(c DEFAULT X'9999' REFERENCES pD ON UPDATE SET DEFAULT);
  INSERT INTO pD VALUES(X'0000');
  INSERT INTO pD VALUES(X'9999');
  INSERT INTO pD VALUES(X'ABCD');
  INSERT INTO pD VALUES(X'1234');
  INSERT INTO cD VALUES(X'ABCD');
  INSERT INTO cE VALUES(X'1234');
} {}
do_execsql_test doltlite_recover_withoutrowid-25.11 {
  DELETE FROM pD WHERE x=X'ABCD';
  SELECT quote(x) FROM pD ORDER BY x;
} {X'0000' X'1234' X'9999'}
do_execsql_test doltlite_recover_withoutrowid-25.12 {
  SELECT quote(c) FROM cD;
} {X'0000'}
do_execsql_test doltlite_recover_withoutrowid-25.13 {
  UPDATE pD SET x = X'8765' WHERE x=X'1234';
  SELECT quote(x) FROM pD ORDER BY x;
} {X'0000' X'8765' X'9999'}
do_execsql_test doltlite_recover_withoutrowid-25.14 {
  SELECT quote(c) FROM cE;
} {X'9999'}
do_test doltlite_recover_withoutrowid-25.15 {
  proc maxparent {args} { db one {SELECT max(x) FROM parent} }
  db func maxparent maxparent
  execsql {
    CREATE TABLE parent(x PRIMARY KEY);
    CREATE TRIGGER bu BEFORE UPDATE ON parent BEGIN
      INSERT INTO parent VALUES(new.x-old.x);
    END;
    CREATE TABLE child(
      a DEFAULT (maxparent()) REFERENCES parent ON UPDATE SET DEFAULT
    );
    CREATE TRIGGER au AFTER UPDATE ON parent BEGIN
      INSERT INTO parent VALUES(new.x+old.x);
    END;
    INSERT INTO parent VALUES(1);
    INSERT INTO child VALUES(1);
    UPDATE parent SET x = 22;
    SELECT x FROM parent ORDER BY x; SELECT 'xxx'; SELECT a FROM child;
  }
} {21 22 23 xxx 22}
do_execsql_test doltlite_recover_withoutrowid-25.16 {
  DELETE FROM child;
  DELETE FROM parent;
  INSERT INTO parent VALUES(-1);
  INSERT INTO child VALUES(-1);
  UPDATE parent SET x = 22;
  SELECT x FROM parent ORDER BY x; SELECT 'xxx'; SELECT a FROM child;
} {21 22 23 xxx 23}
do_execsql_test doltlite_recover_withoutrowid-25.17 {
  CREATE TABLE zeus(a INTEGER COLLATE NOCASE, b, PRIMARY KEY(a, b));
  CREATE TABLE apollo(c, d, FOREIGN KEY(c, d) REFERENCES zeus ON UPDATE CASCADE);
  INSERT INTO zeus VALUES('abc', 'xyz');
  INSERT INTO apollo VALUES('ABC', 'xyz');
  UPDATE zeus SET a = 'aBc';
  SELECT * FROM apollo;
} {ABC xyz}
do_execsql_test doltlite_recover_withoutrowid-25.18 {
  UPDATE zeus SET b = 'www';
  SELECT typeof(c), c, typeof(d), d FROM apollo;
} {text aBc text www}
do_catchsql_test doltlite_recover_withoutrowid-25.19 {
  UPDATE zeus SET b = NULL;
} {1 {NOT NULL constraint failed: zeus.b}}
do_execsql_test doltlite_recover_withoutrowid-25.20 {
  CREATE TABLE p(a, b, PRIMARY KEY(a, b));
  CREATE TABLE pc1(c, d, FOREIGN KEY(c, d) REFERENCES p ON DELETE SET NULL);
  CREATE TABLE pc5(c, d, FOREIGN KEY(c, d) REFERENCES p ON DELETE NO ACTION);
  CREATE TABLE log(msg);
  CREATE TRIGGER tt AFTER DELETE ON p BEGIN
    INSERT INTO log VALUES('delete ' || old.a);
  END;
  INSERT INTO p VALUES('a', 'b');
  INSERT INTO pc1 VALUES('a', 'b');
  BEGIN;
  DROP TABLE p;
  SELECT * FROM pc1;
} {{} {}}
do_execsql_test doltlite_recover_withoutrowid-25.21 {
  SELECT * FROM log;
} {}
do_execsql_test doltlite_recover_withoutrowid-25.22 {
  ROLLBACK;
  BEGIN;
  DELETE FROM p;
  SELECT * FROM log;
} {{delete a}}
do_execsql_test doltlite_recover_withoutrowid-25.23 {
  ROLLBACK;
  DELETE FROM pc1;
  INSERT INTO pc5 VALUES('a', 'b');
} {}
do_catchsql_test doltlite_recover_withoutrowid-25.24 {
  BEGIN;
  DROP TABLE p;
} {1 {FOREIGN KEY constraint failed}}
do_test doltlite_recover_withoutrowid-25.25 {
  set res [execsql {
    SELECT * FROM p;
    SELECT * FROM pc5;
  }]
  catchsql ROLLBACK
  set res
} {a b a b}

finish_test
