# 2026 June 12
#
# The author disclaims copyright to this source code.  In place of
# a legal notice, here is a blessing:
#
#    May you do good and not evil.
#    May you find forgiveness for yourself and forgive others.
#    May you share freely, never taking more than you give.
#
#*************************************************************************

set testdir [file dirname $argv0]
source $testdir/tester.tcl
source $testdir/fts3_common.tcl
set ::testprefix doltlite_fts_reverse_pending_delete

ifcapable !fts3 {
  finish_test
  return
}

do_test 1.0 {
  fts3_build_db_1 5000
} {}

do_execsql_test 1.1 {
  CREATE VIRTUAL TABLE terms USING fts4term(t1);
  SELECT count(*) FROM terms;
} {40000}

do_execsql_test 1.2 {
  BEGIN;
  DELETE FROM t1_segdir WHERE level=0;
  SELECT level, idx FROM t1_segdir
    WHERE level BETWEEN 0 AND 1023
    ORDER BY level DESC, idx ASC;
} {3 0 2 0 2 1 2 2 1 0 1 1 1 2 1 3 1 4 1 5 1 6 1 7}

do_execsql_test 1.3 {
  SELECT count(*) FROM terms;
} {39936}

do_catchsql_test 1.4 {
  INSERT INTO t1(t1) VALUES('integrity-check');
} {1 {database disk image is malformed}}

do_execsql_test 1.5 {
  ROLLBACK;
}

finish_test
