# 2026-07-13
#
# History/at/diff/workspace tables must decode PRIMARY KEY values for every
# key shape. Rows whose PRIMARY KEY covers all columns store an empty value
# record (the row lives in the clustered sort key), so readers that only
# consult the value record returned NULL for every column: single TEXT/BLOB/
# REAL PKs and composite PKs of any type. Single INTEGER PKs took the intkey
# path and worked all along.
#
set testdir [file dirname $argv0]
source $testdir/tester.tcl
set testprefix doltlite_recover_history_pk

db close
forcedelete hpk.db
sqlite3 db hpk.db

do_execsql_test 1.0 {
  CREATE TABLE t_text(k TEXT PRIMARY KEY);
  CREATE TABLE t_blob(k BLOB PRIMARY KEY);
  CREATE TABLE t_real(k REAL PRIMARY KEY);
  CREATE TABLE t_int (k INTEGER PRIMARY KEY);
  CREATE TABLE t_comp(p INT, c INT, PRIMARY KEY(p,c));
  CREATE TABLE t_mix (a TEXT, b REAL, c BLOB, PRIMARY KEY(a,b,c));
  CREATE TABLE t_desc(a INT, b INT, PRIMARY KEY(a DESC, b));
  CREATE TABLE t_nc  (k TEXT COLLATE NOCASE PRIMARY KEY);
  INSERT INTO t_text VALUES('hello');
  INSERT INTO t_blob VALUES(x'deadbeef');
  INSERT INTO t_real VALUES(3.25);
  INSERT INTO t_int  VALUES(42);
  INSERT INTO t_comp VALUES(1,2),(1,3);
  INSERT INTO t_mix  VALUES('x',1.5,x'0102');
  INSERT INTO t_desc VALUES(10,20);
  INSERT INTO t_nc   VALUES('MiXeD');
} {}
do_test 1.1 {
  regexp {[0-9a-f]{40}} [db one {SELECT dolt_commit('-A','-m','c1')}]
} {1}

# Point-in-time reads decode the key for every PK shape.
do_execsql_test 2.1 { SELECT quote(k) FROM dolt_at_t_text('HEAD') } {'hello'}
do_execsql_test 2.2 { SELECT quote(k) FROM dolt_at_t_blob('HEAD') } {X'DEADBEEF'}
do_execsql_test 2.3 { SELECT quote(k) FROM dolt_at_t_real('HEAD') } {3.25}
do_execsql_test 2.4 { SELECT quote(k) FROM dolt_at_t_int('HEAD') } {42}
do_execsql_test 2.5 {
  SELECT p, c FROM dolt_at_t_comp('HEAD') ORDER BY p, c
} {1 2 1 3}
do_execsql_test 2.6 {
  SELECT quote(a), quote(b), quote(c) FROM dolt_at_t_mix('HEAD')
} {'x' 1.5 X'0102'}
do_execsql_test 2.7 { SELECT a, b FROM dolt_at_t_desc('HEAD') } {10 20}
do_execsql_test 2.8 { SELECT quote(k) FROM dolt_at_t_nc('HEAD') } {'MiXeD'}

# History tables decode the key.
do_execsql_test 3.1 { SELECT quote(k) FROM dolt_history_t_text } {'hello'}
do_execsql_test 3.2 {
  SELECT p, c FROM dolt_history_t_comp ORDER BY p, c
} {1 2 1 3}

# Workspace (uncommitted) changes decode the key.
do_execsql_test 4.0 {
  INSERT INTO t_comp VALUES(5,6);
  INSERT INTO t_text VALUES('world');
} {}
do_execsql_test 4.1 {
  SELECT to_p, to_c, diff_type FROM dolt_workspace_t_comp
} {5 6 added}
do_execsql_test 4.2 {
  SELECT quote(to_k), diff_type FROM dolt_workspace_t_text
} {'world' added}

# Committed diffs decode the key on both sides.
do_test 5.0 {
  regexp {[0-9a-f]{40}} [db one {SELECT dolt_commit('-A','-m','c2')}]
} {1}
do_execsql_test 5.1 {
  DELETE FROM t_comp WHERE p=1 AND c=3;
  DELETE FROM t_text WHERE k='hello';
} {}
do_test 5.2 {
  regexp {[0-9a-f]{40}} [db one {SELECT dolt_commit('-A','-m','c3')}]
} {1}
do_execsql_test 5.3 {
  SELECT from_p, from_c, diff_type FROM dolt_diff_t_comp
   WHERE diff_type='removed'
} {1 3 removed}
do_execsql_test 5.4 {
  SELECT quote(from_k), diff_type FROM dolt_diff_t_text
   WHERE diff_type='removed'
} {'hello' removed}
do_execsql_test 5.5 {
  SELECT quote(to_k), diff_type FROM dolt_diff_t_text
   WHERE to_commit_date IS NOT NULL AND diff_type='added'
   ORDER BY to_k
} {'hello' added 'world' added}

db close
finish_test
