
set testdir [file dirname $argv0]
source $testdir/tester.tcl

do_execsql_test doltlite_recover_jrnlwal_3-1.1 {
  PRAGMA journal_mode;
} {wal}
do_execsql_test doltlite_recover_jrnlwal_3-1.2 {
  PRAGMA journal_mode=delete;
} {delete}
do_execsql_test doltlite_recover_jrnlwal_3-1.3 {
  PRAGMA journal_mode=truncate;
} {truncate}
do_execsql_test doltlite_recover_jrnlwal_3-1.4 {
  PRAGMA journal_mode=persist;
} {persist}
do_execsql_test doltlite_recover_jrnlwal_3-1.5 {
  PRAGMA journal_mode=memory;
} {memory}
do_execsql_test doltlite_recover_jrnlwal_3-1.6 {
  PRAGMA journal_mode=off;
} {off}
do_execsql_test doltlite_recover_jrnlwal_3-1.7 {
  PRAGMA journal_mode=wal;
} {wal}
do_execsql_test doltlite_recover_jrnlwal_3-1.8 {
  PRAGMA auto_vacuum;
} {0}
do_test doltlite_recover_jrnlwal_3-1.9 {
  list [catchsql {PRAGMA auto_vacuum=incremental}] \
       [execsql {PRAGMA auto_vacuum}]
} {{0 {}} 0}
do_test doltlite_recover_jrnlwal_3-1.10 {
  list [catchsql {PRAGMA auto_vacuum=full}] \
       [execsql {PRAGMA auto_vacuum}]
} {{0 {}} 0}
do_test doltlite_recover_jrnlwal_3-1.11 {
  list [catchsql {PRAGMA auto_vacuum=2}] \
       [execsql {PRAGMA auto_vacuum}]
} {{0 {}} 0}
do_catchsql_test doltlite_recover_jrnlwal_3-1.12 {
  PRAGMA incremental_vacuum;
} {0 {}}
do_catchsql_test doltlite_recover_jrnlwal_3-1.13 {
  PRAGMA incremental_vacuum(5);
} {0 {}}
do_execsql_test doltlite_recover_jrnlwal_3-1.14 {
  PRAGMA incr_vacuum;
} {}
do_execsql_test doltlite_recover_jrnlwal_3-1.15 {
  PRAGMA wal_checkpoint;
} {0 0 0}
do_execsql_test doltlite_recover_jrnlwal_3-1.16 {
  PRAGMA wal_autocheckpoint;
} {1000}
do_execsql_test doltlite_recover_jrnlwal_3-1.17 {
  PRAGMA wal_autocheckpoint=1;
} {1}
do_execsql_test doltlite_recover_jrnlwal_3-1.18 {
  PRAGMA journal_size_limit;
} {-1}
do_execsql_test doltlite_recover_jrnlwal_3-1.19 {
  PRAGMA journal_size_limit=12000;
} {-1}
do_catchsql_test doltlite_recover_jrnlwal_3-1.20 {
  PRAGMA wal_checkpoint(TRUNCATE);
} {1 {wal_checkpoint mode is not configurable on doltlite-format databases; use the default (PASSIVE) form}}

do_test doltlite_recover_jrnlwal_3-2.1 {
  execsql {
    PRAGMA wal_autocheckpoint=1000;
    CREATE TABLE t1(x);
    INSERT INTO t1 VALUES(1);
    INSERT INTO t1 VALUES(2);
  }
  list [file exists test.db-wal] [file exists test.db-shm] \
       [file exists test.db-journal]
} {0 0 0}
do_test doltlite_recover_jrnlwal_3-2.2 {
  db close
  set res [list [file exists test.db] [file exists test.db-wal] \
                [file exists test.db-shm]]
  sqlite3 db test.db
  concat $res [execsql {SELECT x FROM t1 ORDER BY x}]
} {1 0 0 1 2}
do_test doltlite_recover_jrnlwal_3-2.3 {
  execsql {
    CREATE TABLE t1big(a);
    INSERT INTO t1big VALUES(zeroblob(50000));
    UPDATE t1big SET a=zeroblob(50001);
  }
  db close
  set res [list [file exists test.db-wal] [file exists test.db-shm]]
  sqlite3 db test.db
  concat $res [execsql {SELECT length(a) FROM t1big}] \
              [execsql {PRAGMA integrity_check}]
} {0 0 50001 ok}

set ::straywal "garbage bytes that are not a valid wal file 0123456789"
do_test doltlite_recover_jrnlwal_3-3.1 {
  forcedelete test2.db test2.db-wal test2.db-shm
  close [open test2.db w]
  set fd [open test2.db-wal w]
  puts -nonewline $fd $::straywal
  close $fd
  sqlite3 dbz test2.db
  catchsql {SELECT name FROM sqlite_master} dbz
} {0 {}}
do_test doltlite_recover_jrnlwal_3-3.2 {
  set fd [open test2.db-wal r]
  set content [read $fd]
  close $fd
  expr {$content eq $::straywal}
} {1}
do_test doltlite_recover_jrnlwal_3-3.3 {
  catchsql {SELECT count(*) FROM sqlite_master} dbz
} {0 0}
do_test doltlite_recover_jrnlwal_3-3.4 {
  execsql {
    CREATE TABLE q(z);
    INSERT INTO q VALUES(7);
  } dbz
  dbz close
  sqlite3 dbz test2.db
  set res [execsql {
    SELECT z FROM q;
    PRAGMA integrity_check;
  } dbz]
  dbz close
  set res
} {7 ok}
do_test doltlite_recover_jrnlwal_3-3.5 {
  forcedelete test2.db test2.db-wal
  set {} {}
} {}

do_test doltlite_recover_jrnlwal_3-4.1 {
  execsql {
    CREATE TABLE big(a UNIQUE, b UNIQUE);
    WITH ii(i) AS (VALUES(1) UNION ALL SELECT i+1 FROM ii WHERE i<64)
    INSERT INTO big SELECT printf('a%05d',i)||hex(zeroblob(100)),
                           printf('b%05d',i)||hex(zeroblob(150)) FROM ii;
    SELECT count(*) FROM big;
    PRAGMA integrity_check;
  }
} {64 ok}
do_test doltlite_recover_jrnlwal_3-4.2 {
  execsql {
    BEGIN;
    INSERT INTO big VALUES('zzz-uncommitted','zzz-uncommitted-2');
  }
  db close
  sqlite3 db test.db
  execsql {
    SELECT count(*) FROM big;
    SELECT count(*) FROM big WHERE a='zzz-uncommitted';
    PRAGMA integrity_check;
  }
} {64 0 ok}
do_test doltlite_recover_jrnlwal_3-4.3 {
  set ::h1 [db eval {SELECT dolt_hashof_table('big')}]
  db close
  sqlite3 db test.db
  expr {[db eval {SELECT dolt_hashof_table('big')}] eq $::h1}
} {1}
do_test doltlite_recover_jrnlwal_3-4.4 {
  sqlite3 db2 test.db
  execsql { INSERT INTO big VALUES('from-db2','from-db2-b') } db2
  db2 close
  execsql { SELECT count(*) FROM big WHERE a='from-db2' }
} {1}

do_test doltlite_recover_jrnlwal_3-5.1 {
  execsql {
    CREATE TABLE b(c);
    INSERT INTO b VALUES('Tehran');
    INSERT INTO b VALUES('Qom');
    INSERT INTO b VALUES('Markazi');
    PRAGMA wal_checkpoint;
  }
} {0 0 0}
do_test doltlite_recover_jrnlwal_3-5.2 {
  sqlite3 db2 test.db
  execsql { SELECT c FROM b ORDER BY c } db2
} {Markazi Qom Tehran}
do_test doltlite_recover_jrnlwal_3-5.3 {
  set ::r {}
  db eval { SELECT c FROM b } {
    db eval { INSERT INTO b VALUES('Qazvin') }
    set ::r [execsql { SELECT c FROM b ORDER BY c } db2]
    break
  }
  set ::r
} {Markazi Qazvin Qom Tehran}
do_test doltlite_recover_jrnlwal_3-5.4 {
  execsql {
    BEGIN;
    INSERT INTO b VALUES('Gilan');
  }
  execsql { SELECT c FROM b ORDER BY c } db2
} {Markazi Qazvin Qom Tehran}
do_test doltlite_recover_jrnlwal_3-5.5 {
  catchsql { INSERT INTO b VALUES('Ardabil') } db2
} {1 {database is locked}}
do_test doltlite_recover_jrnlwal_3-5.6 {
  execsql { COMMIT }
  list [execsql {SELECT c FROM b ORDER BY c}] \
       [execsql {SELECT c FROM b ORDER BY c} db2]
} {{Gilan Markazi Qazvin Qom Tehran} {Gilan Markazi Qazvin Qom Tehran}}
do_test doltlite_recover_jrnlwal_3-5.7 {
  execsql { INSERT INTO b VALUES('Ardabil') } db2
  execsql { SELECT c FROM b ORDER BY c }
} {Ardabil Gilan Markazi Qazvin Qom Tehran}
do_test doltlite_recover_jrnlwal_3-5.8 {
  set ::dropmsg {}
  db eval { SELECT c FROM b } {
    catch {db eval { DROP TABLE b }} ::dropmsg
    break
  }
  set ::dropmsg
} {database table is locked}
do_test doltlite_recover_jrnlwal_3-5.9 {
  set res [list [execsql {PRAGMA integrity_check}] \
                [execsql {PRAGMA integrity_check} db2]]
  db2 close
  set res
} {ok ok}

do_test doltlite_recover_jrnlwal_3-6.1 {
  execsql {
    CREATE TABLE s6(k INTEGER PRIMARY KEY, a, b, c);
    CREATE INDEX s6i ON s6(a, b);
    BEGIN;
    WITH ii(i) AS (VALUES(1) UNION ALL SELECT i+1 FROM ii WHERE i<64)
    INSERT INTO s6 SELECT i, printf('a%04d',i), printf('b%04d',i),
                          printf('c%04d',i) FROM ii;
    COMMIT;
    PRAGMA cache_size = 10;
    BEGIN;
      UPDATE s6 SET a = 'u'||a WHERE (k%4)==0;
      SAVEPOINT one;
        DELETE FROM s6 WHERE k%2;
        PRAGMA incr_vacuum;
        SAVEPOINT two;
          INSERT INTO s6(a,b,c) SELECT 'x'||a, 'x'||b, c FROM s6;
          DELETE FROM s6 WHERE k%2;
          PRAGMA incr_vacuum;
      ROLLBACK TO one;
    COMMIT;
    SELECT count(*), count(DISTINCT a) FROM s6;
    SELECT count(*) FROM s6 WHERE a LIKE 'u%';
    PRAGMA integrity_check;
  }
} {64 64 16 ok}
do_test doltlite_recover_jrnlwal_3-6.2 {
  execsql {
    BEGIN;
      SAVEPOINT one;
      CREATE TABLE s7(a, b);
      INSERT INTO s7 SELECT a, b FROM s6;
      ROLLBACK TO one;
    COMMIT;
  }
  list [execsql {SELECT count(*) FROM sqlite_master WHERE name='s7'}] \
       [execsql {PRAGMA integrity_check}]
} {0 ok}
do_test doltlite_recover_jrnlwal_3-6.3 {
  execsql {
    CREATE TABLE s7(a, b);
    INSERT INTO s7 SELECT a, b FROM s6;
    BEGIN;
      SAVEPOINT one;
        DELETE FROM s7;
        PRAGMA incr_vacuum;
        SAVEPOINT two;
          INSERT INTO s7 SELECT a, b FROM s6;
        ROLLBACK TO two;
    COMMIT;
    SELECT count(*) FROM s7;
    PRAGMA integrity_check;
  }
} {0 ok}
do_test doltlite_recover_jrnlwal_3-6.4.1 {
  execsql {
    CREATE TABLE s741(a);
    INSERT INTO s741 VALUES(1);
    INSERT INTO s741 VALUES(2);
    BEGIN;
      DELETE FROM s741 WHERE a=1;
      SAVEPOINT s;
      ROLLBACK TO s;
    COMMIT;
    SELECT a FROM s741;
    PRAGMA integrity_check;
  }
} {2 ok}
do_test doltlite_recover_jrnlwal_3-6.4.2 {
  execsql { DROP TABLE s741 }
} {}
do_test doltlite_recover_jrnlwal_3-6.5 {
  execsql {
    CREATE TABLE t5(x, y);
    INSERT INTO t5 VALUES(1, hex(zeroblob(500)));
    INSERT INTO t5 VALUES(2, hex(zeroblob(500)));
    INSERT INTO t5 VALUES(3, hex(zeroblob(500)));
    BEGIN;
      INSERT INTO t5 VALUES(4, hex(zeroblob(500)));
      INSERT INTO t5 VALUES(5, hex(zeroblob(500)));
      DELETE FROM t5 WHERE x=1 OR x=2;
      SAVEPOINT one;
        PRAGMA incr_vacuum;
        SAVEPOINT two;
          INSERT INTO t5 VALUES(1, hex(zeroblob(500)));
          INSERT INTO t5 VALUES(2, hex(zeroblob(500)));
        ROLLBACK TO two;
      ROLLBACK TO one;
    COMMIT;
    SELECT x FROM t5 ORDER BY x;
    PRAGMA integrity_check;
  }
} {3 4 5 ok}
do_test doltlite_recover_jrnlwal_3-6.6 {
  execsql { DROP TABLE t5 }
} {}

do_test doltlite_recover_jrnlwal_3-6.7 {
  forcedelete test2.db test2.db-wal test3.db test3.db-wal
  execsql {
    ATTACH 'test2.db' AS aux1;
    ATTACH 'test3.db' AS aux2;
    CREATE TABLE main.ta(x, y);
    CREATE TABLE aux1.tb(x, y);
    CREATE TABLE aux2.tc(x, y);
    SELECT name FROM sqlite_master WHERE name='ta';
    SELECT name FROM aux1.sqlite_master;
    SELECT name FROM aux2.sqlite_master;
  }
} {ta tb tc}
do_test doltlite_recover_jrnlwal_3-6.8 {
  execsql {
    SAVEPOINT one;
    INSERT INTO ta VALUES(1, 2);
    INSERT INTO tc VALUES(3, 4);
    SAVEPOINT two;
    INSERT INTO tb VALUES(5, 6);
    SELECT * FROM tb ORDER BY x;
  }
} {5 6}
do_test doltlite_recover_jrnlwal_3-6.9 {
  execsql { ROLLBACK TO two }
  execsql { SELECT * FROM tb ORDER BY x }
} {}
do_test doltlite_recover_jrnlwal_3-6.9.1 {
  execsql {
    SELECT 'a', * FROM ta;
    SELECT 'c', * FROM tc;
  }
} {a 1 2 c 3 4}
do_test doltlite_recover_jrnlwal_3-6.10 {
  execsql {
    ROLLBACK;
    SELECT count(*) FROM ta;
    SELECT count(*) FROM tb;
    SELECT count(*) FROM tc;
  }
} {0 0 0}
do_test doltlite_recover_jrnlwal_3-6.10.1 {
  execsql {
    SAVEPOINT one;
      INSERT INTO ta VALUES('a', 'b');
      SAVEPOINT two;
        INSERT INTO tb VALUES('c', 'd');
        SAVEPOINT three;
          INSERT INTO tc VALUES('e', 'f');
    SELECT * FROM ta;
    SELECT * FROM tb;
    SELECT * FROM tc;
  }
} {a b c d e f}
do_test doltlite_recover_jrnlwal_3-6.10.2 {
  execsql {
    ROLLBACK TO two;
    SELECT count(*) FROM ta;
    SELECT count(*) FROM tb;
    SELECT count(*) FROM tc;
  }
} {1 0 0}
do_test doltlite_recover_jrnlwal_3-6.10.3 {
  execsql {
    INSERT INTO tc VALUES('g', 'h');
    ROLLBACK TO two;
    SELECT count(*) FROM ta;
    SELECT count(*) FROM tb;
    SELECT count(*) FROM tc;
  }
} {1 0 0}
do_test doltlite_recover_jrnlwal_3-6.10.4 {
  execsql {
    ROLLBACK;
    SELECT count(*) FROM ta;
    SELECT count(*) FROM tb;
    SELECT count(*) FROM tc;
  }
} {0 0 0}
do_test doltlite_recover_jrnlwal_3-6.16 {
  array set ls [execsql {PRAGMA lock_status}]
  list [set ls(main)] [set ls(aux1)] [set ls(aux2)]
} {unlocked unlocked unlocked}
do_test doltlite_recover_jrnlwal_3-6.17 {
  execsql {
    DETACH aux1;
    DETACH aux2;
  }
  forcedelete test3.db test3.db-wal
  set {} {}
} {}

do_test doltlite_recover_jrnlwal_3-6.18 {
  execsql {
    CREATE TABLE s11(a, b, UNIQUE(a, b));
    INSERT INTO s11 VALUES(1, hex(zeroblob(500)));
    INSERT INTO s11 VALUES(2, hex(zeroblob(501)));
    SAVEPOINT one;
      CREATE TABLE s11b(a, b, UNIQUE(a, b));
      SAVEPOINT two;
        CREATE TABLE s11c(a, b, UNIQUE(a, b));
    ROLLBACK TO two;
  }
  execsql {
    CREATE TABLE s11c(a, b, UNIQUE(a, b));
    ROLLBACK TO one;
  }
  execsql { ROLLBACK }
  execsql {
    PRAGMA wal_checkpoint;
    SELECT count(*) FROM sqlite_master WHERE name IN ('s11b','s11c');
    SELECT count(*) FROM s11;
    PRAGMA integrity_check;
  }
} {0 0 0 0 2 ok}
do_test doltlite_recover_jrnlwal_3-6.19 {
  execsql {
    BEGIN;
      CREATE TABLE s11x(a, b);
      CREATE TABLE s11y(x, y);
      INSERT INTO s11y VALUES(1, 2);
      SAVEPOINT one;
        INSERT INTO s11y VALUES(3, 4);
        SAVEPOINT two;
          DROP TABLE s11x;
        ROLLBACK TO two;
    COMMIT;
    SELECT * FROM s11y ORDER BY x;
    SELECT count(*) FROM sqlite_master WHERE name='s11x';
  }
} {1 2 3 4 1}
do_test doltlite_recover_jrnlwal_3-6.20 {
  db close
  sqlite3 db test.db
  execsql { SELECT * FROM s11y ORDER BY x }
} {1 2 3 4}

do_test doltlite_recover_jrnlwal_3-6.21 {
  execsql {
    CREATE TABLE s13(a PRIMARY KEY, b);
    INSERT INTO s13 VALUES(1, 2);
    BEGIN;
      INSERT INTO s13 VALUES(3, 4);
      SAVEPOINT s1;
        INSERT INTO s13 VALUES(5, 6);
      ROLLBACK TO s1;
    ROLLBACK;
    SELECT * FROM s13 ORDER BY a;
    PRAGMA integrity_check;
  }
} {1 2 ok}

do_test doltlite_recover_jrnlwal_3-7.1 {
  execsql {
    CREATE TABLE iv(x);
    INSERT INTO iv VALUES(zeroblob(30000));
    DELETE FROM iv;
  }
  list [catchsql {PRAGMA incremental_vacuum(1)}] \
       [execsql {SELECT count(*) FROM iv}] \
       [execsql {PRAGMA integrity_check}]
} {{0 {}} 0 ok}
do_test doltlite_recover_jrnlwal_3-7.2 {
  forcedelete test2.db test2.db-wal
  execsql {
    ATTACH DATABASE 'test2.db' AS aux;
    CREATE TABLE aux.iv2(x);
    INSERT INTO aux.iv2 VALUES(zeroblob(30000));
    INSERT INTO iv SELECT * FROM aux.iv2;
    DELETE FROM aux.iv2;
    DELETE FROM iv;
  }
  list [catchsql {PRAGMA aux.incremental_vacuum(1)}] \
       [execsql {SELECT count(*) FROM iv; SELECT count(*) FROM aux.iv2}]
} {{0 {}} {0 0}}
do_test doltlite_recover_jrnlwal_3-7.3 {
  execsql { DETACH aux }
  execsql {
    BEGIN;
    CREATE TABLE abc(a);
    INSERT INTO abc VALUES(hex(zeroblob(750)));
    COMMIT;
    BEGIN;
    DELETE FROM abc;
    PRAGMA incr_vacuum;
    COMMIT;
    SELECT count(*) FROM abc;
    PRAGMA integrity_check;
  }
} {0 ok}
do_test doltlite_recover_jrnlwal_3-7.4 {
  execsql {
    CREATE TABLE ivb(k INTEGER PRIMARY KEY, x);
    WITH ii(i) AS (VALUES(1) UNION ALL SELECT i+1 FROM ii WHERE i<512)
    INSERT INTO ivb SELECT i, zeroblob(400) FROM ii;
    DELETE FROM ivb WHERE k>256;
    DELETE FROM ivb;
    PRAGMA journal_mode;
  }
} {wal}
do_test doltlite_recover_jrnlwal_3-7.5 {
  db close
  sqlite3 db test.db
  execsql {
    SELECT count(*) FROM ivb;
    PRAGMA integrity_check;
  }
} {0 ok}
do_test doltlite_recover_jrnlwal_3-7.6 {
  execsql {
    PRAGMA cache_size=10;
    CREATE TABLE t37(k INTEGER PRIMARY KEY, x);
    WITH ii(i) AS (VALUES(1) UNION ALL SELECT i+1 FROM ii WHERE i<256)
    INSERT INTO t37 SELECT i, zeroblob(900) FROM ii;
    DELETE FROM t37 WHERE k>202;
    UPDATE t37 SET x=zeroblob(902) WHERE k<10;
  }
  db close
  sqlite3 db test.db
  execsql {
    SELECT count(*), min(k), max(k) FROM t37;
    SELECT count(*) FROM t37 WHERE length(x)=902;
    PRAGMA integrity_check;
  }
} {202 1 202 9 ok}
do_test doltlite_recover_jrnlwal_3-7.7 {
  execsql {
    CREATE TABLE v2t(x INTEGER PRIMARY KEY AUTOINCREMENT, y);
    DROP TABLE v2t;
    VACUUM;
  }
} {}
do_test doltlite_recover_jrnlwal_3-7.8 {
  execsql {
    CREATE TABLE v2(a);
    INSERT INTO v2 VALUES(1);
    INSERT INTO v2 VALUES('hello');
  }
  set ::hv [db eval {SELECT dolt_hashof_table('v2')}]
  execsql { VACUUM }
  list [expr {[db eval {SELECT dolt_hashof_table('v2')}] eq $::hv}] \
       [execsql {SELECT a FROM v2 ORDER BY a}] \
       [execsql {PRAGMA integrity_check}]
} {1 {1 hello} ok}
do_test doltlite_recover_jrnlwal_3-7.9 {
  list [catchsql {PRAGMA auto_vacuum=1; VACUUM}] \
       [execsql {PRAGMA auto_vacuum}]
} {{0 {}} 0}
do_test doltlite_recover_jrnlwal_3-7.10 {
  db close
  sqlite3 db test.db
  execsql {
    PRAGMA auto_vacuum;
    SELECT a FROM v2 ORDER BY a;
    PRAGMA integrity_check;
  }
} {0 1 hello ok}

do_test doltlite_recover_jrnlwal_3-8.1 {
  set ::whc 0
  proc my_wal_hook {args} { incr ::whc ; return 0 }
  db wal_hook my_wal_hook
  execsql {
    CREATE TABLE wh(x);
    INSERT INTO wh VALUES(1);
    BEGIN;
      INSERT INTO wh VALUES(2);
      INSERT INTO wh VALUES(3);
    COMMIT;
  }
  set ::whc
} {0}
do_test doltlite_recover_jrnlwal_3-8.2 {
  sqlite3 db2 test.db
  set res [execsql { SELECT x FROM wh ORDER BY x } db2]
  db2 close
  set res
} {1 2 3}
do_test doltlite_recover_jrnlwal_3-8.3 {
  proc my_wal_hook {args} { return 1 }
  db wal_hook my_wal_hook
  set r1 [catchsql { INSERT INTO wh VALUES(4) }]
  proc my_wal_hook {args} { return 5 }
  set r2 [catchsql { INSERT INTO wh VALUES(5) }]
  proc my_wal_hook {args} { return 14 }
  set r3 [catchsql { INSERT INTO wh VALUES(6) }]
  list $r1 $r2 $r3 [execsql {SELECT x FROM wh ORDER BY x}]
} {{0 {}} {0 {}} {0 {}} {1 2 3 4 5 6}}
do_test doltlite_recover_jrnlwal_3-8.4 {
  set ::old_hook 0
  proc my_old_wal_hook {args} { incr ::old_hook ; return 0 }
  db wal_hook my_old_wal_hook
  execsql { INSERT INTO wh VALUES(7) }
  proc my_new_wal_hook {args} { return 0 }
  db wal_hook my_new_wal_hook
  execsql { INSERT INTO wh VALUES(8) }
  list $::old_hook [execsql {SELECT count(*) FROM wh}]
} {0 8}
do_test doltlite_recover_jrnlwal_3-8.5 {
  db wal_hook {}
  execsql {
    PRAGMA wal_autocheckpoint = 1000;
  }
} {1000}
do_test doltlite_recover_jrnlwal_3-8.6 {
  execsql {
    INSERT INTO wh VALUES(9);
    SELECT count(*) FROM wh;
  }
} {9}

do_test doltlite_recover_jrnlwal_3-9.1 {
  execsql {
    CREATE TABLE tg1(a);
    CREATE TABLE tg2(x, y);
    INSERT INTO tg2 VALUES(3, 4);
    INSERT INTO tg2 VALUES(7, 8);
    CREATE VIEW vg1 AS SELECT x FROM tg2;
    DROP TABLE tg1;
    SELECT type, name FROM sqlite_master
     WHERE name IN ('tg2','vg1') ORDER BY name;
  }
} {table tg2 view vg1}
do_test doltlite_recover_jrnlwal_3-9.2 {
  execsql {
    CREATE TRIGGER tg2 BEFORE DELETE ON tg2 BEGIN
      SELECT RAISE(ABORT,'deletes are not permitted');
    END;
    SELECT type, name FROM sqlite_master
     WHERE name IN ('tg2','vg1') ORDER BY name, type;
  }
} {table tg2 trigger tg2 view vg1}
do_test doltlite_recover_jrnlwal_3-9.3 {
  list [catchsql {DELETE FROM tg2}] \
       [execsql {SELECT * FROM tg2 ORDER BY x}]
} {{1 {deletes are not permitted}} {3 4 7 8}}
do_test doltlite_recover_jrnlwal_3-9.4 {
  db close
  sqlite3 db test.db
  execsql {
    SELECT type, name FROM sqlite_master
     WHERE name IN ('tg2','vg1') ORDER BY name, type;
  }
} {table tg2 trigger tg2 view vg1}
do_test doltlite_recover_jrnlwal_3-9.5 {
  execsql {
    DROP TRIGGER tg2;
    SELECT type, name FROM sqlite_master
     WHERE name IN ('tg2','vg1') ORDER BY name, type;
    SELECT * FROM tg2 ORDER BY x;
  }
} {table tg2 view vg1 3 4 7 8}

do_test doltlite_recover_jrnlwal_3-10.1 {
  execsql {
    CREATE TABLE t1k(k INTEGER PRIMARY KEY, v);
    WITH ii(i) AS (VALUES(1) UNION ALL SELECT i+1 FROM ii WHERE i<1000)
    INSERT INTO t1k SELECT i, i FROM ii;
    CREATE TEMP TABLE z1(a, b);
    INSERT INTO z1 SELECT * FROM t1k;
    SELECT count(*) FROM z1;
    SELECT count(*) FROM z1 WHERE a IS NULL OR b IS NULL;
  }
} {1000 0}
do_test doltlite_recover_jrnlwal_3-10.2 {
  execsql { SELECT count(*) FROM t1k UNION ALL SELECT count(*) FROM z1 }
} {1000 1000}
do_test doltlite_recover_jrnlwal_3-10.3 {
  db close
  set res [list [file exists test.db] [file exists test.db-wal]]
  sqlite3 db test.db
  concat $res [execsql {SELECT count(*) FROM t1k}]
} {1 0 1000}
do_test doltlite_recover_jrnlwal_3-10.4 {
  execsql {
    PRAGMA wal_autocheckpoint = 10;
    CREATE TABLE ac2(x, y);
    CREATE TABLE ac3(x, y);
    CREATE TABLE ac4(x, y);
    INSERT INTO ac2 VALUES(1, 2);
  }
  db close
  sqlite3 db test.db
  execsql {
    SELECT count(*) FROM sqlite_master
     WHERE name IN ('ac2','ac3','ac4');
    SELECT * FROM ac2;
    PRAGMA integrity_check;
  }
} {3 1 2 ok}

finish_test
