set testdir [file dirname $argv0]
source $testdir/tester.tcl


proc sig {} {
  return [db eval {SELECT count(*), md5sum(a), md5sum(b), md5sum(c) FROM abc}]
}

do_test doltlite_recover_rawformat_3-1.1 {
  execsql {
    BEGIN;
    CREATE TABLE abc AS SELECT 1 AS a, 2 AS b, 3 AS c;
    CREATE TABLE def AS SELECT 1 AS d, 2 AS e, 3 AS f;
    COMMIT;
  }
  db close
  sqlite3 db test.db
  list [execsql {SELECT * FROM abc; SELECT * FROM def}] \
       [expr {[file size test.db]>0}] [execsql {PRAGMA integrity_check}]
} {{1 2 3 1 2 3} 1 ok}

do_test doltlite_recover_rawformat_3-1.2 {
  execsql BEGIN
  for {set n 0} {$n < 200} {incr n} {
    execsql "INSERT INTO abc VALUES($n, [expr 2*$n], [expr 3*$n])"
  }
  execsql {
    INSERT INTO abc SELECT * FROM abc;
    INSERT INTO abc SELECT * FROM abc;
    INSERT INTO abc SELECT * FROM abc;
  }
  execsql COMMIT
  db one {SELECT count(*) FROM abc}
} {1608}

foreach {k mut} {
  1 {INSERT INTO abc SELECT a+5000, b+1, c+2 FROM abc WHERE a%3==0}
  2 {DELETE FROM abc WHERE a%2==1}
  3 {UPDATE abc SET b=b+99 WHERE a%5==0}
  4 {INSERT INTO abc SELECT * FROM abc; DELETE FROM abc WHERE a%7==3}
} {
  do_test doltlite_recover_rawformat_3-1.4.$k {
    set ::s [sig]
    execsql BEGIN
    execsql $mut
    db close
    sqlite3 db test.db
    list [expr {[sig] eq $::s}] [execsql {PRAGMA integrity_check}]
  } {1 ok}
}

do_test doltlite_recover_rawformat_3-1.5 {
  set s [sig]
  execsql {
    BEGIN;
    INSERT INTO abc SELECT a+1000000, b, c FROM abc WHERE a%2==0;
    DELETE FROM abc WHERE a%2==1 AND a<1000000;
    COMMIT;
  }
  set s2 [sig]
  db close
  sqlite3 db test.db
  list [expr {$s2 eq $s}] [expr {[sig] eq $s2}] [execsql {PRAGMA integrity_check}]
} {0 1 ok}

do_test doltlite_recover_rawformat_3-2.1 {
  execsql {CREATE TABLE abc3(a,b,c); INSERT INTO abc3 VALUES(1,2,3)}
  execsql "BEGIN; INSERT INTO abc3 VALUES(4,5,'[string repeat y 1000]'); COMMIT"
  db close
  sqlite3 db test.db
  execsql {SELECT a,b,length(c) FROM abc3 ORDER BY a; PRAGMA integrity_check}
} {1 2 1 4 5 1000 ok}

do_test doltlite_recover_rawformat_3-2.2 {
  execsql BEGIN
  execsql "INSERT INTO abc3 VALUES(7,8,'[string repeat z 1000]')"
  db close
  sqlite3 db test.db
  execsql {SELECT count(*) FROM abc3; PRAGMA integrity_check}
} {2 ok}

do_test doltlite_recover_rawformat_3-2.3 {
  execsql {BEGIN; DELETE FROM abc3}
  db close
  sqlite3 db test.db
  set r1 [db one {SELECT count(*) FROM abc3}]
  execsql {DELETE FROM abc3}
  db close
  sqlite3 db test.db
  list $r1 [db one {SELECT count(*) FROM abc3}] [execsql {PRAGMA integrity_check}]
} {2 0 ok}

do_test doltlite_recover_rawformat_3-3.0 {
  execsql { CREATE TABLE mm1(x, y, z) }
  db close
  sqlite3 db test.db
  execsql {
    BEGIN;
    INSERT INTO mm1 VALUES('1', 'I',   'one');
    INSERT INTO mm1 VALUES('2', 'IV',  'four');
    INSERT INTO mm1 VALUES('2', NULL,  'three');
    INSERT INTO mm1 VALUES('2', 'II',  'two');
    INSERT INTO mm1 VALUES('2', 'V',   'five');
    INSERT INTO mm1 VALUES('3', 'VI',  'six');
    COMMIT;
    PRAGMA automatic_index=OFF;
  }
} {}
do_test doltlite_recover_rawformat_3-3.1.1 {
  execsql { SELECT max(y) FROM mm1 WHERE x = '2' }
} {V}
do_test doltlite_recover_rawformat_3-3.1.2 {
  execsql { CREATE INDEX mi1 ON mm1(x) }
  execsql { SELECT max(y) FROM mm1 WHERE x = '2' }
} {V}
do_test doltlite_recover_rawformat_3-3.1.3 {
  execsql { CREATE INDEX mi2 ON mm1(x,y) }
  execsql { SELECT max(y) FROM mm1 WHERE x = '2' }
} {V}
do_test doltlite_recover_rawformat_3-3.1.4 {
  execsql { DROP INDEX mi2 ; CREATE INDEX mi2 ON mm1(x, y DESC) }
  execsql { SELECT max(y) FROM mm1 WHERE x = '2' }
} {V}
do_test doltlite_recover_rawformat_3-3.1.5 {
  execsql { SELECT max(y) FROM mm1 WHERE x = '2' AND y != 'V' }
} {IV}
do_test doltlite_recover_rawformat_3-3.1.6 {
  list [execsql { SELECT max(y) FROM mm1 WHERE x = '2' AND y < 'V' }] \
       [execsql { SELECT max(y) FROM mm1 WHERE x = '2' AND z != 'five' }]
} {IV IV}
do_test doltlite_recover_rawformat_3-3.2.1 {
  execsql { DROP INDEX mi1 ; DROP INDEX mi2 }
  execsql { SELECT min(y) FROM mm1 WHERE x = '2' }
} {II}
do_test doltlite_recover_rawformat_3-3.2.2 {
  execsql { CREATE INDEX mi1 ON mm1(x) }
  execsql { SELECT min(y) FROM mm1 WHERE x = '2' }
} {II}
do_test doltlite_recover_rawformat_3-3.2.3 {
  execsql { CREATE INDEX mi2 ON mm1(x,y) }
  execsql { SELECT min(y) FROM mm1 WHERE x = '2' }
} {II}
do_test doltlite_recover_rawformat_3-3.2.4 {
  execsql { DROP INDEX mi2 ; CREATE INDEX mi2 ON mm1(x, y DESC) }
  execsql { SELECT min(y) FROM mm1 WHERE x = '2' }
} {II}
do_test doltlite_recover_rawformat_3-3.3.1 {
  execsql { DROP INDEX mi1 ; DROP INDEX mi2 }
  execsql { SELECT min(y) FROM mm1 }
} {I}
do_test doltlite_recover_rawformat_3-3.3.2 {
  execsql { CREATE INDEX mi1 ON mm1(y) }
  execsql { SELECT min(y) FROM mm1 }
} {I}
do_test doltlite_recover_rawformat_3-3.3.3 {
  execsql { DROP INDEX mi1 ; CREATE INDEX mi1 ON mm1(y DESC) }
  execsql { SELECT min(y) FROM mm1 }
} {I}
do_test doltlite_recover_rawformat_3-3.4.1 {
  execsql { DROP INDEX mi1 }
  execsql { SELECT max(y) FROM mm1 }
} {VI}
do_test doltlite_recover_rawformat_3-3.4.2 {
  execsql { CREATE INDEX mi1 ON mm1(y) }
  execsql { SELECT max(y) FROM mm1 }
} {VI}
do_test doltlite_recover_rawformat_3-3.4.3 {
  execsql { DROP INDEX mi1 ; CREATE INDEX mi1 ON mm1(y DESC) }
  execsql { SELECT max(y) FROM mm1 }
} {VI}
do_test doltlite_recover_rawformat_3-3.4.4 {
  execsql { DROP INDEX mi1 }
} {}

do_test doltlite_recover_rawformat_3-3.5.1 {
  execsql {
    CREATE TABLE mm2(a, b);
    CREATE INDEX mmi3 ON mm2(a, b);
    INSERT INTO mm2 VALUES(1, NULL);
    INSERT INTO mm2 VALUES(1, 1);
    INSERT INTO mm2 VALUES(1, 2);
    INSERT INTO mm2 VALUES(1, 3);
    INSERT INTO mm2 VALUES(2, NULL);
    INSERT INTO mm2 VALUES(2, 1);
    INSERT INTO mm2 VALUES(2, 2);
    INSERT INTO mm2 VALUES(2, 3);
    INSERT INTO mm2 VALUES(3, 1);
    INSERT INTO mm2 VALUES(3, 2);
    INSERT INTO mm2 VALUES(3, 3);
  }
} {}
do_test doltlite_recover_rawformat_3-3.5.2 {
  execsql { SELECT min(b) FROM mm2 WHERE a = 1 }
} {1}
do_test doltlite_recover_rawformat_3-3.5.3 {
  execsql { SELECT min(b) FROM mm2 WHERE a = 1 AND b>1 }
} {2}
do_test doltlite_recover_rawformat_3-3.5.4 {
  execsql { SELECT min(b) FROM mm2 WHERE a = 1 AND b>-1 }
} {1}
do_test doltlite_recover_rawformat_3-3.5.5 {
  execsql { SELECT min(b) FROM mm2 WHERE a = 1 }
} {1}
do_test doltlite_recover_rawformat_3-3.5.6 {
  execsql { SELECT min(b) FROM mm2 WHERE a = 1 AND b<2 }
} {1}
do_test doltlite_recover_rawformat_3-3.5.7 {
  execsql { SELECT min(b) FROM mm2 WHERE a = 1 AND b<1 }
} {{}}
do_test doltlite_recover_rawformat_3-3.5.8 {
  execsql { SELECT min(b) FROM mm2 WHERE a = 3 AND b<1 }
} {{}}

do_test doltlite_recover_rawformat_3-3.6.1 {
  execsql {
    DROP TABLE mm2;
    CREATE TABLE mm2(a, b);
    CREATE INDEX mmi3 ON mm2(a, b DESC);
    INSERT INTO mm2 VALUES(1, NULL);
    INSERT INTO mm2 VALUES(1, 1);
    INSERT INTO mm2 VALUES(1, 2);
    INSERT INTO mm2 VALUES(1, 3);
    INSERT INTO mm2 VALUES(2, NULL);
    INSERT INTO mm2 VALUES(2, 1);
    INSERT INTO mm2 VALUES(2, 2);
    INSERT INTO mm2 VALUES(2, 3);
    INSERT INTO mm2 VALUES(3, 1);
    INSERT INTO mm2 VALUES(3, 2);
    INSERT INTO mm2 VALUES(3, 3);
  }
} {}
do_test doltlite_recover_rawformat_3-3.6.2 {
  execsql { SELECT min(b) FROM mm2 WHERE a = 1 }
} {1}
do_test doltlite_recover_rawformat_3-3.6.3 {
  execsql { SELECT min(b) FROM mm2 WHERE a = 1 AND b>1 }
} {2}
do_test doltlite_recover_rawformat_3-3.6.4 {
  execsql { SELECT min(b) FROM mm2 WHERE a = 1 AND b>-1 }
} {1}
do_test doltlite_recover_rawformat_3-3.6.5 {
  execsql { SELECT min(b) FROM mm2 WHERE a = 1 }
} {1}
do_test doltlite_recover_rawformat_3-3.6.6 {
  execsql { SELECT min(b) FROM mm2 WHERE a = 1 AND b<2 }
} {1}
do_test doltlite_recover_rawformat_3-3.6.7 {
  execsql { SELECT min(b) FROM mm2 WHERE a = 1 AND b<1 }
} {{}}
do_test doltlite_recover_rawformat_3-3.6.8 {
  execsql { SELECT min(b) FROM mm2 WHERE a = 3 AND b<1 }
} {{}}

do_test doltlite_recover_rawformat_3-3.7.1 {
  execsql {
    CREATE TABLE mm4(x);
    INSERT INTO mm4 VALUES('abc');
    INSERT INTO mm4 VALUES('BCD');
    SELECT max(x) FROM mm4;
  }
} {abc}
do_test doltlite_recover_rawformat_3-3.7.2 {
  execsql { SELECT max(x COLLATE nocase) FROM mm4 }
} {BCD}
do_test doltlite_recover_rawformat_3-3.7.3 {
  execsql { SELECT max(x), max(x COLLATE nocase) FROM mm4 }
} {abc BCD}
do_test doltlite_recover_rawformat_3-3.7.4 {
  execsql { SELECT max(x COLLATE binary), max(x COLLATE nocase) FROM mm4 }
} {abc BCD}
do_test doltlite_recover_rawformat_3-3.7.5 {
  execsql { SELECT max(x COLLATE nocase), max(x COLLATE rtrim) FROM mm4 }
} {BCD abc}
do_test doltlite_recover_rawformat_3-3.7.6 {
  execsql { SELECT max(x COLLATE nocase), max(x) FROM mm4 }
} {BCD abc}
do_test doltlite_recover_rawformat_3-3.7.7 {
  execsql { SELECT min(x) FROM mm4 }
} {BCD}
do_test doltlite_recover_rawformat_3-3.7.8 {
  execsql { SELECT min(x COLLATE nocase) FROM mm4 }
} {abc}
do_test doltlite_recover_rawformat_3-3.7.9 {
  execsql { SELECT min(x), min(x COLLATE nocase) FROM mm4 }
} {BCD abc}
do_test doltlite_recover_rawformat_3-3.7.10 {
  execsql { SELECT min(x COLLATE binary), min(x COLLATE nocase) FROM mm4 }
} {BCD abc}
do_test doltlite_recover_rawformat_3-3.7.11 {
  execsql { SELECT min(x COLLATE nocase), min(x COLLATE rtrim) FROM mm4 }
} {abc BCD}
do_test doltlite_recover_rawformat_3-3.7.12 {
  execsql { SELECT min(x COLLATE nocase), min(x) FROM mm4 }
} {abc BCD}

do_test doltlite_recover_rawformat_3-3.8 {
  execsql {CREATE TABLE mmx(x)}
  execsql BEGIN
  for {set i 1} {$i<=20} {incr i} { execsql "INSERT INTO mmx VALUES($i)" }
  execsql COMMIT
  execsql {CREATE INDEX mmxi1 ON mmx(x)}
  execsql {SELECT min(x), max(x) FROM mmx}
} {1 20}

do_test doltlite_recover_rawformat_3-3.9 {
  execsql {
    CREATE TABLE tpk(a INTEGER PRIMARY KEY, b, c);
    INSERT INTO tpk VALUES(4,'one','two');
    INSERT INTO tpk VALUES(5,'hello','world');
    INSERT INTO tpk VALUES(6,'second','record');
    CREATE INDEX tpki2 ON tpk(a);
    CREATE INDEX tpki3 ON tpk(c,a);
  }
  list [execsql {SELECT * FROM tpk WHERE a=5}] \
       [execsql {SELECT * FROM tpk WHERE c=='world'}]
} {{5 hello world} {5 hello world}}

do_test doltlite_recover_rawformat_3-4.1 {
  execsql {CREATE TABLE ioabc(a,b)}
  for {set i 1} {$i<=9} {incr i} {
    execsql "INSERT INTO ioabc VALUES($i,'[string repeat [format %c [expr 96+$i]] 230]')"
  }
  db close
  sqlite3 db test.db
  execsql {SELECT count(*), sum(length(b)) FROM ioabc; PRAGMA integrity_check}
} {9 2070 ok}

do_test doltlite_recover_rawformat_3-4.2 {
  set sz0 [file size test.db]
  execsql {
    CREATE TABLE iobig(a,b);
    BEGIN;
    INSERT INTO iobig VALUES('hello','world');
  }
  for {set i 0} {$i<11} {incr i} { execsql {INSERT INTO iobig SELECT * FROM iobig} }
  set mid [db one {SELECT count(*) FROM iobig}]
  execsql COMMIT
  db close
  sqlite3 db test.db
  list $mid [db one {SELECT count(*) FROM iobig}] \
       [expr {[file size test.db] > $sz0}] [execsql {PRAGMA integrity_check}]
} {2048 2048 1 ok}

do_test doltlite_recover_rawformat_3-4.3 {
  execsql {DELETE FROM ioabc}
  execsql {INSERT INTO ioabc VALUES('a','b')}
  execsql {BEGIN}
  execsql {INSERT INTO ioabc VALUES('c','d')}
  set mid [execsql {SELECT a FROM ioabc ORDER BY a}]
  execsql {COMMIT}
  execsql {BEGIN; UPDATE iobig SET a='x'; COMMIT}
  db close
  sqlite3 db test.db
  list $mid [execsql {SELECT a FROM ioabc ORDER BY a}] \
       [db one {SELECT count(*) FROM iobig WHERE a='x'}] \
       [execsql {PRAGMA integrity_check}]
} {{a c} {a c} 2048 ok}

do_test doltlite_recover_rawformat_3-4.4 {
  set v0 [execsql {PRAGMA page_size}]
  execsql {PRAGMA page_size=8192}
  set v1 [execsql {PRAGMA page_size}]
  db close
  sqlite3 db test.db
  list $v0 $v1 [execsql {PRAGMA page_size}]
} {1024 8192 1024}

do_test doltlite_recover_rawformat_3-5.1 {
  execsql {
    CREATE TABLE rt1(a,b);
    WITH RECURSIVE c(x) AS (VALUES(1) UNION ALL SELECT x+1 FROM c WHERE x<20)
      INSERT INTO rt1(a,b) SELECT x, randomblob(300) FROM c;
    CREATE INDEX rt1a ON rt1(a);
    CREATE INDEX rt1b ON rt1(b);
  }
  execsql {
    SELECT sum(a), sum(length(b)) FROM rt1;
    PRAGMA integrity_check;
    PRAGMA journal_mode;
  }
} {210 6000 ok wal}
do_test doltlite_recover_rawformat_3-5.2 {
  list [db one {SELECT count(*)>0 FROM sqlite_dbpage}] \
       [expr {[db one {PRAGMA page_count}]>0}]
} {1 1}
do_test doltlite_recover_rawformat_3-5.3 {
  sqlite3 db2 test.db
  execsql { SELECT sum(a), sum(length(b)) FROM rt1; PRAGMA quick_check } db2
} {210 6000 ok}
do_test doltlite_recover_rawformat_3-5.4 {
  sqlite3_db_config db DEFENSIVE 0
  catchsql { UPDATE sqlite_dbpage SET data=randomblob(4096) WHERE pgno=1 }
} {1 {table sqlite_dbpage may not be modified}}
do_test doltlite_recover_rawformat_3-5.5 {
  list [execsql {PRAGMA quick_check}] [execsql {PRAGMA quick_check} db2]
} {ok ok}
do_test doltlite_recover_rawformat_3-5.6 {
  set r1 [sqlite3_db_config db RESET_DB 1]
  db eval VACUUM
  set r2 [sqlite3_db_config db RESET_DB 0]
  list $r1 $r2 [execsql {
    SELECT count(*) FROM rt1;
    SELECT count(*) FROM sqlite_master WHERE name LIKE 'rt1%';
    PRAGMA quick_check;
  } db2]
} {0 0 {20 3 ok}}
do_test doltlite_recover_rawformat_3-5.7 {
  list [execsql {PRAGMA journal_mode=WAL}] \
       [catchsql {PRAGMA journal_mode=DELETE}] \
       [execsql {PRAGMA journal_mode} db2]
} {wal {0 wal} wal}
do_test doltlite_recover_rawformat_3-5.8 {
  execsql {PRAGMA encoding='utf16'}
  set e [execsql {PRAGMA encoding}]
  set q [execsql {PRAGMA quick_check} db2]
  db2 close
  list $e $q
} {UTF-8 ok}

do_test doltlite_recover_rawformat_3-6.1 {
  forcedelete test2.db
  execsql {ATTACH 'test2.db' AS adb}
  execsql {
    CREATE TABLE adb.t2(x);
    CREATE TABLE adb.tx(x);
    CREATE TRIGGER adb.r1 AFTER INSERT ON t2 BEGIN UPDATE tx SET x=x+1; END;
    CREATE INDEX adb.i2 ON t2(x);
  }
  execsql {SELECT type, name, tbl_name FROM adb.sqlite_master ORDER BY name}
} {index i2 t2 trigger r1 t2 table t2 t2 table tx tx}
do_test doltlite_recover_rawformat_3-6.2 {
  db close
  sqlite3 db test.db
  execsql {ATTACH 'test2.db' AS adb}
  list [execsql {SELECT type, name, tbl_name FROM adb.sqlite_master ORDER BY name}] \
       [execsql {INSERT INTO adb.tx VALUES(0); INSERT INTO adb.t2 VALUES(1); SELECT x FROM adb.tx}]
} {{index i2 t2 trigger r1 t2 table t2 t2 table tx tx} 1}
do_test doltlite_recover_rawformat_3-6.3 {
  execsql {DETACH adb}
  set fd [open testnotdb.db w]
  puts $fd "This file is not a valid SQLite database"
  close $fd
  set r [catchsql {ATTACH 'testnotdb.db' AS bad}]
  set rc [db errorcode]
  forcedelete testnotdb.db
  list $r $rc [db one {SELECT 1}]
} {{1 {file is not a database}} 26 1}
do_test doltlite_recover_rawformat_3-6.4 {
  forcedelete testex.db
  sqlite3 dbex testex.db
  dbex eval {CREATE TABLE ext1(x)}
  dbex eval {BEGIN EXCLUSIVE; INSERT INTO ext1 VALUES(1)}
  set r [catchsql {ATTACH 'testex.db' AS exd}]
  set rc [db errorcode]
  dbex eval COMMIT
  dbex close
  list $r $rc [db one {SELECT count(*) FROM exd.ext1}]
} {{0 {}} 0 1}
do_test doltlite_recover_rawformat_3-6.5 {
  execsql {DETACH exd}
  execsql {ATTACH '' AS noname}
  execsql {ATTACH ':memory:' AS inmem}
  set res {}
  foreach {seq name file} [execsql {PRAGMA database_list}] {
    if {$name eq "noname" || $name eq "inmem"} { lappend res $name $file }
  }
  execsql {CREATE TABLE inmem.tm(x); INSERT INTO inmem.tm VALUES(7)}
  set rows [execsql {SELECT * FROM inmem.tm}]
  execsql {DETACH noname}
  execsql {DETACH inmem}
  list $res $rows
} {{noname {} inmem {}} 7}
do_test doltlite_recover_rawformat_3-6.6 {
  db close
  sqlite3 db test.db -uri 1
  execsql {ATTACH printf('file:%09000x/x.db?mode=memory&cache=shared',1) AS auxlong}
  execsql {
    CREATE TABLE auxlong.lt(x);
    INSERT INTO auxlong.lt VALUES(42);
  }
  set r [execsql {SELECT x FROM auxlong.lt}]
  execsql {DETACH auxlong}
  db close
  sqlite3 db test.db
  list $r [db one {SELECT 1}]
} {42 1}

do_test doltlite_recover_rawformat_3-7.1 {
  execsql {PRAGMA secure_delete}
} {0}
do_test doltlite_recover_rawformat_3-7.2 {
  forcedelete test3.db
  execsql {ATTACH 'test3.db' AS sdb}
  list [execsql {PRAGMA main.secure_delete=ON; PRAGMA sdb.secure_delete}] \
       [execsql {PRAGMA secure_delete=ON; PRAGMA sdb.secure_delete}] \
       [execsql {PRAGMA secure_delete=FAST; PRAGMA sdb.secure_delete}] \
       [execsql {PRAGMA main.secure_delete=FAST; PRAGMA sdb.secure_delete}] \
       [execsql {DETACH sdb; ATTACH 'test3.db' AS sdb; PRAGMA sdb.secure_delete}]
} {{0 0} {0 0} {0 0} {0 0} 0}
do_test doltlite_recover_rawformat_3-7.3 {
  execsql {DETACH sdb}
  execsql {
    CREATE TABLE sd1(i INTEGER PRIMARY KEY, v);
    INSERT INTO sd1 VALUES(1,'keep'),(2,'gone'),(3,'keep2');
  }
  set h0 [db one {SELECT dolt_hashof_table('sd1')}]
  execsql {DELETE FROM sd1 WHERE i=2}
  set h1 [db one {SELECT dolt_hashof_table('sd1')}]
  db close
  sqlite3 db test.db
  list [execsql {SELECT i FROM sd1 ORDER BY i}] [expr {$h0 eq $h1}] \
       [execsql {PRAGMA integrity_check}]
} {{1 3} 0 ok}

do_test doltlite_recover_rawformat_3-8.1 {
  execsql {
    CREATE TABLE ck1(id INTEGER PRIMARY KEY, x);
    INSERT INTO ck1 VALUES(1, zeroblob(20));
    INSERT INTO ck1 VALUES(2, zeroblob(100));
    INSERT INTO ck1 VALUES(3, zeroblob(27));
    INSERT INTO ck1 VALUES(4, zeroblob(800));
    DELETE FROM ck1 WHERE id=2;
    INSERT INTO ck1 VALUES(5, zeroblob(20));
  }
  execsql {SELECT id, length(x) FROM ck1 ORDER BY id; PRAGMA integrity_check}
} {1 20 3 27 4 800 5 20 ok}
do_test doltlite_recover_rawformat_3-8.2 {
  set fd [db incrblob ck1 x 3]
  fconfigure $fd -translation binary
  seek $fd 22
  puts -nonewline $fd "\x5d"
  close $fd
  execsql {SELECT hex(substr(x,23,1)) FROM ck1 WHERE id=3; PRAGMA integrity_check}
} {5D ok}
do_test doltlite_recover_rawformat_3-8.3 {
  execsql {
    CREATE TABLE ck2(id INTEGER PRIMARY KEY, x);
    INSERT INTO ck2 VALUES(1,zeroblob(20)),(2,zeroblob(20)),(3,zeroblob(20)),
                          (4,zeroblob(20)),(5,zeroblob(20));
    DELETE FROM ck2 WHERE id IN (2,4);
    INSERT INTO ck2 VALUES(6, zeroblob(20)),(7, zeroblob(90));
  }
  db close
  sqlite3 db test.db
  execsql {SELECT id, length(x) FROM ck2 ORDER BY id; PRAGMA integrity_check}
} {1 20 3 20 5 20 6 20 7 90 ok}

do_test doltlite_recover_rawformat_3-9.1 {
  execsql {CREATE TABLE al1(a,b); INSERT INTO al1 VALUES(1,100),(2,300)}
  set v0 [db one {PRAGMA schema_version}]
  execsql {ALTER TABLE al1 ADD c}
  set v1 [db one {PRAGMA schema_version}]
  db close
  sqlite3 db test.db
  set v2 [db one {PRAGMA schema_version}]
  execsql {PRAGMA schema_version=5}
  set v3 [db one {PRAGMA schema_version}]
  list [execsql {SELECT * FROM al1 ORDER BY a}] \
       [expr {$v0!=0}] [expr {$v0==$v1}] [expr {$v3==5}]
} {{1 100 {} 2 300 {}} 1 0 1}
do_test doltlite_recover_rawformat_3-9.2 {
  forcedelete test4.db
  execsql {ATTACH 'test4.db' AS aux2}
  execsql {CREATE TABLE aux2.t1al(a,b); INSERT INTO aux2.t1al VALUES(1,'one'),(2,'two')}
  set v0 [db one {PRAGMA aux2.schema_version}]
  execsql {ALTER TABLE aux2.t1al ADD COLUMN d DEFAULT 1000}
  set v1 [db one {PRAGMA aux2.schema_version}]
  set rows [execsql {SELECT * FROM aux2.t1al ORDER BY a}]
  execsql {DETACH aux2}
  list $rows [expr {$v0!=0}] [expr {$v0==$v1}]
} {{1 one 1000 2 two 1000} 1 0}

do_test doltlite_recover_rawformat_3-10.1 {
  set before [db one {PRAGMA page_count}]
  set capped [db one {PRAGMA max_page_count=40}]
  execsql {PRAGMA max_page_count=2147483647}
  list [expr {$before>40}] [expr {$capped==$before}]
} {1 1}
do_test doltlite_recover_rawformat_3-10.2 {
  execsql {CREATE TABLE filler(fill)}
  execsql BEGIN
  for {set i 0} {$i<40} {incr i} { execsql {INSERT INTO filler VALUES(zeroblob(2048))} }
  execsql COMMIT
  execsql {SELECT count(*), sum(length(fill)) FROM filler; PRAGMA integrity_check}
} {40 81920 ok}
do_test doltlite_recover_rawformat_3-10.3 {
  execsql {BEGIN; INSERT INTO filler VALUES(zeroblob(10)); ROLLBACK}
  catchsql COMMIT
} {1 {cannot commit - no transaction is active}}

do_test doltlite_recover_rawformat_3-11.1 {
  forcedelete test5.db
  sqlite3 db5 test5.db
  set r [db5 eval {
    PRAGMA encoding='UTF-16le';
    CREATE TABLE te(d,e,f);
    INSERT INTO te VALUES('d','e','f');
    PRAGMA encoding;
  }]
  db5 close
  set r
} {UTF-8}
do_test doltlite_recover_rawformat_3-11.2 {
  execsql {ATTACH 'test5.db' AS encdb}
  execsql {CREATE TEMP TABLE tt1(a); INSERT INTO tt1 VALUES('xxx')}
  set r [execsql {SELECT * FROM encdb.te; SELECT * FROM tt1}]
  execsql {DETACH encdb}
  set r
} {d e f xxx}

do_test doltlite_recover_rawformat_3-12.1 {
  execsql {
    CREATE TABLE f4(x0,x1,x2,x3,x4,x5,x6,x7,x8,x9);
    INSERT INTO f4 VALUES(0,0,0,0,0,0,0,0,0,0);
  }
  for {set i 0} {$i<6} {incr i} { execsql {INSERT INTO f4 SELECT * FROM f4} }
  set h0 [db one {SELECT dolt_hashof_table('f4')}]
  execsql {UPDATE f4 SET x0=1,x1=1,x2=1,x3=1,x4=1,x5=1,x6=1,x7=1,x8=1,x9=1}
  set h1 [db one {SELECT dolt_hashof_table('f4')}]
  execsql {UPDATE f4 SET x0=2,x1=2,x2=2,x3=2,x4=2,x5=2,x6=2,x7=2,x8=2,x9=2}
  set h2 [db one {SELECT dolt_hashof_table('f4')}]
  db close
  sqlite3 db test.db
  list [db one {SELECT count(*) FROM f4 WHERE x0=2 AND x9=2}] \
       [expr {$h0 eq $h1}] [expr {$h1 eq $h2}] \
       [expr {[db one {SELECT dolt_hashof_table('f4')}] eq $h2}]
} {64 0 0 1}

do_test doltlite_recover_rawformat_3-13.1 {
  execsql {
    CREATE TABLE tt2(a,b);
    CREATE INDEX tti2 ON tt2(a,b);
    WITH x(i) AS ( SELECT 1 UNION ALL SELECT i+1 FROM x WHERE i<20 )
    INSERT INTO tt2 SELECT randomblob(100), randomblob(100) FROM x;
  }
  list [expr {[db one {PRAGMA page_count}]>0}] [db one {SELECT count(*) FROM tt2}]
} {1 20}
do_test doltlite_recover_rawformat_3-13.2 {
  sqlite3 tmp ""
  tmp eval {CREATE TABLE t1(a,b); INSERT INTO t1 VALUES(1,2)}
  set rc [catch {sqlite3_backup B tmp main db main} msg]
  catch {B finish}
  set r [list $rc $msg [tmp eval {SELECT count(*) FROM t1}] [db one {SELECT 1}]]
  tmp close
  set r
} {1 {sqlite3_backup_init() failed} 1 1}

do_test doltlite_recover_rawformat_3-14.1 {
  execsql {
    PRAGMA page_size = 2048;
    CREATE TABLE pf1(x);
    INSERT INTO pf1 VALUES(zeroblob(1200));
  }
  expr {[db one {PRAGMA page_count}]>0}
} {1}
do_test doltlite_recover_rawformat_3-14.2 {
  db close
  sqlite3 db test.db
  execsql {PRAGMA page_size = 1024}
  execsql {VACUUM}
  list [db one {SELECT length(x) FROM pf1}] \
       [expr {[db one {PRAGMA page_count}]>0}] [execsql {PRAGMA integrity_check}]
} {1200 1 ok}

do_test doltlite_recover_rawformat_3-15.1 {
  execsql {CREATE TABLE ch4(x,y, CHECK( x+y==11
        OR x*y==12
        OR x/y BETWEEN 5 AND 8
        OR -x==y+10 ))}
  execsql {INSERT INTO ch4 VALUES(12,-22)}
  db close
  sqlite3 db test.db
  catchsql {UPDATE ch4 SET x=0, y=2}
} {1 {CHECK constraint failed: x+y==11 OR x*y==12 OR x/y BETWEEN 5 AND 8 OR -x==y+10}}

do_test doltlite_recover_rawformat_3-15.2 {
  execsql {CREATE TABLE qxyz(a, b, c CHECK (c!="null") )}
  set r1 [catchsql {INSERT INTO qxyz VALUES(1,2,'null')}]
  execsql {INSERT INTO qxyz VALUES(1,2,3)}
  db close
  sqlite3 db test.db
  set r2 [catchsql {INSERT INTO qxyz VALUES(4,5,'null')}]
  list $r1 $r2 [db one {SELECT sql FROM sqlite_master WHERE name='qxyz'}]
} {{1 {CHECK constraint failed: c!="null"}} {1 {CHECK constraint failed: c!="null"}} {CREATE TABLE qxyz(a, b, c CHECK(c!="null"))}}

do_test doltlite_recover_rawformat_3-15.3 {
  execsql {
    CREATE TABLE dt1(i INTEGER PRIMARY KEY,a,b,c,d);
    CREATE INDEX dt1i1 ON dt1(a DESC, b ASC, c DESC);
    CREATE INDEX dt1i2 ON dt1(b DESC, c ASC, d DESC);
    INSERT INTO dt1 VALUES(1, 'one', 'I', 'a', NULL);
    INSERT INTO dt1 VALUES(2, 'two', 'II', 'b', 4.5);
    INSERT INTO dt1 VALUES(3, 'three', 'III', 'c', 99);
    INSERT INTO dt1 VALUES(4, 'four', 'IV', 'd', 100);
  }
  db close
  sqlite3 db test.db
  list [execsql {SELECT i FROM dt1 ORDER BY a DESC, b ASC, c DESC}] \
       [execsql {SELECT b FROM dt1 ORDER BY b DESC, c ASC, d DESC}] \
       [execsql {PRAGMA integrity_check}]
} {{2 3 1 4} {IV III II I} ok}

do_test doltlite_recover_rawformat_3-15.4 {
  execsql {CREATE TABLE ix1(x)}
  execsql BEGIN
  for {set i 0} {$i<500} {incr i} {
    execsql "INSERT INTO ix1 VALUES('k[format %05d $i]')"
  }
  execsql COMMIT
  execsql {CREATE INDEX ixi1 ON ix1(x)}
  list [db one {SELECT min(x) FROM ix1}] [db one {SELECT max(x) FROM ix1}] \
       [db one {SELECT count(*) FROM ix1}] [execsql {PRAGMA integrity_check}]
} {k00000 k00499 500 ok}

do_test doltlite_recover_rawformat_3-15.5 {
  execsql {PRAGMA encoding='UTF16'}
  list [execsql {PRAGMA encoding}] [catchsql {CREATE VIRTUAL TABLE vx USING s}]
} {UTF-8 {1 {no such module: s}}}

do_test doltlite_recover_rawformat_3-15.6 {
  sqlite3 dd {}
  set rc [catch {dd deserialize [decode_hexdb {
| size 8192 pagesize 4096 filename c27.db
| page 1 offset 0
|      0: 53 51 4c 69 74 65 20 66 6f 72 6d 61 74 20 33 00   SQLite format 3.
| end c27.db
}]} msg]
  set ok [dd one {SELECT 1}]
  dd close
  list $rc $msg $ok
} {1 {unable to set MEMDB content} 1}

do_test doltlite_recover_rawformat_3-15.7 {
  execsql {
    CREATE TABLE gc1(a INT PRIMARY KEY, b AS (a*3));
    REPLACE INTO gc1(a) VALUES(9);
    SELECT a, b FROM gc1;
  }
} {9 27}

finish_test
