set testdir [file dirname $argv0]
source $testdir/tester.tcl
source $testdir/lock_common.tcl



do_test doltlite_recover_jrnlwal_2-1.1 {
  execsql {PRAGMA journal_mode}
} {wal}
do_test doltlite_recover_jrnlwal_2-1.2 {
  execsql {PRAGMA journal_mode=WAL}
} {wal}
do_catchsql_test doltlite_recover_jrnlwal_2-1.3 {
  PRAGMA journal_mode=delete
} {0 wal}
do_test doltlite_recover_jrnlwal_2-1.4 {
  execsql {PRAGMA wal_checkpoint}
} {0 0 0}
do_test doltlite_recover_jrnlwal_2-1.5 {
  execsql {PRAGMA main.wal_checkpoint}
} {0 0 0}
do_catchsql_test doltlite_recover_jrnlwal_2-1.6 {
  PRAGMA wal_checkpoint=full
} {1 {wal_checkpoint mode is not configurable on doltlite-format databases; use the default (PASSIVE) form}}
do_catchsql_test doltlite_recover_jrnlwal_2-1.7 {
  PRAGMA wal_checkpoint=restart
} {1 {wal_checkpoint mode is not configurable on doltlite-format databases; use the default (PASSIVE) form}}
do_catchsql_test doltlite_recover_jrnlwal_2-1.8 {
  PRAGMA wal_checkpoint=truncate
} {1 {wal_checkpoint mode is not configurable on doltlite-format databases; use the default (PASSIVE) form}}
do_test doltlite_recover_jrnlwal_2-1.9 {
  execsql {PRAGMA wal_checkpoint=typo}
} {0 0 0}
do_test doltlite_recover_jrnlwal_2-1.10 {
  execsql {PRAGMA wal_autocheckpoint}
} {1000}
do_test doltlite_recover_jrnlwal_2-1.11 {
  execsql {PRAGMA wal_autocheckpoint=10}
} {10}
do_test doltlite_recover_jrnlwal_2-1.12 {
  execsql {PRAGMA wal_autocheckpoint}
} {10}
do_test doltlite_recover_jrnlwal_2-1.13 {
  execsql {PRAGMA journal_size_limit}
} {-1}
do_test doltlite_recover_jrnlwal_2-1.14 {
  execsql {PRAGMA journal_size_limit=25000}
} {-1}
do_test doltlite_recover_jrnlwal_2-1.15 {
  execsql {
    CREATE TABLE t1(x INTEGER PRIMARY KEY, y);
    INSERT INTO t1 VALUES(1, zeroblob(1200));
    INSERT INTO t1 VALUES(2, zeroblob(1200));
    INSERT INTO t1 VALUES(3, zeroblob(1200));
  }
  list [file exists test.db-wal] [file exists test.db-journal]
} {0 0}

do_test doltlite_recover_jrnlwal_2-2.1 {
  sqlite3_wal_checkpoint_v2 db passive
} {0 0 0}
do_test doltlite_recover_jrnlwal_2-2.2 {
  sqlite3_wal_checkpoint_v2 db full
} {0 0 0}
do_test doltlite_recover_jrnlwal_2-2.3 {
  sqlite3_wal_checkpoint_v2 db restart
} {0 0 0}
do_test doltlite_recover_jrnlwal_2-2.4 {
  sqlite3_wal_checkpoint_v2 db truncate
} {0 0 0}
do_test doltlite_recover_jrnlwal_2-2.5 {
  sqlite3_wal_checkpoint_v2 db passive main
} {0 0 0}

do_test doltlite_recover_jrnlwal_2-3.1 {
  sqlite3 db2 test.db
  execsql {BEGIN; SELECT x FROM t1 ORDER BY x} db2
} {1 2 3}
do_test doltlite_recover_jrnlwal_2-3.2 {
  execsql {INSERT INTO t1 VALUES(4, zeroblob(1200))}
  execsql {PRAGMA wal_checkpoint}
} {0 0 0}
do_test doltlite_recover_jrnlwal_2-3.3 {
  execsql {SELECT x FROM t1 ORDER BY x} db2
} {1 2 3}
do_test doltlite_recover_jrnlwal_2-3.4 {
  execsql {COMMIT} db2
  execsql {SELECT x FROM t1 ORDER BY x} db2
} {1 2 3 4}
do_test doltlite_recover_jrnlwal_2-3.5 {
  sqlite3 db3 test.db
  execsql {BEGIN; INSERT INTO t1 VALUES(99, zeroblob(10))} db3
  execsql {ROLLBACK} db3
  execsql {SELECT x FROM t1 ORDER BY x} db3
} {1 2 3 4}
do_test doltlite_recover_jrnlwal_2-3.6 {
  execsql {
    INSERT INTO t1 VALUES(5, zeroblob(1200));
    INSERT INTO t1 VALUES(6, zeroblob(1200));
  }
  db close
  db2 close
  db3 close
  sqlite3 db test.db
  execsql {SELECT x FROM t1 ORDER BY x}
} {1 2 3 4 5 6}
do_test doltlite_recover_jrnlwal_2-3.7 {
  execsql {PRAGMA integrity_check}
} {ok}

do_test doltlite_recover_jrnlwal_2-4.1 {
  sqlite3 db2 test.db
  execsql {BEGIN; INSERT INTO t1 VALUES(7, zeroblob(10))} db2
} {}
do_test doltlite_recover_jrnlwal_2-4.2 {
  catchsql {INSERT INTO t1 VALUES(8, zeroblob(10))}
} {1 {database is locked}}
do_test doltlite_recover_jrnlwal_2-4.3 {
  execsql {PRAGMA wal_checkpoint}
} {1 0 0}
do_test doltlite_recover_jrnlwal_2-4.4 {
  execsql {COMMIT} db2
  execsql {INSERT INTO t1 VALUES(8, zeroblob(10))}
  execsql {SELECT x FROM t1 ORDER BY x}
} {1 2 3 4 5 6 7 8}
do_test doltlite_recover_jrnlwal_2-4.5 {
  execsql {SELECT x FROM t1 ORDER BY x} db2
} {1 2 3 4 5 6 7 8}
do_test doltlite_recover_jrnlwal_2-4.6 {
  db2 close
  execsql {PRAGMA integrity_check}
} {ok}

do_test doltlite_recover_jrnlwal_2-5.1 {
  forcedelete test.db2jw2
  execsql {
    ATTACH 'test.db2jw2' AS aux;
    CREATE TABLE aux.t2(a, b);
    INSERT INTO aux.t2 VALUES(1, 2);
    INSERT INTO aux.t2 VALUES(3, 4);
  }
  execsql {PRAGMA wal_checkpoint}
} {0 0 0}
do_test doltlite_recover_jrnlwal_2-5.2 {
  execsql {PRAGMA aux.wal_checkpoint}
} {0 0 0}
do_test doltlite_recover_jrnlwal_2-5.3 {
  sqlite3 db2 test.db
  execsql {PRAGMA journal_mode} db2
} {wal}
do_test doltlite_recover_jrnlwal_2-5.4 {
  execsql {PRAGMA wal_checkpoint} db2
} {0 0 0}
do_test doltlite_recover_jrnlwal_2-5.5 {
  db2 close
  db close
  sqlite3 db test.db
  execsql {ATTACH 'test.db2jw2' AS aux}
  list [execsql {SELECT a FROM aux.t2 ORDER BY a}] \
       [execsql {SELECT count(*) FROM t1}] \
       [file exists test.db2jw2-wal]
} {{1 3} 8 0}
do_test doltlite_recover_jrnlwal_2-5.6 {
  execsql {DETACH aux}
} {}

do_test doltlite_recover_jrnlwal_2-6.1 {
  execsql {PRAGMA wal_checkpoint}
  sqlite3 db2 test.db
  execsql {SELECT x FROM t1 ORDER BY x} db2
} {1 2 3 4 5 6 7 8}
do_test doltlite_recover_jrnlwal_2-6.2 {
  execsql {INSERT INTO t1 VALUES(9, 'b')} db2
  execsql {SELECT count(*) FROM t1}
} {9}
do_test doltlite_recover_jrnlwal_2-6.3 {
  db2 close
  file exists test.db-wal
} {0}

set ::wal_hook [list]
proc wal_hook_proc {zDb nEntry} { lappend ::wal_hook $zDb $nEntry ; return 0 }
do_test doltlite_recover_jrnlwal_2-7.1 {
  db wal_hook wal_hook_proc
  execsql {
    CREATE TABLE h1(i INTEGER PRIMARY KEY, j);
    INSERT INTO h1 VALUES(1, 'one');
    INSERT INTO h1 VALUES(2, 'two');
  }
  set ::wal_hook
} {}
do_test doltlite_recover_jrnlwal_2-7.2 {
  execsql {PRAGMA wal_autocheckpoint=10}
} {10}
do_test doltlite_recover_jrnlwal_2-7.3 {
  execsql {CREATE TABLE h4(x INTEGER PRIMARY KEY, y)}
  foreach {k v} {1 one 2 two 3 three 4 four 5 five} {
    db eval {INSERT INTO h4 VALUES($k, $v)}
  }
  execsql {SELECT x, y FROM h4 ORDER BY x}
} {1 one 2 two 3 three 4 four 5 five}
do_test doltlite_recover_jrnlwal_2-7.4 {
  db close
  sqlite3 db test.db
  execsql {SELECT j FROM h1 ORDER BY i}
} {one two}
do_test doltlite_recover_jrnlwal_2-7.5 {
  execsql {SELECT count(*) FROM h4}
} {5}

do_test doltlite_recover_jrnlwal_2-8.1 {
  execsql {
    CREATE TABLE c1(x INTEGER PRIMARY KEY, y, z);
    INSERT INTO c1 VALUES(1, 2, 3);
  }
  file exists test.db-wal
} {0}
do_test doltlite_recover_jrnlwal_2-8.2 {
  db close
  file exists test.db-wal
} {0}
do_test doltlite_recover_jrnlwal_2-8.3 {
  sqlite3 db test.db
  execsql {
    INSERT INTO c1 VALUES(4, 5, 6);
    INSERT INTO c1 VALUES(7, 8, 9);
  }
  sqlite3_db_config db NO_CKPT_ON_CLOSE 1
} {1}
do_test doltlite_recover_jrnlwal_2-8.4 {
  db close
  sqlite3 db test.db
  execsql {SELECT x, y, z FROM c1 ORDER BY x}
} {1 2 3 4 5 6 7 8 9}
do_catchsql_test doltlite_recover_jrnlwal_2-8.5 {
  PRAGMA main.journal_mode = delete
} {0 wal}
do_test doltlite_recover_jrnlwal_2-8.6 {
  execsql {PRAGMA main.journal_mode}
} {wal}
do_test doltlite_recover_jrnlwal_2-8.7 {
  execsql {
    CREATE TABLE y1(a PRIMARY KEY, b UNIQUE, c);
    INSERT INTO y1 VALUES('a', 'b', 'c');
    INSERT INTO y1 VALUES('d', 'e', 'f');
  }
  sqlite3 db2 test.db
  execsql {BEGIN; SELECT a, b, c FROM y1 ORDER BY a} db2
} {a b c d e f}
do_test doltlite_recover_jrnlwal_2-8.8 {
  execsql {
    UPDATE y1 SET c='g' WHERE a='d';
    PRAGMA wal_checkpoint;
  }
} {0 0 0}
do_test doltlite_recover_jrnlwal_2-8.9 {
  execsql {COMMIT} db2
  db2 close
  sqlite3 db3 test.db
  set res [execsql {
    PRAGMA integrity_check;
    SELECT a, b, c FROM y1 ORDER BY a;
  } db3]
  db3 close
  set res
} {ok a b c d e g}

do_test doltlite_recover_jrnlwal_2-9.1 {
  db close
  forcedelete test.db
  sqlite3 db test.db
  execsql {
    PRAGMA journal_size_limit=25000;
    PRAGMA journal_mode=WAL;
    PRAGMA wal_autocheckpoint=50;
    PRAGMA journal_size_limit=0;
  }
} {-1 wal 50 -1}
do_test doltlite_recover_jrnlwal_2-9.2 {
  execsql {
    CREATE TABLE t1(x, y UNIQUE);
    INSERT INTO t1 VALUES(1, 2);
    INSERT INTO t1 VALUES(zeroblob(200000), 4);
    CREATE TABLE t2(z);
    DELETE FROM t1;
    INSERT INTO t2 SELECT x FROM t1;
    INSERT INTO t2 VALUES('hi');
    SELECT count(*), z FROM t2;
  }
} {1 hi}
do_test doltlite_recover_jrnlwal_2-9.3 {
  execsql {PRAGMA wal_checkpoint}
} {0 0 0}
do_test doltlite_recover_jrnlwal_2-9.4 {
  file exists test.db-wal
} {0}
do_test doltlite_recover_jrnlwal_2-9.5 {
  db close
  sqlite3 db test.db
  execsql {SELECT count(*) FROM t1; SELECT z FROM t2}
} {0 hi}

do_test doltlite_recover_jrnlwal_2-10.1 {
  execsql {
    CREATE TABLE j1(a, b, c);
    INSERT INTO j1 VALUES(1, 2, 3);
    BEGIN;
    INSERT INTO j1 VALUES(4, 5, 6);
  }
  forcecopy test.db test.db4jw2
  execsql {COMMIT}
  file exists test.db-journal
} {0}
do_test doltlite_recover_jrnlwal_2-10.2 {
  sqlite3 db2 test.db4jw2
  set res [execsql {
    PRAGMA integrity_check;
    SELECT a, b, c FROM j1 ORDER BY a;
  } db2]
  db2 close
  set res
} {ok 1 2 3}
do_test doltlite_recover_jrnlwal_2-10.3 {
  execsql {SELECT a, b, c FROM j1 ORDER BY a}
} {1 2 3 4 5 6}

do_test doltlite_recover_jrnlwal_2-11.1 {
  execsql {
    CREATE TABLE t4(a PRIMARY KEY, b);
    INSERT INTO t4 VALUES('xyz', 1);
  }
  forcecopy test.db test.db3jw2
  sqlite3 db2 test.db3jw2
  set res [execsql {
    SELECT a FROM t4 WHERE a = 'xyz';
    PRAGMA integrity_check;
  } db2]
  db2 close
  set res
} {xyz ok}

do_test doltlite_recover_jrnlwal_2-12.1 {
  execsql {CREATE TABLE wt1(w int, x int, y int)}
  for {set i 1} {$i<=100} {incr i} {
    set w $i
    set x [expr {int(log($i)/log(2))}]
    set y [expr {$i*$i + 2*$i + 1}]
    execsql "INSERT INTO wt1 VALUES($w,$x,$y)"
  }
  execsql { CREATE INDEX i1w ON wt1("w") }
  execsql {SELECT x, y, w FROM wt1 WHERE w=10}
} {3 121 10}
do_test doltlite_recover_jrnlwal_2-12.2 {
  lindex [execsql {EXPLAIN QUERY PLAN SELECT x, y, w FROM wt1 WHERE w=10}] 3
} {SEARCH wt1 USING INDEX i1w (w=?)}
do_test doltlite_recover_jrnlwal_2-12.3 {
  execsql {SELECT x, y, w FROM wt1 WHERE +w=10}
} {3 121 10}
do_test doltlite_recover_jrnlwal_2-12.4 {
  lindex [execsql {EXPLAIN QUERY PLAN SELECT x, y, w FROM wt1 WHERE +w=10}] 3
} {SCAN wt1}

do_test doltlite_recover_jrnlwal_2-13.1 {
  sqlite3 dbm :memory:
  list [catchsql {PRAGMA auto_vacuum=INCREMENTAL} dbm] \
       [execsql {PRAGMA auto_vacuum} dbm]
} {{0 {}} 0}
do_test doltlite_recover_jrnlwal_2-13.2 {
  catchsql {PRAGMA incremental_vacuum(4)} dbm
} {0 {}}
do_test doltlite_recover_jrnlwal_2-13.3 {
  execsql {
    CREATE TABLE v1(k INTEGER PRIMARY KEY, x);
    INSERT INTO v1(x) VALUES(zeroblob(900));
    INSERT INTO v1(x) VALUES(zeroblob(900));
    INSERT INTO v1(x) SELECT x FROM v1;
    INSERT INTO v1(x) SELECT x FROM v1;
    INSERT INTO v1(x) SELECT x FROM v1;
    INSERT INTO v1(x) SELECT x FROM v1;
    BEGIN;
    DELETE FROM v1 WHERE k%2;
    ROLLBACK;
    SELECT count(*) FROM v1;
    PRAGMA integrity_check;
  } dbm
} {32 ok}
do_test doltlite_recover_jrnlwal_2-13.4 {
  dbm close
  execsql {PRAGMA integrity_check}
} {ok}

do_test doltlite_recover_jrnlwal_2-14.1 {
  catch {db close}
  forcedelete jw_nohang.db .jw_nohang.db-lock jw_nohang.db-wal jw_nohang.db-shm
  sqlite3 db jw_nohang.db
  execsql {
    PRAGMA journal_mode = wal;
    CREATE TABLE wh(a, b);
    INSERT INTO wh VALUES(1, 2), (3, 4), (5, 6);
  }
  db close

  unset -nocomplain childDone
  testfixture_nb childDone {
    testvfs tvfs -fullshm 1
    sqlite3 db jw_nohang.db -vfs tvfs
    tvfs script wh_callback
    tvfs filter xRead
    set ::sawWalRead 0
    proc wh_callback {method file args} {
      if {[string match *-wal $file] || [string match *wal $file]} {
        set ::sawWalRead 1
        after 4000
      }
      return SQLITE_OK
    }
    set rows [db eval {SELECT * FROM wh ORDER BY a}]
    db close
    tvfs delete
    list $rows $::sawWalRead
  }

  testvfs tvfs -fullshm 1
  sqlite3 db jw_nohang.db -vfs tvfs
  set parentRows [db eval {SELECT * FROM wh ORDER BY a}]
  db close
  tvfs delete

  for {set i 0} {$i<200 && ![info exists childDone]} {incr i} {
    after 10 {set ::wh_tick 1}
    vwait ::wh_tick
    unset -nocomplain ::wh_tick
  }
  set childResult [expr {[info exists childDone] ? $childDone : "timeout"}]
  list $childResult $parentRows \
      [file exists jw_nohang.db-wal] [file exists jw_nohang.db-shm]
} {{{1 2 3 4 5 6} 0} {1 2 3 4 5 6} 0 0}

finish_test
