set testdir [file dirname $argv0]
source $testdir/tester.tcl


do_test doltlite_recover_jrnlwal_1-1.1 {
  execsql {PRAGMA journal_mode}
} {wal}
do_execsql_test doltlite_recover_jrnlwal_1-1.2 {
  PRAGMA journal_mode = memory
} {memory}
do_test doltlite_recover_jrnlwal_1-1.3 {
  execsql {PRAGMA journal_mode = wal}
} {wal}
do_test doltlite_recover_jrnlwal_1-1.4 {
  execsql { CREATE TABLE t1(a INTEGER PRIMARY KEY, b UNIQUE) }
} {}

set nRow [expr 2000]

do_test doltlite_recover_jrnlwal_1-1.5 {
  execsql {
    BEGIN;
      WITH s(i) AS (
        SELECT 1 UNION ALL SELECT i+1 FROM s WHERE i<$nRow
      )
      INSERT INTO t1 SELECT NULL, printf('R%07d%692s',i,'') FROM s;
    SELECT count(*), min(a), max(a), sum(length(b)) FROM t1;
  }
} {2000 1 2000 1400000}

for {set jj 200} {$jj <= 300} {incr jj} {
  set uprefix [format {U%06d-} $jj]

  do_test doltlite_recover_jrnlwal_1-2.$jj.1 {
    execsql {
      SAVEPOINT one;
        UPDATE t1 SET b=printf('U%06d-%06d%686s',$jj,a,'') WHERE a<=$jj;
      SELECT substr(b,1,8) FROM t1 WHERE a=1;
    }
  } $uprefix

  do_test doltlite_recover_jrnlwal_1-2.$jj.2 {
    execsql {
      SAVEPOINT two;
        UPDATE t1 SET b=printf('XCHANGED%692s','') WHERE a==1;
        SELECT substr(b,1,8) FROM t1 WHERE a=1;
      ROLLBACK TO two;
      RELEASE two;
      SELECT substr(b,1,8) FROM t1 WHERE a=1;
    }
  } [list XCHANGED $uprefix]

  do_test doltlite_recover_jrnlwal_1-2.$jj.3 {
    execsql {
      SAVEPOINT two;
        UPDATE t1 SET b=printf('XCHANGED%692s','') WHERE a==1;
        SELECT substr(b,1,8) FROM t1 WHERE a=1;
      ROLLBACK TO two;
      RELEASE two;
      SELECT substr(b,1,8) FROM t1 WHERE a=1;
    }
  } [list XCHANGED $uprefix]

  do_test doltlite_recover_jrnlwal_1-2.$jj.4 {
    execsql {
      PRAGMA integrity_check;
      ROLLBACK TO one;
      RELEASE one;
      SELECT substr(b,1,8) FROM t1 WHERE a=1;
    }
  } {ok R0000001}
}

do_test doltlite_recover_jrnlwal_1-3.1 {
  execsql {
    COMMIT;
    SELECT count(*), sum(length(b)) FROM t1;
  }
} {2000 1400000}
do_test doltlite_recover_jrnlwal_1-3.2 {
  execsql { SELECT substr(b,1,8) FROM t1 WHERE a=1 }
} {R0000001}
do_test doltlite_recover_jrnlwal_1-3.3 {
  execsql {PRAGMA integrity_check}
} {ok}
do_test doltlite_recover_jrnlwal_1-3.4 {
  set h1 [execsql {SELECT dolt_hashof_table('t1')}]
  db close
  sqlite3 db test.db
  set h2 [execsql {SELECT dolt_hashof_table('t1')}]
  list [expr {$h1 eq $h2}] [execsql {SELECT count(*), sum(length(b)) FROM t1}]
} {1 {2000 1400000}}
do_test doltlite_recover_jrnlwal_1-3.5 {
  execsql {PRAGMA integrity_check}
} {ok}

finish_test
