set testdir [file dirname $argv0]
source $testdir/tester.tcl


do_test doltlite_recover_rejections-1.1 {
  db close
  forcedelete test.db
  sqlite3 db test.db
  catchsql {
    CREATE TABLE Test (TestID int primary key);
    INSERT INTO Test VALUES (1);
    CREATE VIEW viewTest AS SELECT * FROM Test;

    BEGIN;
    CREATE TABLE tempTest (TestID int primary key, Test2 int NULL);
    INSERT INTO tempTest SELECT TestID, 1 FROM Test;
    DROP TABLE Test;
    CREATE TABLE Test(TestID int primary key, Test2 int NULL);
    INSERT INTO Test SELECT * FROM tempTest;
    DROP TABLE tempTest;
    COMMIT;
    VACUUM;
  }
} {0 {}}
do_test doltlite_recover_rejections-1.2 {
  catchsql {VACUUM}
} {0 {}}
do_test doltlite_recover_rejections-1.3 {
  execsql {SELECT TestID, Test2 FROM Test ORDER BY TestID}
} {1 1}
do_test doltlite_recover_rejections-1.4 {
  execsql {SELECT TestID, Test2 FROM viewTest ORDER BY TestID}
} {1 1}
do_test doltlite_recover_rejections-1.5 {
  db close
  sqlite3 db test.db
  list [execsql {SELECT TestID, Test2 FROM Test ORDER BY TestID}] \
       [execsql {PRAGMA integrity_check}]
} {{1 1} ok}

do_test doltlite_recover_rejections-2.1 {
  execsql {
    CREATE TABLE t1(a INTEGER PRIMARY KEY, b TEXT);
    WITH RECURSIVE c(x) AS (VALUES(1) UNION ALL SELECT x+1 FROM c WHERE x<16)
    INSERT INTO t1 SELECT x, printf('row-%02d', x) FROM c;
    SELECT count(*) FROM t1;
  }
} {16}
do_test doltlite_recover_rejections-2.2 {
  set rows {}
  set vres {}
  db eval {SELECT a FROM t1 ORDER BY a} {
    if {$a == 8} { set vres [catchsql VACUUM] }
    lappend rows $a
  }
  list $rows $vres
} {{1 2 3 4 5 6 7 8 9 10 11 12 13 14 15 16} {0 {}}}
do_test doltlite_recover_rejections-2.3 {
  list [catch {
    db eval {SELECT 1, 2, 3} { execsql VACUUM }
  } msg] $msg
} {0 {}}
do_test doltlite_recover_rejections-2.4 {
  set res {}
  set res2 {}
  db eval {SELECT a, b FROM t1 WHERE a<=10 ORDER BY a} {
    if {$a==6} { set res [catchsql VACUUM] }
    lappend res2 $a
  }
  lappend res2 $res
} {1 2 3 4 5 6 7 8 9 10 {0 {}}}
do_test doltlite_recover_rejections-2.5 {
  list [execsql {SELECT count(*), min(a), max(a) FROM t1}] \
       [execsql {PRAGMA integrity_check}]
} {{16 1 16} ok}

do_test doltlite_recover_rejections-3.0 {
  db close
  forcedelete test.db
  sqlite3 db test.db
  execsql {
    CREATE TABLE abc(a PRIMARY KEY, b, c);
    WITH RECURSIVE n(x) AS (VALUES(1) UNION ALL SELECT x+1 FROM n WHERE x<48)
    INSERT INTO abc
      SELECT printf('key-%03d', x),
             zeroblob(200 + (x%7)*100),
             printf('%.*c', 500 + (x%5)*900, 'z')
      FROM n;
    SELECT count(*) FROM abc;
  }
} {48}

set ::sig3 [execsql {SELECT dolt_hashof_table('abc')}]
set tn 0
foreach psz {1024 2048 4096 8192} {
  incr tn
  do_test doltlite_recover_rejections-3.$tn.1 {
    execsql "PRAGMA page_size = $psz"
    catchsql {VACUUM}
  } {0 {}}
  do_test doltlite_recover_rejections-3.$tn.2 {
    db close
    sqlite3 db test.db
    list [string equal $::sig3 [execsql {SELECT dolt_hashof_table('abc')}]] \
         [execsql {SELECT count(*) FROM abc}] \
         [execsql {PRAGMA integrity_check}]
  } {1 48 ok}
}

do_test doltlite_recover_rejections-3.5 {
  execsql {
    CREATE TABLE t2(a, b, UNIQUE(a, b));
    WITH RECURSIVE n(x) AS (VALUES(1) UNION ALL SELECT x+1 FROM n WHERE x<64)
    INSERT INTO t2 SELECT printf('a%03d', x), printf('b%03d', x) FROM n;
    DELETE FROM t2 WHERE rowid%2;
    SELECT count(*) FROM t2;
  }
} {32}
set ::sig3b [execsql {SELECT dolt_hashof_table('t2')}]
for {set i 1} {$i <= 5} {incr i} {
  do_test doltlite_recover_rejections-3.6.$i {
    set v [catchsql {VACUUM}]
    db close
    sqlite3 db test.db
    list $v \
         [string equal $::sig3b [execsql {SELECT dolt_hashof_table('t2')}]] \
         [execsql {PRAGMA integrity_check}]
  } {{0 {}} 1 ok}
}
do_test doltlite_recover_rejections-3.7 {
  execsql {SELECT a, b FROM t2 WHERE rowid<=4 ORDER BY a}
} {a002 b002 a004 b004}

do_test doltlite_recover_rejections-4.1 {
  sqlite3 dbm {}
  list [catch {dbm deserialize [decode_hexdb {
    .open --hexdb
    | size 4096 pagesize 4096 filename x.db
    | page 1 offset 0
    |      0: 53 51 4c 69 74 65 20 66 6f 72 6d 61 74 20 33 00   SQLite format 3.
    | end x.db
  }]} msg] $msg
} {1 {unable to set MEMDB content}}
do_test doltlite_recover_rejections-4.2 {
  set res [dbm eval {
    CREATE TABLE z(a INTEGER PRIMARY KEY, b TEXT);
    INSERT INTO z VALUES(5,'five');
    SELECT a, b FROM z ORDER BY a;
  }]
  dbm close
  set res
} {5 five}

do_test doltlite_recover_rejections-5.0 {
  db close
  forcedelete test.db
  forcedelete out.db
  forcedelete out2.db
  forcedelete test.db2
  sqlite3 db test.db
  execsql {
    CREATE TABLE t1(
      a INTEGER PRIMARY KEY,
      b ANY,
      c INT AS (b+1),
      CHECK( typeof(b)!='integer' OR b>a-5 )
    );
    WITH RECURSIVE c(x) AS (VALUES(1) UNION ALL SELECT x+1 FROM c WHERE x<100)
    INSERT INTO t1(a,b) SELECT x, zeroblob(600) FROM c;
    CREATE INDEX t1b ON t1(b);
    DELETE FROM t1 WHERE a%2;
    SELECT count(*), sum(a), sum(length(b)) FROM t1;
  }
} {50 2550 30000}
set ::sig5 [execsql {SELECT dolt_hashof_table('t1')}]

do_catchsql_test doltlite_recover_rejections-5.1 {
  VACUUM main INTO 'out.db';
} {1 {VACUUM INTO is not supported for doltlite databases}}
do_test doltlite_recover_rejections-5.2 {
  file exists out.db
} {0}
do_catchsql_test doltlite_recover_rejections-5.3 {
  VACUUM INTO 'out.db';
} {1 {VACUUM INTO is not supported for doltlite databases}}
do_test doltlite_recover_rejections-5.4 {
  list [catchsql {VACUUM INTO 'out2.db'}] \
       [catchsql {VACUUM INTO 'out2.db'}] \
       [file exists out2.db]
} {{1 {VACUUM INTO is not supported for doltlite databases}} {1 {VACUUM INTO is not supported for doltlite databases}} 0}
do_catchsql_test doltlite_recover_rejections-5.5 {
  VACUUM main INTO ':memory:';
} {1 {VACUUM INTO is not supported for doltlite databases}}
do_test doltlite_recover_rejections-5.6 {
  execsql {
    CREATE TABLE t2(name TEXT);
    INSERT INTO t2 VALUES(':memory:');
  }
  catchsql {VACUUM main INTO (SELECT name FROM t2)}
} {1 {VACUUM INTO is not supported for doltlite databases}}
do_catchsql_test doltlite_recover_rejections-5.7 {
  VACUUM INTO null;
} {1 {VACUUM INTO is not supported for doltlite databases}}
do_test doltlite_recover_rejections-5.8 {
  db func target target
  proc target {} { return "test.db2" }
  list [catchsql {VACUUM INTO target()}] [file exists test.db2]
} {{1 {VACUUM INTO is not supported for doltlite databases}} 0}
do_test doltlite_recover_rejections-5.9 {
  list [string equal $::sig5 [execsql {SELECT dolt_hashof_table('t1')}]] \
       [execsql {SELECT count(*), sum(a), sum(length(b)) FROM t1}]
} {1 {50 2550 30000}}
do_test doltlite_recover_rejections-5.10 {
  execsql {SELECT name FROM sqlite_master WHERE name IN ('t1','t1b','t2') ORDER BY 1}
} {t1 t1b t2}
do_test doltlite_recover_rejections-5.11 {
  execsql {PRAGMA page_size=1024}
  list [catchsql {VACUUM INTO 'test.db2'}] [file exists test.db2]
} {{1 {VACUUM INTO is not supported for doltlite databases}} 0}

set tn 0
foreach pragma {
  {PRAGMA synchronous = normal}
  {PRAGMA synchronous = full}
  {PRAGMA synchronous = off}
  {PRAGMA synchronous = extra}
  {PRAGMA fullfsync = 1; PRAGMA synchronous = full}
} {
  incr tn
  do_test doltlite_recover_rejections-5.12.$tn {
    forcedelete test.db2
    db eval $pragma
    list [catchsql {VACUUM INTO 'test.db2'}] \
         [file exists test.db2] \
         [string equal $::sig5 [execsql {SELECT dolt_hashof_table('t1')}]]
  } {{1 {VACUUM INTO is not supported for doltlite databases}} 0 1}
}

do_test doltlite_recover_rejections-5.13 {
  db close
  sqlite3 db test.db
  catchsql {VACUUM INTO 'out.db'}
} {1 {VACUUM INTO is not supported for doltlite databases}}
do_test doltlite_recover_rejections-5.14 {
  execsql {
    INSERT INTO t1(a,b) VALUES(101, 200);
  }
  list [execsql {SELECT count(*) FROM t1}] \
       [execsql {SELECT b, c FROM t1 WHERE a=101}] \
       [execsql {PRAGMA integrity_check}]
} {51 {200 201} ok}

finish_test
