set testdir [file dirname $argv0]
source $testdir/tester.tcl


do_test doltlite_recover_pragma_output-1.1 {
  execsql {
    PRAGMA default_cache_size=-123;
    PRAGMA cache_size;
    PRAGMA default_cache_size;
    PRAGMA synchronous;
  }
} {123 123 2}
do_test doltlite_recover_pragma_output-1.2 {
  execsql {
    VACUUM;
    PRAGMA cache_size;
    PRAGMA default_cache_size;
    PRAGMA synchronous;
  }
} {123 123 2}
do_test doltlite_recover_pragma_output-1.3 {
  execsql {
    PRAGMA synchronous=NORMAL;
    PRAGMA cache_size;
    PRAGMA default_cache_size;
    PRAGMA synchronous;
  }
} {123 123 1}
do_test doltlite_recover_pragma_output-1.4 {
  execsql {
    PRAGMA synchronous=EXTRA;
    PRAGMA synchronous;
  }
} {3}
do_test doltlite_recover_pragma_output-1.5 {
  execsql {
    PRAGMA synchronous=FULL;
    PRAGMA synchronous;
  }
} {2}
do_test doltlite_recover_pragma_output-1.6 {
  db close
  sqlite3 db test.db
  execsql {
    PRAGMA cache_size;
    PRAGMA default_cache_size;
    PRAGMA synchronous;
  }
} {-2000 -2000 2}
do_test doltlite_recover_pragma_output-1.7 {
  execsql {
    PRAGMA default_cache_size=-500;
    PRAGMA default_cache_size;
  }
} {500}
do_test doltlite_recover_pragma_output-1.8 {
  forcedelete test2.db
  execsql {
    ATTACH 'test2.db' AS aux;
    PRAGMA aux.default_cache_size=456;
    PRAGMA aux.cache_size;
    PRAGMA aux.default_cache_size;
  }
} {456 456}
do_test doltlite_recover_pragma_output-1.9 {
  execsql {
    DETACH aux;
    ATTACH 'test2.db' AS aux;
    PRAGMA aux.cache_size;
    PRAGMA aux.default_cache_size;
  }
} {-2000 -2000}
execsql {DETACH aux}

do_test doltlite_recover_pragma_output-2.1 {
  execsql {
    CREATE TABLE t2(a,b,c);
    CREATE INDEX i2 ON t2(a);
    INSERT INTO t2 VALUES(11,2,3);
    INSERT INTO t2 VALUES(22,3,4);
    PRAGMA integrity_check;
  }
} {ok}
do_test doltlite_recover_pragma_output-2.2 {
  execsql {PRAGMA integrity_check=1}
} {ok}
do_catchsql_test doltlite_recover_pragma_output-2.3 {
  PRAGMA integrity_check='4'
} {1 {no such table: 4}}
do_catchsql_test doltlite_recover_pragma_output-2.4 {
  PRAGMA integrity_check=xyz
} {1 {no such table: xyz}}
do_test doltlite_recover_pragma_output-2.5 {
  execsql {PRAGMA integrity_check=t2}
} {ok}
do_test doltlite_recover_pragma_output-2.6 {
  execsql {PRAGMA integrity_check=sqlite_schema}
} {ok}
do_test doltlite_recover_pragma_output-2.7 {
  execsql {PRAGMA integrity_check=0}
} {ok}
do_test doltlite_recover_pragma_output-2.8 {
  execsql {PRAGMA integrity_check=4}
} {ok}
do_test doltlite_recover_pragma_output-2.9 {
  execsql {
    ATTACH DATABASE 'test.db' AS t2x;
    PRAGMA integrity_check;
  }
} {ok}
do_test doltlite_recover_pragma_output-2.9b {
  execsql {SELECT a FROM t2x.t2 ORDER BY a}
} {11 22}
do_test doltlite_recover_pragma_output-2.10 {
  execsql {
    DETACH t2x;
    REINDEX t2;
  }
  list [execsql {PRAGMA integrity_check}] \
       [execsql {PRAGMA quick_check}] \
       [execsql {PRAGMA QUICK_CHECK}]
} {ok ok ok}
do_test doltlite_recover_pragma_output-2.11 {
  forcedelete testdup.db
  sqlite3 dbdup testdup.db
  execsql {
    CREATE TABLE t2(a,b,c);
    CREATE INDEX i2 ON t2(a);
    INSERT INTO t2 VALUES(11,2,3);
    INSERT INTO t2 VALUES(22,3,4);
  } dbdup
  dbdup close
  execsql {
    ATTACH 'testdup.db' AS aux;
    PRAGMA integrity_check;
  }
} {ok}
do_test doltlite_recover_pragma_output-2.12 {
  execsql {PRAGMA aux.integrity_check=t2}
} {ok}
do_catchsql_test doltlite_recover_pragma_output-2.12b {
  PRAGMA aux.integrity_check=nosuch
} {1 {no such table: aux.nosuch}}
do_test doltlite_recover_pragma_output-2.13 {
  execsql {PRAGMA aux.integrity_check=sqlite_schema}
} {ok}
do_test doltlite_recover_pragma_output-2.14 {
  execsql {ATTACH 'testdup.db' AS aux2}
  list [execsql {PRAGMA integrity_check=1}] \
       [execsql {PRAGMA integrity_check=5}] \
       [execsql {PRAGMA integrity_check=4}] \
       [execsql {PRAGMA integrity_check=3}] \
       [execsql {PRAGMA integrity_check(2)}] \
       [execsql {PRAGMA integrity_check(10)}] \
       [execsql {PRAGMA integrity_check=8}] \
       [execsql {PRAGMA integrity_check=4}]
} {ok ok ok ok ok ok ok ok}
execsql {DETACH aux2; DETACH aux}

do_test doltlite_recover_pragma_output-3.1 {
  forcedelete testerr.db
  forcecopy testdup.db testerr.db
  hexio_write testerr.db 0 [string repeat aa 32]
  set rc [catch {sqlite3 dberr testerr.db} msg]
  catch {dberr close}
  list $rc $msg
} {1 {file is not a database}}
do_catchsql_test doltlite_recover_pragma_output-3.2 {
  ATTACH 'testerr.db' AS bad
} {1 {unable to open database: testerr.db}}
do_test doltlite_recover_pragma_output-3.2b {
  execsql {
    PRAGMA integrity_check;
    SELECT count(*) FROM t2;
  }
} {ok 2}
do_test doltlite_recover_pragma_output-3.3 {
  execsql {ATTACH 'testdup.db' AS aux}
  list [execsql {PRAGMA main.integrity_check}] \
       [execsql {PRAGMA aux.integrity_check}]
} {ok ok}
execsql {DETACH aux}

db nullvalue <<NULL>>
do_test doltlite_recover_pragma_output-4.1 {
  execsql {
    CREATE TABLE t5(
      a TEXT DEFAULT CURRENT_TIMESTAMP,
      b DEFAULT (5+3),
      c TEXT,
      d INTEGER DEFAULT NULL,
      e TEXT DEFAULT '',
      UNIQUE(b,c,d),
      PRIMARY KEY(e,b,c)
    );
    PRAGMA table_info(t5);
  }
} {0 a TEXT 0 CURRENT_TIMESTAMP 0 1 b {} 1 5+3 2 2 c TEXT 1 <<NULL>> 3 3 d INTEGER 0 NULL 0 4 e TEXT 1 '' 1}
db nullvalue {}
do_test doltlite_recover_pragma_output-4.2 {
  execsql {
    CREATE TABLE t68(a,b,c,PRIMARY KEY(a,b,a,c));
    PRAGMA table_info(t68);
  }
} {0 a {} 1 {} 1 1 b {} 1 {} 2 2 c {} 1 {} 3}

do_test doltlite_recover_pragma_output-5.1 {
  set ::sv0 [execsql {PRAGMA schema_version}]
  list [string is integer -strict $::sv0] \
       [expr {[execsql {PRAGMA schema_version}] == $::sv0}]
} {1 1}
do_test doltlite_recover_pragma_output-5.2 {
  execsql {PRAGMA schema_version=105}
  execsql {PRAGMA schema_version}
} {105}
do_test doltlite_recover_pragma_output-5.3 {
  execsql {
    CREATE TABLE t4(a,b,c);
    INSERT INTO t4 VALUES(1,2,3);
  }
  set ::sv1 [execsql {PRAGMA schema_version}]
  expr {$::sv1 != $::sv0}
} {1}
do_test doltlite_recover_pragma_output-5.4 {
  sqlite3 db2 test.db
  set ::DB2 [sqlite3_connection_pointer db2]
  execsql {SELECT * FROM t4} db2
  set ::STMT [sqlite3_prepare $::DB2 "SELECT * FROM t4" -1 DUMMY]
  execsql {ALTER TABLE t4 ADD COLUMN d DEFAULT 9}
  set step [sqlite3_step $::STMT]
  set fin [sqlite3_finalize $::STMT]
  list $step $fin
} {SQLITE_ERROR SQLITE_SCHEMA}
do_test doltlite_recover_pragma_output-5.4b {
  execsql {SELECT * FROM t4} db2
} {1 2 3 9}
do_test doltlite_recover_pragma_output-5.5 {
  forcedelete test2.db
  execsql {
    ATTACH 'test2.db' AS aux;
    CREATE TABLE aux.t1(a,b,c);
  }
  set ::auxsv [execsql {PRAGMA aux.schema_version}]
  execsql {PRAGMA aux.schema_version=205}
  list [string is integer -strict $::auxsv] \
       [execsql {PRAGMA aux.schema_version}]
} {1 205}
do_test doltlite_recover_pragma_output-5.6 {
  set svA [execsql {PRAGMA schema_version}]
  execsql {CREATE TABLE aux.t1b(x)}
  set svB [execsql {PRAGMA schema_version}]
  list [expr {$svA == $svB}] \
       [expr {[execsql {PRAGMA aux.schema_version}] != $::auxsv}]
} {1 1}
do_test doltlite_recover_pragma_output-5.7 {
  execsql {ATTACH 'test2.db' AS aux; SELECT * FROM aux.t1} db2
  set ::STMT [sqlite3_prepare $::DB2 "SELECT * FROM aux.t1" -1 DUMMY]
  execsql {ALTER TABLE aux.t1 ADD COLUMN d DEFAULT 7}
  set step [sqlite3_step $::STMT]
  set fin [sqlite3_finalize $::STMT]
  db2 close
  list $step $fin
} {SQLITE_ERROR SQLITE_SCHEMA}
do_test doltlite_recover_pragma_output-5.8 {
  set svA [execsql {PRAGMA schema_version}]
  execsql {PRAGMA user_version=2}
  set svB [execsql {PRAGMA schema_version}]
  execsql {VACUUM}
  set svC [execsql {PRAGMA schema_version}]
  list [expr {$svA == $svB}] [expr {$svA == $svC}] \
       [execsql {PRAGMA user_version}]
} {1 1 2}

do_test doltlite_recover_pragma_output-6.1 {
  execsql {
    PRAGMA aux.user_version;
    PRAGMA aux.user_version=3;
    PRAGMA aux.user_version;
    PRAGMA main.user_version;
  }
} {0 3 2}
do_test doltlite_recover_pragma_output-6.2 {
  execsql {
    BEGIN;
    PRAGMA aux.user_version=10;
    PRAGMA user_version=11;
    PRAGMA aux.user_version;
    PRAGMA main.user_version;
  }
} {10 11}
do_test doltlite_recover_pragma_output-6.3 {
  execsql {
    ROLLBACK;
    PRAGMA aux.user_version;
    PRAGMA main.user_version;
  }
} {3 2}
do_test doltlite_recover_pragma_output-6.4 {
  execsql {
    BEGIN;
    PRAGMA user_version=6;
    SAVEPOINT sp;
    PRAGMA user_version=10;
    ROLLBACK TO sp;
    PRAGMA user_version;
  }
} {6}
do_test doltlite_recover_pragma_output-6.5 {
  execsql {
    COMMIT;
    PRAGMA user_version;
  }
} {6}
do_test doltlite_recover_pragma_output-6.6 {
  execsql {DETACH aux}
  db close
  sqlite3 db test.db
  execsql {PRAGMA user_version}
} {6}

do_test doltlite_recover_pragma_output-7.1 {
  db close
  foreach f [glob -nocomplain testpc.db* testpc2.db*] {forcedelete $f}
  sqlite3 db testpc.db
  execsql {PRAGMA page_count; PRAGMA main.page_count}
} {4 4}
do_test doltlite_recover_pragma_output-7.2 {
  execsql {
    CREATE TABLE abc(a,b,c);
    PRAGMA page_count;
    PRAGMA main.page_count;
    PRAGMA temp.page_count;
  }
} {9 9 0}
do_test doltlite_recover_pragma_output-7.3 {
  execsql {pragma PAGE_COUNT}
} {9}
do_test doltlite_recover_pragma_output-7.4 {
  execsql {
    BEGIN;
    CREATE TABLE def(a,b,c);
    PRAGMA page_count;
  }
} {11}
do_test doltlite_recover_pragma_output-7.4b {
  execsql {pragma PAGE_COUNT}
} {11}
do_test doltlite_recover_pragma_output-7.5 {
  execsql {
    ROLLBACK;
    PRAGMA page_count;
  }
} {9}
do_test doltlite_recover_pragma_output-7.6 {
  execsql {PRAGMA page_size}
} {1024}
do_test doltlite_recover_pragma_output-7.7 {
  sqlite3 db2 testpc2.db
  execsql {
    CREATE TABLE t1(a,b,c);
    CREATE TABLE t2(a,b,c);
    CREATE TABLE t3(a,b,c);
    CREATE TABLE t4(a,b,c);
  } db2
  set want [execsql {PRAGMA page_count} db2]
  db2 close
  execsql {ATTACH 'testpc2.db' AS aux}
  list [expr {[execsql {PRAGMA aux.page_count}] == $want}] \
       [expr {[execsql {pragma AUX.PAGE_COUNT}] == $want}] \
       [expr {$want > 9}]
} {1 1 1}
execsql {DETACH aux}

do_test doltlite_recover_pragma_output-8.1 {
  list [catchsql {PRAGMA auto_vacuum=1}] [execsql {PRAGMA auto_vacuum}]
} {{0 {}} 0}
do_test doltlite_recover_pragma_output-8.2 {
  list [catchsql {PRAGMA auto_vacuum=2}] [execsql {PRAGMA auto_vacuum}]
} {{0 {}} 0}
do_test doltlite_recover_pragma_output-8.3a {
  list [catchsql {PRAGMA auto_vacuum=full}] [execsql {PRAGMA auto_vacuum}]
} {{0 {}} 0}
do_test doltlite_recover_pragma_output-8.3b {
  list [catchsql {PRAGMA auto_vacuum=FULL}] [execsql {PRAGMA auto_vacuum}]
} {{0 {}} 0}
do_test doltlite_recover_pragma_output-8.4a {
  list [catchsql {PRAGMA auto_vacuum=incremental}] [execsql {PRAGMA auto_vacuum}]
} {{0 {}} 0}
do_test doltlite_recover_pragma_output-8.4b {
  list [catchsql {PRAGMA auto_vacuum=INCREMENTAL}] [execsql {PRAGMA auto_vacuum}]
} {{0 {}} 0}
do_test doltlite_recover_pragma_output-8.5 {
  execsql {
    PRAGMA auto_vacuum=0;
    PRAGMA auto_vacuum=none;
    PRAGMA auto_vacuum;
    INSERT INTO abc VALUES(1,2,3);
    SELECT * FROM abc;
  }
} {0 1 2 3}

do_test doltlite_recover_pragma_output-9.1 {
  db close
  foreach f [glob -nocomplain testpc.db*] {forcedelete $f}
  sqlite3 db testpc.db
  sqlite3 db2 testpc.db
  execsql {SELECT count(*) FROM sqlite_master} db2
  execsql {
    CREATE TABLE t1(a INTEGER PRIMARY KEY,b,c,d);
    CREATE INDEX i1 ON t1(b,c);
    CREATE INDEX i2 ON t1(c,d);
    CREATE INDEX i2x ON t1(d COLLATE nocase, c DESC);
    CREATE INDEX i3 ON t1(d,b,c);
    CREATE TABLE t2(x INTEGER REFERENCES t1);
  }
  lsort [execsql {SELECT name FROM sqlite_master} db2]
} {i1 i2 i2x i3 t1 t2}
do_test doltlite_recover_pragma_output-9.2 {
  execsql {
    DROP INDEX i2;
    CREATE INDEX i2 ON t1(c,d,b);
    DROP INDEX IF EXISTS i3;
    CREATE INDEX i3 ON t1(d,b,c);
  }
  execsql {PRAGMA index_list(t1)} db2
} {0 i3 0 c 0 1 i2 0 c 0 2 i2x 0 c 0 3 i1 0 c 0}
do_test doltlite_recover_pragma_output-9.3 {
  execsql {PRAGMA index_info(i2)} db2
} {0 2 c 1 3 d 2 1 b}
db2 close

do_test doltlite_recover_pragma_output-10.1 {
  execsql {
    PRAGMA cache_size=2000;
    CREATE TABLE st(x,y);
    INSERT INTO st VALUES(zeroblob(1000000),1);
  }
  list [sqlite3_db_release_memory db] \
       [execsql {SELECT length(x), y FROM st}]
} {0 {1000000 1}}
do_test doltlite_recover_pragma_output-10.2 {
  execsql {
    UPDATE st SET y=y+1;
    SELECT length(x), y FROM st;
  }
} {1000000 2}
do_test doltlite_recover_pragma_output-10.3 {
  execsql {PRAGMA shrink_memory}
  execsql {
    SELECT length(x), y FROM st;
    PRAGMA integrity_check;
  }
} {1000000 2 ok}

do_test doltlite_recover_pragma_output-11.1 {
  set rc [catch {sqlite3 dbm mxt.db -vfs multiplex} msg]
  catch {dbm close}
  list $rc $msg
} {1 {no such vfs: multiplex}}
do_test doltlite_recover_pragma_output-11.2 {
  db close
  foreach f [glob -nocomplain testmx.db*] {forcedelete $f}
  sqlite3 db testmx.db
  execsql {
    CREATE TABLE t1(x);
    INSERT INTO t1(x) VALUES(zeroblob(250000));
  }
  db close
  list [lsort [glob -nocomplain testmx.db*]] \
       [glob -nocomplain {testmx.*[0-9][0-9][0-9]}]
} {testmx.db {}}
do_test doltlite_recover_pragma_output-11.3 {
  sqlite3 db testmx.db
  execsql {
    DELETE FROM t1;
    VACUUM;
  }
  db close
  set files [lsort [glob -nocomplain testmx.db*]]
  sqlite3 db testmx.db
  list $files [execsql {SELECT count(*) FROM t1}]
} {testmx.db 0}
do_test doltlite_recover_pragma_output-11.4 {
  list [execsql {PRAGMA multiplex_truncate}] \
       [execsql {PRAGMA multiplex_truncate=off}] \
       [execsql {PRAGMA multiplex_truncate=on}]
} {{} {} {}}

do_test doltlite_recover_pragma_output-12.1 {
  db close
  forcedelete test2686.db
  sqlite3 db test2686.db
  execsql {
    PRAGMA page_size=1024;
    PRAGMA max_page_count=50;
    PRAGMA auto_vacuum=0;
    CREATE TABLE filler(fill);
  }
  expr {[db one {PRAGMA max_page_count}]==50}
} {1}
do_test doltlite_recover_pragma_output-12.2 {
  set maxInsert 0
  for {set i 0} {$i<20} {incr i} {
    execsql BEGIN
    set nInsert 0
    set rc [catch {
      while 1 {
        execsql {INSERT INTO filler(fill) VALUES(randstr(1000,10000))}
        incr nInsert
      }
    } msg]
    if {$rc!=1 || $msg ne "database or disk is full"} {
      error "expected SQLITE_FULL, got rc=$rc msg=$msg"
    }
    if {$nInsert>$maxInsert} { set maxInsert $nInsert }
    execsql {
      DELETE FROM filler
       WHERE rowid <= (SELECT MAX(rowid) FROM filler LIMIT 20)
    }
    if {[execsql {PRAGMA integrity_check}] ne "ok"} {
      error "integrity_check failed"
    }
    catch {execsql COMMIT}
  }
  list [expr {$maxInsert>0}] \
       [expr {[file size test2686.db] < 50*1024*8}] \
       [execsql {SELECT count(*) FROM filler}] \
       [execsql {PRAGMA integrity_check}]
} {1 1 0 ok}

finish_test
